User-ID,ISBN,Book-Rating,Book-Title,Book-Author,Year-Of-Publication,Publisher
51971,373290608,7,"Hunter Of My Heart (Harlequin Historical, No. 460)",Janet Kendall,1999,Harlequin
51974,3442541751,8,Russendisko.,Wladimir Kaminer,2002,Goldmann
51974,3446203605,7,Die LÃ?Â¼gen der Frauen,Ljudmila Ulitzkaja,2003,Hanser
51974,349223643X,6,Der Traum des LeuchtturmwÃ?Â¤rters. Ein Ort fÃ?Â¼r deine SehnsÃ?Â¼chte.,Sergio Bambaren,2002,Piper
51975,140444254,10,"Three Theban Plays, The",Sophocles,2000,Penguin USA (Paper)
51977,043910274X,3,The Magic School Bus Gets a Bright Idea: A Book About Light (Magic School Bus),Nancy White,1999,Scholastic
51979,967415306,10,What if everything you thought you knew about AIDS was wrong?,Christine Maggiore,2000,American Foundation for AIDS Alternatives
51982,067081489X,8,Worlds End,T. Coraghessan Boyle,1987,Penguin Putnam~childrens Hc
51983,60930314,10,Identity: A Novel,Milan Kundera,1999,Perennial
51983,345391802,4,The Hitchhiker's Guide to the Galaxy,Douglas Adams,1995,Ballantine Books
51983,425156842,10,Sophie's World: A Novel About the History of Philosophy (Berkeley Signature Edition),Jostein Gaarder,1997,Berkley Publishing Group
51983,452280621,9,Beloved,Toni Morrison,1998,Plume Books
51983,684801221,7,OLD MAN AND THE SEA,Ernest Hemingway,1995,Scribner
51983,081120068X,10,Siddhartha,Hermann Hesse,1951,New Directions Publishing Corporation
51986,20446500,8,Z for Zachariah,Robert C. O'Brien,1987,Simon Pulse
51986,034530988X,10,Friday,Robert Heinlein,1988,Del Rey Books
51986,345422589,10,"Running With the Demon (The Word and the Void Trilogy, Book 1)",Terry Brooks,1998,Del Rey Books
51986,345424646,10,"A Knight of the Word (The Word and the Void Trilogy, Book 2)",Terry Brooks,1999,Del Rey Books
51986,345435257,10,"Angel Fire East (The Word and the Void Trilogy, Book 3)",Terry Brooks,2000,Del Rey Books
51987,316693235,8,Violets Are Blue,James Patterson,2001,"Little, Brown"
51987,399526137,5,Triumphs of the Heart: Miraculous True Stories of the Power of Love,Chris Benguhe,2000,Perigee Books
51988,385334672,9,His Bright Light : The Story of Nick Traina,DANIELLE STEEL,2000,Delta
51990,375411089,8,Skinny Dip,Carl Hiaasen,2004,Knopf
51990,039914675X,1,The Cat Who Went up the Creek,Lilian Jackson Braun,2002,Putnam Adult
51991,1550544683,10,Jade Peony,Wayson Choy,1995,Harpercollins Canada
51992,60930934,7,Wasted : A Memoir of Anorexia and Bulimia,Marya Hornbacher,1999,Perennial
51992,60934808,10,Dreamland : A Novel,Kevin Baker,2002,Perennial
51992,60976977,8,"Amazing Grace : Lives of Children and the Conscience of a Nation, The",Jonathan Kozol,1996,Perennial
51992,60977744,8,Crazy Ladies : A Novel,Michael Lee West,2000,Perennial
51992,70212570,9,Fried Green Tomatoes at the Whistle Stop Cafe,Fannie Flagg,1989,McGraw-Hill
51992,70497591,8,The emergence of society: A pre-history of the establishment,John E Pfeiffer,1977,McGraw-Hill
51992,015600531X,8,Blue Sky Dream: A Memoir of AMERICAN (AMERI)ca's Fall from Grace,David Beers,1997,Harvest Books
51992,156013908,7,The Honey Thief,Elizabeth Graver,2000,Harvest Books
51992,312195516,8,The Red Tent (Bestselling Backlist),Anita Diamant,1998,Picador USA
51992,312923074,8,Sudden Fury,Leslie Walker,1990,St Martins Pr
51992,312970684,10,Flat Lake in Winter,Joseph T. Klempner,2000,St. Martin's Press
51992,316569321,9,White Oleander : A Novel,Janet Fitch,1999,"Little, Brown"
51992,316929190,8,All Too Human : A Political Education,George Stephanopoulos,1999,"Little, Brown"
51992,034531221X,7,Lincoln,Gore Vidal,1985,Ballantine Books
51992,345370139,7,Hollywood: A Novel of America in the 1920's,Gore Vidal,1991,Ballantine Books
51992,345389247,8,Crazy in Alabama,Mark Childress,1994,Ballantine Books
51992,345434870,10,Eleanor of Aquitaine: A Life (Ballantine Reader's Circle),Alison Weir,2001,Ballantine Books
51992,345435028,7,What We Keep,Elizabeth Berg,2002,Ballantine Books
51992,037540256X,10,A Patchwork Planet,Anne Tyler,1998,Random House Inc
51992,037541214X,10,The Yokota Officers Club,SARAH BIRD,2001,Knopf
51992,380714752,10,The True Confessions of Charlotte Doyle (rack),Avi,1992,HarperTrophy
51992,038529686X,4,Her Native Colors,Elisabeth Hyde,1989,Bantam Dell Pub Group
51992,385471475,5,"Child of War, Woman of Peace",Le Ly Hayslip,1994,Anchor
51992,385479565,10,The Hot Zone,Richard Preston,1995,Anchor
51992,385485107,9,Charles Kuralt's America,Charles Kuralt,1996,Anchor Books/Doubleday
51992,394480244,8,Burr: A Novel,Gore Vidal,1973,Random House Inc
51992,395282179,9,Gorillas in the Mist,Dian Fossey,1983,Houghton Mifflin Company
51992,399143874,5,Homeport,Nora Roberts,1998,Putnam Publishing Group
51992,039914675X,7,The Cat Who Went up the Creek,Lilian Jackson Braun,2002,Putnam Adult
51992,439456983,8,Lucas: A Story of Love and Hate,Kevin Brooks,2003,Chicken House
51992,440208459,8,Burn Marks (V.I. Warshawski Novels (Paperback)),Sara Paretsky,1991,Dell
51992,440415705,8,My Louisiana Sky,Kimberly Willis Holt,2000,Yearling Books
51992,440416027,8,Skellig,David Almond,2000,Yearling Books
51992,440418267,7,Counting Stars (Readers Circle),DAVID ALMOND,2003,Laurel Leaf
51992,446607711,5,The Simple Truth,David Baldacci,1999,Warner Books
51992,451166582,9,The Eyes of the Dragon,Stephen King,2001,Signet Book
51992,452280621,7,Beloved,Toni Morrison,1998,Plume Books
51992,471606006,9,The Endangered Kingdom: The Struggle to Save America's Wildlife (Wiley Science Editions),Roger L. Disilvestro,1989,John Wiley &amp; Sons Inc
51992,499903390,7,Rachel and Her Children (R),Jonathan Kozol,1989,Fawcett Books
51992,517704927,8,Altars in the Street: A Neighborhood Fights to Survive,Melody Ermachild Chavis,1997,Random House Inc
51992,590409433,10,Fallen Angels,Walter Dean Myers,1991,Scholastic Paperbacks
51992,590897993,9,Bat 6,Virginia Euwer Wolff,1998,Scholastic
51992,671047507,8,Bloody River Blues,Jeffery Deaver,2000,Pocket
51992,671510053,9,SHIPPING NEWS,Annie Proulx,1994,Scribner
51992,671756443,6,NEON RAIN : A Dave Robicheaux Novel,James Lee Burke,1992,Pocket
51992,671825348,5,Halloween Party,Agatha Christie,0,Pocket Books
51992,679415629,8,Playing for Keeps: Michael Jordan and the World That He Made,David Halberstam,1999,Random House Inc
51992,679421343,7,Dinner With Persephone,Patricia Storace,1996,Pantheon Books
51992,679430946,10,The Hot Zone,Richard Preston,1994,Random House
51992,679721886,7,The Woman Warrior : Memoirs of a Girlhood Among Ghosts,MAXINE HONG KINGSTON,1989,Vintage
51992,684841185,8,Death du Jour,Kathy Reichs,1999,Scribner
51992,068484625X,9,The RIVERKEEPERS: Two Activists Fight to Reclaim Our Environment as a Basic Human Right,John Cronin,1999,Scribner
51992,684867621,9,The Girl Who Loved Tom Gordon : A Novel,Stephen King,1999,Scribner
51992,698119517,8,Hope Was Here (2001 Newbery Honor Book),Joan Bauer,2002,Puffin Books
51992,786867175,8,Leap of Faith : Memoirs of an Unexpected Life,Queen Noor,2003,Miramax
51992,786867647,8,Lucky Man: A Memoir,Michael J. Fox,2002,Hyperion
51992,804104549,7,Riding the Iron Rooster: By Train Through China,Paul Theroux,1990,Ivy Books
51992,805069194,8,Among the Bears: Raising Orphaned Cubs in the Wild,Benjamin Kilham,2002,Henry Holt &amp; Company
51992,080706341X,8,Staying Put : Making a Home in a Restless World,Scott Russell Sanders,1994,Beacon Press
51992,809034050,8,"Changes in the land: Indians, colonists, and the ecology of New England",William Cronon,1983,Hill and Wang
51992,812921135,6,"The Mansion on the Hill: Dylan, Young, Geffen, Springsteen, and the Head-On Collision of Rock and Commerce",Fred Goodman,1997,Random House Inc
51992,092717605X,9,Me 'N Henry,Walter&amp;Deloris Swan,1987,Swan Enterprises
51992,1570362777,7,Level 4: Virus Hunters of the Cdc,Joseph McCormick,1996,Turner Pub
51993,2277115533,3,Des Bleus a L'ame,Sagan,0,Editions 84
51994,743218779,8,Romancing the Ordinary,Sarah Ban Breathnach,2002,Scribner
51996,375501290,8,The Botany of Desire: A Plant's-Eye View of the World,Michael Pollan,2001,Random House
52001,8807812576,5,La Fata Carabina,Daniel Pennac,1987,Universale Economica Feltrinelli
52002,60196092,10,Moment of Truth,Lisa Scottoline,2000,HarperCollins Publishers
52002,60930535,10,The Poisonwood Bible: A Novel,Barbara Kingsolver,1999,Perennial
52002,140133488,9,Crossing to Safety,Wallace Earle Stegner,1991,Penguin Books
52002,312195516,10,The Red Tent (Bestselling Backlist),Anita Diamant,1998,Picador USA
52002,316666343,10,The Lovely Bones: A Novel,Alice Sebold,2002,"Little, Brown"
52002,316693715,7,Jack and Jill: A Novel,James Patterson,1996,Little Brown &amp; Co
52002,375702709,10,A Lesson Before Dying (Vintage Contemporaries (Paperback)),Ernest J. Gaines,1997,Vintage Books USA
52002,385504209,10,The Da Vinci Code,Dan Brown,2003,Doubleday
52002,446672211,8,Where the Heart Is (Oprah's Book Club (Paperback)),Billie Letts,1998,Warner Books
52002,671722131,8,Some Can Whistle,Larry McMurtry,1990,Pocket
52002,1570428212,9,White Oleander: A Novel,Janet Fitch,1999,Time Warner Audiobooks
52002,1593150229,8,Secrets of the Code: The Unauthorized Guide to the Mysteries Behind The Da Vinci Code,Dan Burstein,2004,CDs Books
52005,723234760,7,The Tale of the Pie and the Patty Pan (The Original Peter Rabbit Books),Beatrix Potter,1987,Frederick Warne and Company Inc
52007,375719180,10,The Miracle Life of Edgar Mint: A Novel,Brady Udall,2002,Vintage Books USA
52007,380784491,5,Murder Runs in the Family: A Southern Sisters Mystery,Anne George,1997,Avon
52008,679429220,7,Midnight in the Garden of Good and Evil: A Savannah Story,John Berendt,1994,Random House
52011,42990084,5,Taoism: The quest for immortality,John Eaton Calthorpe Blofeld,1979,Unwin Paperbacks
52011,64471047,5,"The Lion, the Witch, and the Wardrobe (The Chronicles of Narnia, Book 2)",C. S. Lewis,1994,HarperCollins
52011,140183167,5,The Jungle Books (Penguin Classics),Rudyard Kipling,1990,Penguin Books
52011,140440240,5,The Symposium (Penguin Classics),Plato,1995,Penguin Books
52011,014044131X,5,Tao Te Ching (Penguin Classics),Lao Tzu,1985,Penguin Books
52011,140467629,5,Mind over Labor (Penguin Handbooks),Carl Jones,1988,Penguin Books
52011,015584072X,5,Structured Assembler Language for IBM Microcomputers,Alton R. Kindred,1991,Oxford University Press
52011,192741632,5,German Hero-Sagas and Folk-Tales (Oxford Myths and Legends),Barbara Leonie Picard,1994,Oxford Univ Pr
52011,226307808,5,Euripides I: The Complete Greek Tragedies (Euripides),Euripides,1983,University of Chicago Press
52011,312867867,5,"Faith of the Fallen (Sword of Truth, Book 6)",Terry Goodkind,2000,Tor Books
52011,312890532,8,"Temple of the Winds (Sword of Truth, Book 4)",Terry Goodkind,1997,Tor Books
52011,316544175,5,The Executioner's Song,Norman Mailer,1979,Little Brown &amp; Co
52011,345335457,8,"Magician's Gambit (The Belgariad, Book 3)",David Eddings,1995,Del Rey Books
52011,345335511,8,"Pawn of Prophecy (The Belgariad, Book 1)",David Eddings,1990,Del Rey Books
52011,345335651,8,"Queen of Sorcery (The Belgariad, Book 2)",David Eddings,1989,Del Rey Books
52011,345335708,8,"Castle of Wizardry (The Belgariad, Book 4)",David Eddings,1991,Del Rey Books
52011,345338715,9,"Enchanters' End Game (The Belgariad, Book 5)",David Eddings,1988,Del Rey Books
52011,345352661,8,Guardians of the West (Book 1 of the Malloreon),David Eddings,1988,Del Rey Books
52011,345358805,8,King of the Murgos (Malloreon (Paperback Random House)),David Eddings,1995,Del Rey Books
52011,345363310,8,Demon Lord of Karanda (Malloreon (Paperback Random House)),DAVID EDDINGS,1989,Del Rey
52011,345369351,8,Sorceress of Darshiva (Malloreon (Paperback Random House)),David Eddings,1990,Del Rey Books
52011,345377591,9,"The Seeress of Kell (The Malloreon, Book 5)",David Eddings,1995,Del Rey Books
52011,345390407,5,"Hidden City (The Tamuli Book, No 3)",DAVID EDDINGS,1995,Del Rey
52011,345403959,6,Belgarath the Sorcerer,David Eddings,1996,Del Rey Books
52011,345422554,7,Polgara the Sorceress (Malloreon (Paperback Random House)),David Eddings,1999,Del Rey Books
52011,037582345X,10,"The Golden Compass (His Dark Materials, Book 1)",PHILIP PULLMAN,2002,Knopf Books for Young Readers
52011,380000830,5,The Guns of Avalon (Chronicles of Amber),Roger Zelazny,1996,Harper Mass Market Paperbacks (Mm)
52011,380008319,5,A 3: Sign of the Unicorn (Amber Novels (Paperback)),Roger Zelazny,1999,Avon
52011,380014300,5,Nine Princes In Amber,Roger Zelazny,1977,Avon
52011,380016648,5,A  4: Hand of Oberon (Amber Novels (Paperback)),Roger Zelazny,1999,Avon
52011,380471752,5,"A  5: Court of Chaos (The Chronicles of Amber Series, Book 5)",Roger Zelazny,1979,Avon
52011,380703165,5,The Last Defender of Camelot,Roger Zelazny,1988,Harper Mass Market Paperbacks (Mm)
52011,393020371,7,Next: The Future Just Happened,Michael Lewis,2001,W.W. Norton &amp; Company
52011,039395613X,5,Art of Reasoning,David Kelley,1988,W.W. Norton &amp; Company Ltd
52011,039453512X,5,The Demon-Haunted World: Science As a Candle in the Dark,Carl Sagan,1996,Random House
52011,451159764,5,Jack of Shadows,Roger Zelazny,1989,New Amer Library (Mm)
52011,451522656,5,"Pericles, Prince of Tyre: Cymbeline : The Two Noble Kinsmen (Shakespeare, William,)",William Shakespeare,1993,Signet Classics
52011,451628039,5,Mythology,Edith Hamilton,1991,Signet Book
52011,452008298,5,Meridian Classic Book of Eighteenth and Nineteenth Century British Drama,Katherine Rogers,1993,Penguin USA
52011,517150646,5,The History of the Devil and the Idea of Evil,Paul Carus,1996,Gramercy Books
52011,553207083,5,Zen and the Art of Motorcycle Maintenance,Robert M Pirsig,1982,Bantam Doubleday Dell
52011,553212192,5,Ten Plays by Euripides,Euripides,1984,Bantam
52011,671500678,5,The Power of Silence: Further Lessons of Don Juan,Carlos Castaneda,1991,Book Sales
52011,067173590X,5,SECRET DIARY OF LAURA PALMER (TWIN PEAKS) (A Twin Peaks Book),Jennifer Lynch,1990,Pocket
52011,671738054,5,WHAT'S WRONG WITH TAMARA?,D.A. Fowler,1992,Pocket
52011,671781596,5,FURTHER ALONG THE ROAD LESS TRAVELED,M. Scott Peck,1993,Simon &amp; Schuster
52011,674810406,5,Six Memos for the Next Millennium,Italo Calvino,1988,Harvard University Press
52011,713726202,5,Ufo a Deadly Concealment: The Official Cover-Up,Derek Sheffield,1996,Sterling Pub Co Inc
52011,747401659,5,Books of Blood Volume to 6,Clive Barker,0,Sphere Books Limited
52011,765300265,7,The Pillars of Creation,Terry Goodkind,2001,Tor Books
52011,765305224,7,"Naked Empire (Sword of Truth, Book 8)",Terry Goodkind,2003,Tor Books
52011,765346524,9,Wizard's First Rule (Sword Of Truth),Terry Goodkind,2003,Tor Books
52011,782124623,5,MCSE JumpStart: Computer and Network Basics,Lisa Donald,1999,Sybex Inc
52011,804900795,5,Alice's Adventures in Wonderland and Through the Looking Glass,Lewis Carroll,1979,Airmont Pub Co
52011,812500482,7,The Eye of the World : Book One of 'The Wheel of Time' (Wheel of Time),Robert Jordan,1990,Tor Books
52011,812517725,9,"The Great Hunt (The Wheel of Time, Book 2)",Robert Jordan,1991,Tor Fantasy
52011,812548094,8,"Stone of Tears (Sword of Truth, Book 2)",Terry Goodkind,1996,Tor Fantasy
52011,812551478,8,"Blood of the Fold (Sword of Truth, Book 3)",Terry Goodkind,1997,Tor Fantasy
52011,812551494,8,"Soul of the Fire (Sword of Truth, Book 5)",Terry Goodkind,2000,Tor Fantasy
52011,861885694,5,The Ribbon Book,Julia Bawden,1987,Judy Piatkus Publishers Ltd
52011,1555215319,5,Elliott O'Donnell's Casebook of Ghosts: True Stories from the Files of One of the World's Greatest Ghost Hunters,Elliott O'Donnell,1989,Book Sales
52011,1563890186,5,Batman: Holy Terror (Batman (DC Comics Paperback)),Alan Brennert,1991,Dc Comics
52011,1563892618,5,Preacher: Gone to Texas (Vertigo),Garth Ennis,1996,DC Comics
52011,1563892650,5," Summonings: Books of Magic, Vol. 2",John Ney Rieber,1996,DC Comics
52011,1563893126,5,"Preacher: Until the End of the World (Preacher Series , Vol 2)",Garth Ennis,1997,DC Comics
52013,345348036,8,The Princess Bride: S Morgenstern's Classic Tale of True Love and High Adventure,WILLIAM GOLDMAN,1987,Del Rey
52018,380789019,10,Neverwhere,Neil Gaiman,1998,Avon
52018,441000916,8,The Laughing Corpse (Anita Blake Vampire Hunter (Paperback)),Laurell K. Hamilton,1994,Ace Books
52018,441009360,8,Knight Life,Peter David,2002,Ace Books
52018,441304834,8,Guilty Pleasures (Anita Blake Vampire Hunter (Paperback)),Laurell K. Hamilton,1995,Ace Books
52021,60958391,10,The Women Who Wrote the War,Nancy Caldwell Sorel,2000,Perennial
52021,020530902X,10,"The Elements of Style, Fourth Edition",William Strunk Jr.,2000,Pearson Higher Education
52021,345449835,10,Martyrs' Crossing: A Novel (Ballantine Reader's Circle),Amy Wilentz,2002,Ballantine Books
52021,385336403,10,Cloud of Sparrows,TAKASHI MATSUOKA,2002,Delacorte Press
52021,394755111,10,Iron and Silk (Vintage Departures),Mark Salzman,1987,Vintage Books USA
52021,439136350,10,Harry Potter and the Prisoner of Azkaban (Book 3),J. K. Rowling,1999,Scholastic
52021,451523024,10,Uncle Tom's Cabin,Harriet Beecher Stowe,1997,Signet Classics
52021,684869527,10,Coming Home To Jerusalem: A Personal Journey,Wendy Orange,2001,Simon &amp; Schuster
52021,743448219,10,The Four Feathers,A.E.W. Mason,2002,Pocket
52021,786882328,10,"The Hip Mama Survival Guide : Advice from the Trenches on Pregnancy, Childbirth, Cool Names, Clueless Doctors, Potty Training and Toddler Avengers",Ariel Gore,1998,Hyperion
52021,874778883,10,Seven Years in Tibet,Heinrich Harrer,1997,Jeremy P. Tarcher
52021,1565840437,5,The North China Lover,Marguerite Duras,1993,New Press
52021,1858284651,8,"The Rough Guide to Washington D. C. (Washington, D.C. (Rough Guides))",Jules Brown,2000,Rough Guides Limited
52021,1880684578,8,Living on the Edge: Fiction by Peace Corps Writers,John Coyne,1999,Curbstone Press
52022,3499109999,6,Giovannis Zimmer.,James Baldwin,1996,Rowohlt Tb.
52025,307305007,10,Richard Scarry's Biggest and Best Storybook Ever,Richard Scarry,1998,Golden Books
52026,3423202327,7,MÃ?Â¶rder ohne Gesicht.,Henning Mankell,1999,Dtv
52026,3596143136,7,Auf fremdem Terrain. Anastasijas erster Fall.,Alexandra Marinina,2000,"Fischer (Tb.), Frankfurt"
52031,340551194,8,Time to Dance,Melvyn Bragg,0,Scepter Pubs
52036,28603958,10,Betty Crocker's New Cookbook: Everything You Need to Know to Cook (8th ed),Betty Crocker,1996,MacMillan Publishing Company.
52036,307301443,10,Disney's Aladdin Magic Carpet Ride (Little Golden Book),Teddy Slater Margulies,1995,Random House Childrens Books
52036,877797080,10,Merriam Webster's Collegiate Dictionary,Webster,1993,"Merriam-Webster, Inc."
52036,156476317X,9,The Preschoolers Bible,V. Gilbert Beers,1994,Chariot Victor Publishing
52036,1579543626,5,Doctor's Book of Food Remedies,Selene Yeager,2000,St. Martin's Press
52038,847223259X,9,El Otono En Pekin (Andanzas),Boris Vian,2002,Tusquets
52040,151686564,9,"Old Possum's Book of Practical Cats, Illustrated Edition",T.S. Eliot,1982,Harcourt
52044,20430701,10,Prayer for a Child,Rachel Field,1984,Aladdin
52044,20449313,10,The Yearling (Scribner Classics),Marjorie Kinnan Rawlings,1988,Simon Pulse
52044,60194871,10,Am I Pig Enough for You Yet? : Voices of the Barnyard,Valerie Shaff,2001,HarperCollins
52044,60606797,10,The Mystery of Love: Saints in Art Through the Centuries,Wendy Beckett,1997,Harpercollins
52044,60609362,10,Telling Secrets,Frederick Buechner,1992,HarperSanFrancisco
52044,60611618,10,Now and then,Frederick Buechner,1983,Harper &amp; Row
52044,60611839,10,The Sacred Journey : A Memoir of Early Days,Frederick Buechner,1991,HarperSanFrancisco
52044,60830719,10,Great Short Works of Leo Tolstoy,Leo Tolstoy,1967,Perennial
52044,60907010,8,Innocent Erendira and Other Stories,Gabriel Garcia Marquez,1979,Perennial
52044,006092053X,7,The Enlightened Heart,Stephen Mitchell,1993,Perennial
52044,60928778,10,"Full Woman, Fleshly Apple, Hot Moon: Selected Poems of Pablo Neruda",Stephen Mitchell,1998,Perennial
52044,60982039,8,Holy Fire: Nine Visionary Poets and the Quest for Enlightenment,Daniel Halpern,1994,HarperCollins
52044,140077871,10,Dreams of Sleep (Contemporary American Fiction),Josephine Humphreys,2000,Penguin Books
52044,140153195,10,Justine (Alexandria Quartet),Lawrence Durrell,1991,Penguin Books
52044,140153209,10,"Mountolive (Durrell, Lawrence. Alexandria Quartet.)",Lawrence Durrell,1991,Penguin Books
52044,140153217,10,"Balthazar (Durrell, Lawrence. Alexandria Quartet.)",Lawrence Durrell,1991,Penguin Books
52044,140153225,10,"Clea (Durrell, Lawrence. Alexandria Quartet.)",Lawrence Durrell,1993,Penguin Books
52044,014028902X,10,My Family and Other Animals (Penguin Nature Classics),Gerald Durrell,2000,Penguin Books
52044,140505393,10,Miss Rumphius,Barbara Cooney,1985,Puffin Books
52044,151529582,10,Locked Rooms and Open Doors: Diaries and Letters 1933-1935,Anne Morrow Lindbergh,1974,Harcourt Brace Jovanovich
52044,017443460X,10,King Lear (3rd Series),William Shakespeare,1997,Arden Shakespeare
52044,192142216,7,The Oxford Book of Exile,John Simpson,1995,Oxford University Press
52044,198661657,10,The Oxford Companion to Christian Art and Architecture,Peter Murray,1996,Oxford University Press
52044,281045526,10,Praying with John Donne &amp; George,Abingdon Press,1997,Abingdon Press
52044,300001762,10,Long Day's Journey Into Night,Eugene Gladstone O'Neill,1956,Yale University Press
52044,316313076,9,Victory Over Japan : A Book of Stories,Ellen Gilchrist,1985,Back Bay Books
52044,374475881,10,The Topsy-Turvy Emperor of China,Isaac Bashevis Singer,1996,Farrar Straus &amp; Giroux
52044,385480334,10,Diary of a Young Girl: The Definitive Editon,Anne Frank,1996,Anchor
52044,399235841,9,The Tale of the Firebird,Gennadii Spirin,2002,Philomel Books
52044,415011035,10,Antony and Cleopatra (3rd Series),William Shakespeare,1995,Arden Shakespeare
52044,441627404,9,The Once and Future King,T. H. White,1987,Ace Books
52044,449005615,10,Seabiscuit: An American Legend,LAURA HILLENBRAND,2002,Ballantine Books
52044,449203719,10,Centaur,John Updike,1983,Fawcett Books
52044,451625552,8,Writing for Story,Jon Franklin,1987,Signet Book
52044,486286320,7,Favorite Russian Fairy Tales (Dover Children's Thrift Classics),Arthur Ransome,1995,Dover Publications
52044,486287297,10,\God's Grandeur\ and Other Poems (Dover Thrift Editions),Gerard Manley Hopkins,1995,Dover Publications
52044,486292495,10,The Story of My Life (Dover Thrift Editions),Helen Keller,1996,Dover Publications
52044,486403475,9,Favorite Animal Poems (Dover Children's Thrift Classics),Victoria Fremont,1998,Dover Publications
52044,486414175,10,Gitanjali,Rabindranath Tagore,2000,Dover Publications
52044,553232762,8,Cheaper by the Dozen,"Frank B., Jr. Gilbreth",1981,Bantam Books
52044,679429085,10,Rossetti: Poems (Everyman's Library Pocket Poets),Christina Georgina Rossetti,1993,Everyman's Library
52044,679642188,10,The Southern Woman: New and Selected Fiction (Modern Library),Elizabeth Spencer,2001,Modern Library
52044,679745203,8,The English Patient,Michael Ondaatje,1996,Vintage Books USA
52044,679746536,7,The Cryptogram,David Mamet,1995,Vintage Books USA
52044,689121105,10,FORESEEABLE FUTURE,Reynolds Price,1991,Scribner
52044,068985563X,8,Jimmy Zangwow's Out-of-This-World Moon-Pie Adventure,Tony DiTerlizzi,2003,Aladdin Library
52044,714827851,10,Fra Angelico : Colour Library (Colour Library),Christopher Lloyd,1998,Phaidon Press Inc.
52044,714833347,7,DÃ¼rer : Colour Library (Phaidon Colour Library),Martin Bailey,1995,Phaidon Press
52044,714839396,10,Annunciation,Editors of Phaidon Press,2000,Phaidon Press Inc.
52044,071483940X,10,Last Supper,Editors of Phaidon Press,2000,Phaidon Press Inc.
52044,714839418,10,Crucifixion,Editors of Phaidon Press,2000,Phaidon Press Inc.
52044,714839426,10,Descent,Editors of Phaidon Press,2000,Phaidon Press Inc.
52044,723243263,9,A Little Book of Bible Stories (Flower S.),Dorothy Barker,1996,Frederick Warne and Company Inc
52044,723248303,10,Flower Fairies of the Wayside (Serendipity Books),Cicely Mary Barker,2002,Frederick Warne and Company Inc
52044,789203227,10,Fra Angelico,John T. Spike,1997,Abbeville Press
52044,803722923,9,The Mightiest Heart,Lynn Cullen,1998,Dial Books
52044,805022848,10,The Book of Common Prayer,Century Hutchinson,1992,Henry Holt &amp; Company
52044,805063331,10,The Easter Story,Gennadii Spirin,1999,Henry Holt &amp; Company
52044,807068187,10,New and Selected Poems,Mary Oliver,1992,Beacon Press
52044,807123277,7,Where Water Begins: New Poems and Prose (Poetry),John Stone,1998,Louisiana State University Press
52044,813920744,8,Invited Guest: An Anthology of Twentieth-Century Southern Poetry,David Rigsbee,2001,University Press of Virginia
52044,081921552X,9,The Bible in Stained Glass,Laura Lushington,1991,Morehouse Group
52044,821225073,8,Time's River : The Voyage of Life in Art and Poetry,Kate Farrell,1999,Bulfinch
52044,877734518,8,LITTLE COURSE IN DRMS,ROBERT BOSNAK,1988,Shambhala
52044,877931003,7,Day by Day: The Notre Dame Prayerbook for Students,Thomas McNally,1975,Ave Maria Press
52044,880014261,10,"The Essential Cavafy (Essential Poets Series, 22)",Constantine Cavafy,1995,Ecco Press
52044,918477360,10,The Essential Rosary: Prayers,Caryll Houselander,1996,Sophia Institute Press
52044,1555214398,7,The Art of George Stubbs,Venetia Morrison,1990,Wellfleet Press
52044,1570716900,7,Life and Works: Degas (Life and Works),Virginia Spate,2000,Sourcebooks Trade
52044,1582431469,10,The Art of the Commonplace: The Agrarian Essays of Wendell Berry,Wendell Berry,2002,Counterpoint Press
52044,1928832849,7,More Catholic Tales for Boys and Girls,Caryll Houselander,2003,Sophia Institute Press
52046,446605484,9,Roses Are Red (Alex Cross Novels),James Patterson,2001,Warner Vision
52048,2020308959,9,"Dieu Et Nous Seuls Pouvons (Fiction, Poetry and Drama)",Folco,0,Editions du Seuil
