User-ID,ISBN,Book-Rating,Book-Title,Book-Author,Year-Of-Publication,Publisher
24090,067976402X,7,Snow Falling on Cedars,David Guterson,1995,Vintage Books USA
24090,743249291,5,Wideacre : A Novel,Philippa Gregory,2003,Touchstone
24090,767904559,9,On Rue Tatin: Living and Cooking in a French Town,Susan Herrmann Loomis,2002,Broadway Books
24090,1400052726,9,Sarah : A Novel (Canaan Triology),MAREK HALTER,2004,Crown
24100,441569595,6,Neuromancer (Remembering Tomorrow),William Gibson,1995,Ace Books
24100,553278223,9,The Martian Chronicles,RAY BRADBURY,1984,Spectra
24105,61030872,8,Maggie Sweet,Judith Minthorn Stacy,2002,HarperTorch
24105,61097659,9,Switcheroo : A Novel,Olivia Goldsmith,1999,HarperTorch
24105,312971362,8,Sis Boom Bah,Jane Heller,2000,St. Martin's Press
24105,312976909,9,Got Your Number,Stephanie Bond,2001,St. Martin's Paperbacks
24105,312983271,7,Full House (Janet Evanovich's Full Series),Janet Evanovich,2002,St. Martin's Paperbacks
24105,312983336,7,I Think I Love You,Stephanie Bond,2002,St. Martin's Paperbacks
24105,440226147,8,Shooting Stars and Other Deadly Things (Carrie Carlin Mystery),Nancy Tesler,1999,Dell Publishing Company
24105,451204956,8,Bad Boy,Olivia Goldsmith,2002,Signet Book
24105,451206673,10,Pen Pals,Olivia Goldsmith,2002,Signet Book
24105,451208501,7,Bubbles in Trouble (Bubbles Books),Sarah Strohmeyer,2003,Signet Book
24105,1551668467,7,Deepest Water,Kate Wilhelm,2001,Mira
24111,140293469,10,High Fidelity,Nick Hornby,2000,Penguin Books Ltd
24115,316782505,7,The Weight of Water,Anita Shreve,2001,"Little, Brown"
24115,316899984,5,"River, Cross My Heart",Breena Clarke,1999,Little Brown &amp; Company
24115,786866276,5,Mother of Pearl,Melinda Haynes,1999,Hyperion
24115,080411918X,8,A Patchwork Planet,ANNE TYLER,2001,Ballantine Books
24118,64473384,9,Anna and the Duke (An Avon True Romance),Kathryn Smith,2002,Avon
24118,014038166X,9,Awake and Dreaming (Novel),Kit Pearson,1999,Puffin Books
24118,059025510X,9,"Dreams of Revenge: Dark Moon, Book II (Dark Moon, No 2)",Elizabeth Moore,1995,Scholastic Paperbacks (Mm)
24123,190315510X,10,Miss Pettigrew Lives for a Day,Winifred Watson,2000,Persephone Books Ltd
24132,906969778,8,Costumes for the Stage,Sheilia Jackson,1988,Fitzhenry &amp; Whiteside Ltd
24140,140067477,10,The Tao of Pooh,Benjamin Hoff,1983,Penguin Books
24144,345417623,8,Timeline,MICHAEL CRICHTON,2000,Ballantine Books
24145,399149384,5,Light in Shadow,Jayne Ann Krentz,2002,Putnam Publishing Group
24145,439064872,8,Harry Potter and the Chamber of Secrets (Book 2),J. K. Rowling,2000,Scholastic
24145,684838184,8,The Roaring 2000s: Building the Wealth and Life Style You Desire in the Greatest Boom in History,Harry S. Dent,1998,Simon &amp; Schuster
24145,785807284,8,Big Book of Home Crafts 2,Withers,0,Book Sales Inc Remainder
24145,1883672899,5,The Kids 'N' Clay Ceramics Book,Kevin Nierman,2000,Tricycle Press
24147,60926015,10,Mary Kay : The Story of America's Most Dynamic Businesswoman,Mary Kay Ash,1994,Perennial Currents
24150,385484089,2,Windswept House,Malachi Martin,1996,Bantam Books
24150,399136150,8,The Sum of All Fears,Tom Clancy,1991,Putnam Publishing Group
24150,446516775,8,Day of Wrath,Larry Bond,1998,Warner Books
24150,802880533,7,History of the Christian Church: German Reformation (German Reformation),Philip Schaff,1960,Eerdmans Pub Co
24153,451204530,10,Code to Zero,Ken Follett,2001,Signet Book
24153,812511816,7,"The Eye of the World (The Wheel of Time, Book 1)",Robert Jordan,1990,Tor Fantasy
24160,553281003,10,Two From Galilee : The Story Of Mary And Joseph,MARJORIE HOLMES,1982,Bantam
24162,087113795X,10,Peace Like a River,Leif Enger,2001,Grove/Atlantic
24169,62511254,10,More Than a Tea Party,Jane Evershed,1994,HarperCollins
24169,966410076,10,"You Are Being Lied To: The Disinformation Guide to Media Distortion, Historical Whitewashes and Cultural Myths",Russ Kick,2001,The Disinformation Company
24169,971394202,10,Everything You Know Is Wrong: The Disinformation Guide to Secrets and Lies,Russ Kick,2002,Last Gasp
24169,1573247073,10,Take It Personally: How to Make Conscious Choices to Change the World,Anita Roddick,2001,Red Wheel/Weiser
24172,380777428,8,"Billy Baker's Dog Won't Stay Buried (Spinetingler, No 2)",M. T. Coffin,1995,Avon Books
24172,380777851,7,"My Teacher's a Bug (Spinetinglers, No 3)",M. T. Coffin,1995,Avon Books
24172,380778297,7,The Substitute Creature (Spinetinglers),M. T. Coffin,1995,Avon Books
24172,380781174,7,"Where Have All the Parents Gone? (Spinetinglers, No 4)",M. T. Coffin,1995,Avon Books
24172,436279746,8,The Novel,James A. Michener,1991,Secker &amp; Warburg
24172,059002972X,7,Help! I'm Trapped in Santa's Body (Help! I'm Trapped (Paperback)),Todd Strasser,1997,Scholastic
24172,590397761,8,"Shop Till You Drop ... Dead! (Give Yourself Goosebumps, No 25)",R. L. Stine,1998,Apple
24172,590399993,8,"Return to Terror Tower (Give Yourself Goosebumps Special Edition, No 2)",R. L. Stine,1998,Apple (Scholastic)
24172,590473549,6,The Ghost Comes Calling (Little Apple),Betty Ren Wright,1997,Little Apple Books (Scholastic)
24172,590483404,8,"A Shocker on Shock Street (Goosebumps, No 35)",R. L. Stine,1995,Scholastic
24172,590568930,7,"The Curse of Camp Cold Lake (Goosebumps, No 56)",R. L. Stine,1997,Scholastic
24172,059084766X,5,"The Knight in Screaming Armor (Give Yourself Goosebumps, No 9)",R. L. Stine,1996,Scholastic
24172,059088025X,5,There's a Tarantula in My Homework (Little Apple),Susan Clymer,1997,Apple
24172,590880268,5,There's a Frog in My Sleeping Bag,Susan Clymer,1998,Little Apple Books (Scholastic)
24172,603032826,8,The Adventures of the Wishing-chair,Enid Blyton,1990,Egmont Childrens Books
24172,749730757,8,A Pig Called Francis Bacon,Stephen Measday,1997,Egmont Childrens Books
24172,861635744,7,"Look Out, Secret Seven (Enid Blyton's The Secret Seven Series II)",Enid Blyton,1962,Award Publications
24180,312291639,8,The Nanny Diaries: A Novel,Emma McLaughlin,2003,St. Martin's Griffin
24182,60938455,7,Fast Food Nation: The Dark Side of the All-American Meal,Eric Schlosser,2002,Perennial
24182,312254377,2,"Visitors from Oz: The Wild Adventures of Dorothy, the Scarecrow, and the Tin Woodman",Martin Gardner,2000,St Martins Pr
24182,044024126X,5,Taken,Thomas H. Cook,2002,Dell Publishing Company
24183,156537060,8,The Lost World of the Kalahari,Laurens Van Der Post,1977,Harvest Books
24183,380712210,6,Real Farm,Patricia Tichenor Westfall,1991,Harpercollins
24183,553135457,9,Sophies Choice,William Styron,0,Bantam Doubleday Dell
24186,60164662,10,"28 Barbary Lane : A \Tales of the City\"" Omnibus""",Armistead Maupin,1990,HarperCollins
24186,60166495,10,Back to Barbary Lane: The Final Tales of the City Omnibus,Armistead Maupin,1991,HarperCollins
24186,60392452,9,Stupid White Men ...and Other Sorry Excuses for the State of the Nation!,Michael Moore,2002,Regan Books
24186,60914319,10,Search for Signs of Intelligent Life in the Universe,Jane Wagner,1991,Harpercollins
24186,60929871,5,Brave New World,Aldous Huxley,1998,Perennial
24186,006093090X,9,The Night Listener : A Novel,Armistead Maupin,2001,Perennial
24186,61044334,9,Death of a Dj: A Mystery,Jane Rubino,1997,Harper Mass Market Paperbacks (Mm)
24186,155510967,8,Literature: Art and Artifact,William A. Heffernan,1987,Harcourt College Pub
24186,312082738,9,Not Since Carrie : Forty Years of Broadway Musical Flops,Ken Mandelbaum,1992,St. Martin's Griffin
24186,034536225X,9,I'll Take It,Paul Rudnick,1995,Ballantine Books
24186,374216495,9,The Museum Guard,Howard Norman,1998,Farrar Straus Giroux
24186,375727191,10,The Laramie Project (Vintage Originals),Moises Kaufman,2001,Vintage Books USA
24186,380012863,9,Jonathan Livingston Seagull,Richard Bach,1976,Avon
24186,380014300,8,Nine Princes In Amber,Roger Zelazny,1977,Avon
24186,380978407,8,"Lamb: The Gospel According to Biff, Christ's Childhood Pal",Christopher Moore,2002,William Morrow &amp; Company
24186,425180883,10,Iron Chef: The Official Book,Kaoru Hoketsu,2001,Berkley Publishing Group
24186,043935806X,9,Harry Potter and the Order of the Phoenix (Book 5),J. K. Rowling,2003,Scholastic
24186,440206154,9,Red Dragon,Thomas Harris,2000,Dell Publishing Company
24186,441769772,7,Slaves of the Volcano God,Craig Shaw Gardner,1989,Ace Books
24186,451153553,9,Misery,Stephen King,1988,New Amer Library
24186,553581309,10,Biting the Sun,Tanith Lee,1999,Spectra Books
24186,573692424,7,Out of order: A new comedy,Ray Cooney,1991,S. French
24186,671648144,9,IF THERE BE THORN (Dollanger Saga (Paperback)),V.C. Andrews,1987,Pocket
24186,671722123,9,"Marked Cards (Wild Cards: A New Cycle, Book 2)",George R.R. Martin,1994,Baen
24186,743423801,9,Wild Cards (Volume 1),George Martin,2001,I Books
24186,743462785,8,What Price Honor? (Star Trek Enterprise),Dave Stern,2002,Star Trek
24186,786882638,10,Clerks and Chasing Amy : Two Screenplays,Kevin Smith,1997,Miramax
24186,802135196,9,Valley of the Dolls: A Novel,Jacqueline Susann,1997,Grove Press
24186,812516001,7,The Inheritor,Marion Zimmer Bradley,1984,Tor Books
24186,823088170,10,"Let's Put on a Musical!: How to Choose the Right Show for Your School, Community or Professional Theater",Peter Filichia,1997,Back Stage Books
24186,884001806,10,Survival of a Spirit,Eva Salier,1997,Shengold Pub
24186,964954273,10,The Enchanted World of Rankin/Bass,Rick Goldschmidt,1998,Scb Distributors
24186,1555835821,8,Soon to Be a Major Motion Picture,Warren Dunford,2000,Alyson Publications
24186,1558539328,10,Merry Christmas From The Family,Robert Earl Keen Jr.,2001,Rutledge Hill Press
24186,1563897954,9,"The Doom Patrol Archives, Vol. 1 (DC Archive Editions)",Bob Haney,2002,DC Comics
24186,1575665530,2,Every Man for Himself,Orland Outland,2000,Kensington Publishing Corporation
24186,1580630073,9,Pufnstuf &amp; Other Stuff: The Weird and Wonderful World of Sid &amp; Marty Krofft,David Martindale,1998,Audio Renaissance
24186,158899256X,8,Iron Wok Jan (Iron Wok Jan!),Shinji Saijyo,2002,ComicsOne Corporation
24186,187806794X,9,Working Parts: A Novel,Lucy Jane Bledsoe,1997,Seal Press (WA)
24186,1886360065,5,Born Gay: Mom Should Have Known When...,Michael Zambotti,1998,Alamo Square Distributors
24186,1892597055,10,The Complete Strangers in Paradise Volume One,Terry Moore,1998,"Abstract Studio, Incorporated"
24188,312862024,6,Between the Rivers,Harry Turtledove,1998,St Martins Pr
24188,380455757,2,People of the Lake,Richard E Leakey,1988,Harper Mass Market Paperbacks (Mm)
24188,399126503,2,"The Maharajah, and Other Stories",Terence Hanbury White,1981,Putnam Pub Group
24188,446673587,7,Ramses: The Battle of Kadesh - Volume III (Ramses),Christian Jacq,1998,Warner Books
24188,521633982,10,Dynamic Memory Revisited,Roger C. Schank,1999,Cambridge University Press
24188,679444815,10,Timeline,Michael Crichton,1999,Alfred A. Knopf
24188,743400135,10,West of Eden (West of Eden),Harry Harrison,2000,I Books
24188,804108447,10,Druids,MORGAN LLYWELYN,1992,Del Rey
24188,877954437,6,Lord of Darkness,Robert Silverberg,1983,Arbor House Pub Co
24188,096559016X,7,The Dragons of Springplace: Stories,Robert Reed,1999,Golden Gryphon Press
24188,971880107,1,Wild Animus,Rich Shapero,2004,Too Far
24190,345427637,8,The Angel of Darkness,Caleb Carr,1998,Ballantine Books
24191,312199406,8,Night of Many Dreams : A Novel,Gail Tsukiyama,1998,St. Martin's Griffin
24191,312965354,7,An Act of Love (Act of Love),Nancy Thayer,1999,St. Martin's Press
24191,345435168,7,Open House (Oprah's Book Club (Paperback)),Elizabeth Berg,2001,Ballantine Books
24191,375419934,9,The World Below,SUE MILLER,2001,Random House Audio
24191,037570731X,6,The Ladies' Man,ELINOR LIPMAN,2000,Vintage Books
24191,440121353,5,Eden Burning,Belva Plain,1987,Dell
24191,553292498,9,"Dawn of the Century (American Chronicles, Vol 1, 1901-1910)",Robert Vaughan,1992,Bantam Books
24191,553296612,9,"Over There 1911 1920 (The American Chronicles, Vol 2)",Robert Vaughan,1992,Bantam Books
24191,553296809,9,"The Lost Generation (American Chronicles, Vol 3)",Robert Vaughan,1992,Bantam Books
24191,679402543,6,Me : Stories of My Life,KATHARINE HEPBURN,2003,Random House Audio
24191,679417125,7,Parliament of Whores,P. J. O'Rourke,1992,Random House Trade
24191,679460497,10,All over but the Shoutin',Rick Bragg,1997,Random House Audio Publishing Group
24191,1559271833,2,Toujours Provence,Peter Mayle,1991,Audio Renaissance
24191,1567403085,7,We Are Our Mothers' Daughters (Hazelden Meditations Flip Book),Cokie Roberts,1999,Paperback Nova Audio
24191,1567408265,6,On Mystic Lake (Nova Audio Books),Kristin Hannah,1999,Brilliance Audio - Trade
24191,1567408389,5,Local Girls (Nova Audio Books),Alice Hoffman,1999,Brilliance Audio - Trade
24191,1570426007,7,All Too Human : A Political Education,George Stephanopoulos,1999,Time Warner Audio Major
24193,140167153,7,Your Money or Your Life: Transforming Your Relationship With Money and Achieving Financial Independence,Joe Dominguez,1993,Penguin Books
24193,452282829,3,We Were the Mulvaneys,Joyce Carol Oates,1996,Plume
24193,767906713,8,The Minimalist Cooks Dinner,Mark Bittman,2001,Broadway Books
24193,786884592,5,"Life Strategies: Doing What Works, Doing What Matters",Phillip C. McGraw,2000,Hyperion
24193,875963005,7,"Mountain Bike Magazine's Complete Guide To Mountain Biking Skills : Expert Tips On Conquering Curves, Corners, Dips, Descents, Hills, Water Hazards, And Other All-Terrain Challenges",Bicycling Magazines,1996,Rodale Books
24193,897321146,7,Mountain Bike!: A Manual of Beginning to Advanced Technique,William Nealy,1992,Menasha Ridge Press
24194,60952970,9,Ophelia Speaks : Adolescent Girls Write About Their Search for Self,Sara Shandler,1999,Perennial
24194,61073628,8,A Night Without Armor : Poems,Jewel,1999,Perennial Currents
24194,64400026,8,Little House on the Prairie,Laura Ingalls Wilder,1953,HarperTrophy
24194,64440214,9,Frog and Toad Together (I Can Read Book 2),Arnold Lobel,1979,HarperTrophy
24194,64440532,5,The Big Balloon Race (I Can Read Book),Eleanor Coerr,1992,HarperCollins Publishers
24194,006444192X,7,Stan the Hot Dog Man (I Can Read Book 2),Ethel Kessler,1995,HarperTrophy
24194,140240187,8,The Penguin Book of Lesbian Short Stories,Margaret Reynolds,1994,Penguin Books
24194,014034991X,9,Westing Game,Ellen Raskin,1992,Puffin Books
24194,152001182,10,Mouse Paint,Ellen Stoll Walsh,1995,Voyager Books
24194,156010690,10,The Emperors New Clothes: An All-Star Illustrated Retelling of the Classic Fairy Tale,Hans Christian Andersen,2000,Harcourt
24194,307021491,9,Alice in Wonderland,Jane Werner,1920,Golden Books
24194,307101673,10,Little Duck's moving day (A First little golden book),Stephanie Calmenson,1986,Western Pub. Co
24194,307117383,9,Garfield's Picnic Adventure (Golden Look-Look Book),Jack C. Harris,1988,Golden Books
24194,307118932,9,Just Grandma and Me (Golden Look-Look Book),MERCER MAYER,2001,Golden Books
24194,307119491,9,"Baby Sister Says No (Mayer, Mercer, Little Critter Book.)",MERCER MAYER,2000,Golden Books
24194,307119750,9,I Just Forgot (A Little Critter Book),MERCER MAYER,1999,Golden Books
24194,307124959,9,Disney's Aladdin: Action Words (Sturdy Shapes),Diane Muldrow,1994,Random House Childrens Books
24194,307130576,9,Baby 1-2-3 (Shaped Little Nugget Book),HEATHER FELDMAN,1999,Golden Books
24194,307301397,8,Richard Scarry's Floating Bananas (Little Golden Book),Golden Books,1994,Golden Books
24194,312261551,10,Extra Nutty!: Even More Letters from a Nut,Ted L. Nancy,2000,St. Martin's Press
24194,312959214,6,Meditations for a Miserable Millennium,Dan Goodman,1996,St. Martin's Press
24194,330332775,9,Bridget Jones's Diary,Helen Fielding,1997,Picador (UK)
24194,345392825,8,Reviving Ophelia: Saving the Selves of Adolescent Girls (Ballantine Reader's Circle),Mary Pipher,1995,Ballantine Books
24194,380709163,8,Ramona and Her Father (Avon Camelot Books (Paperback)),Beverly Cleary,1999,HarperTrophy
24194,380722925,10,There's a Boy in Here,Judy Barron,1994,Harper Mass Market Paperbacks (Mm)
24194,380794667,7,Astronumerology : Your Key to Empowerment Using Stars and Numbers,Pamela Hobs Bell,1998,Avon Books
24194,038549081X,10,The Handmaid's Tale : A Novel,Margaret Atwood,1998,Anchor
24194,394750918,9,School Is Hell,MATT GROENING,1987,Pantheon
24194,039486154X,4,HH-FARM ANIMALS,Hans Helweg,1983,Random House Books for Young Readers
24194,394865707,9,The Berenstain Bears and Too Much TV (First Time Books),STAN BERENSTAIN,1984,Random House Books for Young Readers
24194,394865804,10,The Butter Battle Book,Dr. Seuss,1984,Random House Children's Books
24194,394871804,8,"The Berenstain Bears on the Moon (Bright &amp; Early Book, Be 27)",Stan Berenstain,1985,Random House Children's Books
24194,395368952,10,A Porcupine Named Fluffy,Helen Lester,1986,Houghton Mifflin/Walter Lorraine Books
24194,039568093X,8,Prozac Nation: Young and Depressed in America,Elizabeth Wurtzel,1994,Houghton Mifflin Company
24194,399501487,8,Lord of the Flies,William Gerald Golding,1959,Perigee Trade
24194,439443261,10,Fairies All Year Long: With Shiny Fingernail Stickers (Secret Fairy),Claire Freedman,2003,Cartwheel Books
24194,440219515,8,Letters from the Inside,John Marsden,1996,Laure Leaf
24194,440422256,7,The Egypt Game (Yearling Newbery),Zilpha Keatley Snyder,1985,Yearling Books
24194,440472091,8,Ramona the Pest (Ramona Quimby (Paperback)),Beverly Cleary,1982,Yearling Books
24194,446310786,8,To Kill a Mockingbird,Harper Lee,1988,Little Brown &amp; Company
24194,044841838X,9,Fluttery Butterflies: Includes 20 Glitter Tattoos (Glitter Tattoos),Tennant Redbank,1998,Grosset &amp; Dunlap
24194,451160312,9,I Never Promised You a Rose Garden,Joanne Greenberg,1984,Signet Book
24194,451628039,5,Mythology,Edith Hamilton,1991,Signet Book
24194,452281784,9,Bad Heir Day,Wendy Holden,2001,Plume Books
24194,553272535,6,Night,Elie Wiesel,1982,Bantam Books
24194,055327886X,9,Rubyfruit Jungle,Rita Mae Brown,1983,Bantam Books
24194,553280414,8,A Separate Peace,John Knowles,1985,Bantam Books
24194,573693331,7,Piece of My Heart: A Play in 2 Acts,S Lauro,1992,Samuel French Inc Plays
24194,590262645,9,"The Classroom Pet (Hello Reader!, Level 1)",Grace Maccarone,1995,Scholastic
24194,590430122,9,Alexander and the Wind-Up Mouse,Leo Lionni,1989,Scholastic Paperbacks (Mm)
24194,590442627,10,Clifford's Puppy Days (Clifford the Big Red Dog (Paperback)),Norman Bridwell,1989,Scholastic
24194,590475460,8,Enormous Egg,Oliver Butterworth,0,Scholastic Inc
24194,670869392,10,There Was an Old Lady Who Swallowed a Fly (Caldecott Honor Book),Simms Taback,1997,Viking Books
24194,067087616X,9,Froggy Gets Dressed,Jonathan London,1997,Viking Juvenile
24194,689504799,9,The Story of a Farm,John S. Goodall,1989,Margaret K. McElderry
24194,696019892,10,Better Homes and Gardens Vegetarian Recipes (Cooking for Today),Shelli McConnell,1993,Meredith Books
24194,717282783,9,On the go (My first book club),Emily Paul,1992,Grolier
24194,743229339,9,The Victoria's Secret Catalog Never Stops Coming,Jennie Nash,2001,Scribner
24194,075820177X,9,"Sex, Lies and Stereotypes",Kim Ficera,2003,Kensington Publishing Corporation
24194,761124209,10,Zobmondo: The Outrageous Book of Bizarre Choices,Randy Horn,2001,Workman Publishing
24194,805029281,8,Recovering from Rape,Linda E. Ledray,1994,Owl Books (NY)
24194,806947241,8,The funniest joke book ever!,Joseph Rosenbloom,1986,Sterling Pub. Co
24194,809117541,9,Hope for the Flowers,Trina Paulus,1973,Paulist Press
24194,810119803,6,Metamorphoses: A Play,Mary Zimmerman,2002,Northwestern University Press
24194,084233341X,10,The Life Recovery Bible: New Living Translation,David A. Stoop,1998,Tyndale House Publishers
24194,843119039,8,Patrick's Problem (Did It Happen Series),Kees Moerbeek,1987,Price Stern Sloan Pub (J)
24194,844255610,5,Mythology and You : Classical Mythology and its Relevance in Today's World,Donna Rosenberg,2001,Glencoe/McGraw-Hill
24194,875290485,10,Puck's peculiar pet shop; a tongue-twister story,Dean Walley,1970,Hallmark Children's Editions
24194,893755931,7,Mystery of the Missing Wigs (Troll Easy-to-Read Mystery),Janet Palazzo-Craig,1982,Troll Communications Llc
24194,894866370,9,The Language of Letting Go (Hazelden Meditation Series),Melody Beattie,1996,Hazelden Publishing &amp; Educational Services
24194,1562472305,8,Help!: An Absolutely Indispensable Guide to Life for Girls! (American Girl Library),Nancy Holyoke,1995,Pleasant Company Publications
24194,1562800868,8,The First Time Ever: Love Stories by Naiad Press Authors,Barbara Grier,1995,Naiad Pr
24194,1562822047,8,"Honey, I Blew Up the Kid",Todd Strasser,1992,Warner Books (Mm)
24194,1589253507,9,I Don't Want to Go to Bed,Julie Sykes,2001,Tiger Tales
24194,1591960983,10,Fear To Freedom and Beyond 911,Group Authors,2002,InstantPublisher.com
24194,189322466X,8,Room to Grow: An Appetite for Life,Tracey Gold,2003,New Millennium Press
24194,B0001GMSV2,8,Find Me,Rosie O'Donnell,2002,Warner Books
24204,439149770,9,Every Cloud Has a Silver Lining (Amazing Days of Abby Hayes),Anne Mazer,2000,Scholastic
24204,067988288X,3,Wild Magic (Immortals (Paperback)),TAMORA PIERCE,1997,Random House Books for Young Readers
24204,689841140,10,What My Mother Doesn't Know,Sonya Sones,2001,Simon &amp; Schuster Children's Publishing
24204,812097815,8,Painless Grammar (Barron's Painless Series),Rebecca Elliott,1997,Barron's Educational Series
24204,939810026,10,Priscilla,Colene Copeland,1981,Jordan Valley Heritage House
24204,1552091554,7,The Dog Encyclopedia,Esther J. J. Verhoef-Verhallen,2000,Firefly Books Ltd
24204,1562472305,7,Help!: An Absolutely Indispensable Guide to Life for Girls! (American Girl Library),Nancy Holyoke,1995,Pleasant Company Publications
24204,1562474812,9,"More Help! (American Girl Library (Middleton, Wisconsin).)",Nancy Holyoke,1996,Pleasant Company Publications
24204,1564586146,9,Encyclopedia of the Horse,Elwyn Hartley Edwards,1994,Dorling Kindersley
24209,380709597,9,Ramona the Brave (Avon Camelot Books (Paperback)),Beverly Cleary,1995,HarperTrophy
24211,316491705,7,The Soul of a New Machine,Tracy Kidder,1981,Little Brown &amp; Co
24211,385234104,8,Fatherhood,Bill Cosby,1986,Bantam Dell Pub Group
24211,399140425,5,Angel of Death,Jack Higgins,1995,Putnam Publishing Group
24211,684810204,5,The WHOLE SHEBANG : A STATE OF THE UNIVERSE S REPORT,Timothy Ferris,1997,Simon &amp; Schuster
24211,879755733,10,"Science: Good, Bad, and Bogus",Martin Gardner,1990,Prometheus Books
24215,059035342X,9,Harry Potter and the Sorcerer's Stone (Harry Potter (Paperback)),J. K. Rowling,1999,Arthur A. Levine Books
24215,074343627X,8,Dreamcatcher,Stephen King,2001,Pocket
24215,886777941,7,Beneath the Vaulted Hills : The River into Darkness,Sean Russell,1998,Daw Books
24215,097188191X,9,"Path of Glory (Boundary's Fall, 1)",Bret Mathew Funk,2002,Tyrannosaurus Press
24217,375704434,7,For the Relief of Unbearable Urges : Stories,NATHAN ENGLANDER,2000,Vintage
24217,375705171,7,Trans-Sister Radio (Vintage Contemporaries (Paperback)),CHRIS BOHJALIAN,2001,Vintage
24217,385475721,8,The Blind Assassin,Margaret Atwood,2000,Nan A. Talese
24217,385499833,7,The Solace of Leaving Early : A Novel,HAVEN KIMMEL,2002,Doubleday
24217,743218035,8,The Keepers of Truth: A Novel,Michael Collins,2001,Scribner
24217,805064958,7,A Good House,Bonnie Burnard,2000,Henry Holt &amp; Company
24220,044023722X,9,A Painted House,John Grisham,2001,Dell Publishing Company
24221,385486804,10,Into the Wild,Jon Krakauer,1997,Anchor
24222,345440765,8,The World Below (Ballantine Reader's Circle),SUE MILLER,2002,Ballantine Books
24223,380789019,8,Neverwhere,Neil Gaiman,1998,Avon
24224,385314698,7,The Sixteen Pleasures: A Novel,Robert Hellenga,1995,Delta
24226,446611239,8,The Cabinet of Curiosities,Douglas Preston,2003,Warner Books
24234,253372658,7,Haydn: His Life and Music,H.C. Robbins Landon,1988,Indiana Univ Pr
24234,316035297,8,Bachanalia: The Essential Listener's Guide to Bach's Well-Tempered Clavier,Eric Lewin Altschuler,1994,Little Brown &amp; Co
24234,081281925x,8,An irreverent and thoroughly incomplete social history of almost everything,Frank Muir,1976,Stein and Day
24236,618112200,4,Oggi in Italia: A First Course in Italian,Franca Celli Merlonghi,2001,Not Avail
24240,767905385,8,Catch Me If You Can: The True Story of a Real Fake,Stan Redding,2000,Broadway
24242,399140824,9,Come to Grief,Dick Francis,1995,Putnam Pub Group
24243,446363170,10,Cape Cod,William Martin,1992,Warner Books
24250,2070415732,10,Fahrenheit 451 (Collection Folio),Ray Bradbury,2002,Distribooks Inc
24251,61052507,7,"Feet of Clay: A Novel of Discworld (Pratchett, Terry. Discworld Series.)",Terry Pratchett,1996,HarperPrism
24256,385505833,8,Skipping Christmas,JOHN GRISHAM,2001,Doubleday
24261,971880107,6,Wild Animus,Rich Shapero,2004,Too Far
24262,671664271,7,Lost Horizon,James Hilton,1988,Pocket
24267,446610623,7,Futures : Four Novellas,Ian McDonald,2001,Aspect
24267,449300439,9,The Time Machine / The War of the Worlds,H. G. Wells,1991,Fawcett Books
24267,812577663,7,The Siege of Eternity (Eschaton Sequence),Frederik Pohl,1998,Tor Books
24278,345417623,7,Timeline,MICHAEL CRICHTON,2000,Ballantine Books
24283,3257233191,9,Business Class. Geschichten aus der Welt des Managements.,Martin Suter,2002,Diogenes Verlag
24283,3404920767,7,Der Dieb der sÃ?Â¼Ã?Â?en Dinge. Commissario Montalbanos dritter Fall.,Andrea Camilleri,2001,LÃ?Â¼bbe
24283,357012701X,9,Schlimmes Ende. ( Ab 10 J.).,Philip Ardagh,2002,Chronik Verlag im Bertelsmann LEXIKON Verlag GmbH
24283,3821806710,7,Dufays Requiem.,Wolfgang SchlÃ?Â¼ter,2001,Eichborn
24284,871206404,8,"Visual Literacy: Learn to See, See to Learn",Lynell Burmark,2002,Association for Supervision &amp; Curriculum Deve
24299,440218667,7,The Select,F. Paul Wilson,1995,Dell
