User-ID,ISBN,Book-Rating,Book-Title,Book-Author,Year-Of-Publication,Publisher
56399,1588810224,10,The Scream,Skipp,2001,Stealth Press
56399,1592241255,10,The Leaky Establishment,David Langford,2003,Cosmos Books (NJ)
56399,1841810150,10,Voices from the Earth: A Handbook for the Modern Shaman,Nicholas Wood,2000,Godsfield Press
56399,1841810517,10,The Smudge Pack,Jane Alexander,2001,Godsfield Press
56399,1841811343,10,The Summer Solstice,John Matthews,2002,Godsfield Press
56399,1843336227,10,The Wicca Book of Days,Sheena Morgan,2003,Vega
56399,1850520453,10,Study In Scarlet,Arthur Conan Doyle,0,Peerage
56399,1850586764,10,Your Brilliant Guide to the 1999 Total Solar Eclipse,Walter Berg,1999,Sigma Press
56399,1851168036,10,Bats in the Garden,Shirley Thompson,1996,Chalksoft
56399,1851459251,10,The Key to the Kingdom: An Enchanted Deck,Tony Meeuwissen,1992,Chrysalis Books
56399,1851523812,10,The Complete Illustrated Works Of William Shakespeare,William Shakespeare,2000,Sterling Publishing
56399,1851708820,10,Illustrated Guide to Celtic Mythology,T W Rolleston,1993,Studio Editions Ltd
56399,1852303832,10,The Elements of Native American Traditions (The Elements of),Arthur Versluis,1993,Element Books
56399,1852305614,10,The Encyclopaedia of Celtic Wisdom: The Celtic Shaman's Sourcebook,Caitlin Matthews,1994,Element Books Ltd
56399,1852305665,10,The Little Book of Native American Wisdom (Element's Little Book Series),Steven McFadden,1994,Element Books Ltd
56399,1852306688,10,Earth Medicine: Revealing Hidden Teachings of the Native American Medicine Wheel (Earth Quest),Kenneth Meadows,1996,Element Books Ltd.
56399,1852307943,10,Shamanism (The Element Library Series),Nevill Drury,1996,Element Books Ltd.
56399,1852308478,10,The Complete Illustrated Holistic Herbal: A Safe and Practical Guide to Making and Using Herbal Remedies,David Hoffmann,1996,Element Books Ltd.
56399,1853044555,10,Cooking with Asterix,Marie-Christine Crabos,1992,Ravette Publishing Ltd
56399,1853063665,10,A Dictionary of Sussex Folk Medicine,Andrew Allen,1995,Countryside Books
56399,185326007X,7,Women in Love (Wordsworth Classics),D. H. Lawrence,1997,NTC/Contemporary Publishing Company
56399,1853260495,7,The Last of the Mohicans (Wordsworth Classics),James Fenimore Cooper,1997,NTC/Contemporary Publishing Company
56399,1853260533,7,Collected Ghost Stories (Classics Library (NTC)),Montague Rhodes James,1999,NTC/Contemporary Publishing Company
56399,1853263230,10,Dictionary of Medical Folklore,C. A. Rinzler,1999,Lb May &amp; Assoc Inc
56399,1853263451,10,Culpeper's Complete Herbal: A Book of Natural Remedies of Ancient Ills (The Wordsworth Collection Reference Library),Nicholas Culpeper,1998,NTC/Contemporary Publishing Company
56399,1853263893,10,Guide to Poisons and Antidotes,Carol Turkington,1999,Lb May &amp; Assoc Inc
56399,1853361208,10,"Dracula's Brood: Neglected Vampire Classics by Sir Arthur Conan Doyle, Algernon Black E, Algernon Blackwood, M.R.James and Others",Richard Dalby,1989,HarperCollins Publishers
56399,1853915262,6,Woodlands in Cross Stitch (Cross Stitch Ser),Angela Beazley,1999,Tuttle Publishing
56399,1854710443,10,The Observer's Book of Rocks and Minerals,Richard Atkinson,1996,Godfrey Cave / Claremont
56399,1854872311,10,H.P. Lovecraft's Book of Horror,Stephen Jones,1994,Constable Robinson
56399,1855012499,10,Modern Herbal,M Grieve,0,Tiger Books Intl
56399,1855323990,10,Indycar (Osprey Motor Sport),Kris Perkins,1993,Motorbooks International
56399,185538048X,10,Discover Tarot: Understanding and Using Tarot Symbolism (Workbook),Emily. Peach,1990,HarperCollins Publishers
56399,1855385074,10,Principles of Paganism (Principles of ...),Viviane Crowley,1996,Thorsons Publishers
56399,1855496704,8,Harry Potter and the Philosopher's Stone (Cover to Cover),J.K. Rowling,2000,BBC Consumer Publishing
56399,1856262944,10,100 Great Natural Remedies: Using Healing Plants at Home,Penelope Ody,1998,K. Cathie
56399,1856263053,10,Witches - An Encyclopedia of Paganism and Magic,Michael Jordan,1998,Trafalgar Square Publishing
56399,185669075X,10,The shadow catchers: Images of the American Indian,Paula Richardson Fleming,1996,L. King
56399,1857231813,10,Expecting Someone Taller,Tom Holt,0,Firebird Distributing
56399,1857233689,10,Encyclopaedia of Fantasy,John Clute,1997,Orbit
56399,1857701313,10,The Green Man Companion and Gazetteer,Ronald Millar,1997,John Nickalls Publications
56399,1857982436,10,Sins of the Blood,Kristine Kathryn Rusch,0,Orion Publishing Group
56399,1858283051,10,The Rough Guide to Romania (Rough Guides),Tim Burford,1998,Rough Guides Limited
56399,1858334780,10,The Anglo-Saxon Chronicles,Anne Savage,1997,BHB International
56399,1858683858,10,Ultimate Encyclopedia of Science Fiction the De,David Pringle,0,Carlton Books Ltd
56399,1858911567,10,Treasure,Dan James,1994,Ordnance Survey
56399,1859060080,10,White Eagle Medicine Wheel,Wa-Na-Nee-Che,1997,Connections Book Publishing
56399,1859580513,10,Gerards Herbal History of Plants,John Gerard,1994,Studio Limited
56399,1859580726,10,Book of Werewolves,Sabine Baring-Gould,1995,Senate
56399,1861050593,10,The A-Z of Names in Rock: And the Amazing Stories Behind Them,Mark Beech,1999,Robson Books
56399,1861081154,10,Celtic Knotwork Handbook,Sheila Sturrock,2000,Sterling Publishing
56399,1861630360,10,Teachings of the Wisewomen,Rhiannon Ryall,2000,Holmes Pub Group Llc
56399,1861631596,10,A Witch's Kitchen,Val Thomas,2003,Holmes Pub Group Llc
56399,1862040222,10,The Medicine Way: A Shamanic Path to Self Mastery (The \Earth Quest\ Series),Kenneth Meadows,1997,Element Books Ltd.
56399,1862040494,10,The Little Book of Celtic Wisdom (The \Little Books\ Series),Giulietta Wood,1997,Houghton Mifflin
56399,1862041156,10,Eight Easy Lessons (The \Feng Shui Fundamentals\ Series),Lillian Too,1997,Element Books Ltd.
56399,1862047618,10,New Perspectives: Shamanism,Nevil Drury,2000,Harper Collins - UK
56399,1862050767,10,The Songs My Paddle Sings: Native American Legends,James Riordan,1997,Pavilion Books
56399,186205102X,10,Bizarre Books,Russell Ash,1998,Pavilion Books
56399,1869893069,10,Green and Pleasant Land: The British 1920s-1930s Gthulhu Sourcepack (Call of Cthulhu),Pete Tamlyn,1987,Games Workshop Ltd
56399,187033860X,10,Alligator Alley,Mink Mole,1989,Morrigan Publications
56399,1871197945,10,Beat Your Relatives to a Blood...,Maximillian Decharne,1989,Malice Aforethought Press
56399,1871438160,10,The Necronomicon,George Hay,1993,Skoob Books Pub Ltd
56399,187143890X,10,The R'Lyeh Text: Hidden Leaves from the Necronomicon (Skoob Esoterica),Robert Turner,1995,Skoob Books
56399,1871592321,10,The Starry Wisdom : A Tribute to H P Lovecraft,H. P. Lovecraft,1995,Creation Books
56399,1871615011,10,Book-worm Droppings,Shaun Tyas,1988,Paul Watkins Publishing
56399,1873335008,10,Rennes-le-chÃ¢teau: Its mysteries and secrets,R. Lionel Fanthorpe,1991,Bellevue Books
56399,187474436X,10,Scotch Whisky,David Daiches,1998,Birlinn Publishers
56399,1881316637,10,The Lost Books of the Bible and the Forgotten Books of Eden,Frank Crane,1994,A &amp; B Book Dist Inc
56399,1887797009,10,Coming Full Circle,John H Crowe,1995,Pagan Pub
56399,1887797068,10,A Guide to the Cthulhu Cult,Fred L. Pelton,1998,Armitage House
56399,1887797157,10,The Lurker in the Lobby: A Guide to the Cinema of H.P. Lovecraft,John Strysik,2000,Armitage House
56399,1892065487,7,A Taste of Blood Wine,Freda Warrington,2002,Meisha Merlin Publishing
56399,1897853424,10,"The folk-lore of the Isle of Man: Being an account of its myths, legends, superstitions, customs &amp; proverbs",A. W Moore,1994,Llanerch
56399,1898281238,10,"Leechcraft: Early English Charms, Plantlore and Healing",Stephen Pollington,2001,Anglo-Saxon Books
56399,1901680290,10,Waking Ned Devine: An Original Screenplay,Kirk Jones,1999,ScreenPress Books
56399,1902418158,10,Crop Circles,Michael Glickman,1999,Wooden Books
56399,1902418204,10,Leys,Danny Sullivan,2000,Wooden Books
56399,1902418239,10,Avebury,Evelyn Francis,0,Wooden Books
56399,1902579321,10,Encyclopedia of native tribes of North America,Michael Johnson,2001,Compendium
56399,1903065186,10,Fortune Telling by Tarot Cards,Sasha Fenton,2002,Zambezi Publishing
56399,1904263089,10,"Callanish, and Other Megalithic Sites of the Outer Hebrides",Gerald Ponting,2003,Wooden Books
56399,1904492118,10,Earthdoom,David Langford,2003,Bewrite Books
56399,2290300691,10,Vampire Junction,S. P Somtow,2000,J'ai lu
56399,3829029853,10,The Cultures of Native North Americans,Christian F. Feest,2000,Konemann
56401,3518370340,8,Der futurologische KongreÃ?Â?.,Stanislaw Lem,2001,Suhrkamp
56406,60745908,10,Wicked Musical Tie-in Edition : The Life and Times of the Wicked Witch of the West,Gregory Maguire,2004,Regan Books
56406,345391802,9,The Hitchhiker's Guide to the Galaxy,Douglas Adams,1995,Ballantine Books
56423,312278586,10,The Nanny Diaries: A Novel,Emma McLaughlin,2002,St. Martin's Press
56424,345310020,8,Chronicle of a Death Foretold,GABRIEL GARCIA MARQUEZ,1984,Ballantine Books
56425,679864423,10,"Sunshine, Moonshine (Step-Into-Reading, Step 1)",JENNIFER ARMSTRONG,1997,Random House Books for Young Readers
56425,761109196,10,Children Learn What They Live: Parenting to Inspire Values,Dorothy Law Nolte,1998,Workman Publishing
56425,914846248,10,Explore Arizona! (Arizona and the Southwest),Rick Harris,1986,Golden West Publishers (AZ)
56425,966431502,5,Breaking the Chain of Low Self-Esteem,Marilyn J. Sorensen,1998,Wolf Publishing Company (OR)
56425,8880293699,10,Arizona,Jerry Camarillo Dunn,1998,Distributed by Eiron
56427,679436448,7,CORELLI'S MANDOLIN : A Novel,LOUIS DE BERNIERES,1994,Pantheon
56442,312283377,9,The Northern Lights,Howard Norman,2001,Picador USA
56442,440224594,8,The Return Journey,MAEVE BINCHY,1999,Dell
56442,440225779,9,The Uncanny,Andrew Klavan,1998,Dell Publishing Company
56442,452277175,8,Memories of My Ghost Brother,Heinz Insu Fenkl,1997,Plume Books
56442,671617028,10,The Color Purple,Alice Walker,1985,Pocket Books
56442,888012659,7,Beatrice,Monica Kidd,2001,Turnstone Press
56442,920541941,9,Beginnings,Dorothy Livesay,1989,Turnstone Press
56442,1896300561,8,Whipstock (Nunatak Fiction),Barb Howard,2002,NeWest Press
56445,142002631,5,The Terra-Cotta Dog: An Inspector Montalbano Mystery,Andrea Camilleri,2003,Penguin Books
56445,747554870,7,Capri File,Amanda Prantera,2001,Trafalgar Square
56445,1840281219,7,Garden Projects (Done in a Day),Stewart Walton,1999,Marshall Editions
56447,60507772,10,The Last Hero : A Discworld Fable,Terry Pratchett,2002,Eos
56447,60830956,9,Brave New World,Aldous Huxley,1984,HarperCollins Publishers
56447,60928336,8,Divine Secrets of the Ya-Ya Sisterhood: A Novel,Rebecca Wells,1997,Perennial
56447,60929596,9,As Nature Made Him : The Boy Who Was Raised as a Girl,John Colapinto,2001,Perennial
56447,60958022,8,Five Quarters of the Orange,Joanne Harris,2002,Perennial
56447,61020400,9,The Fifth Elephant: A Novel of Discworld,Terry Pratchett,2001,HarperTorch
56447,006105691X,9,Maskerade (Discworld Novels (Paperback)),Terry Pratchett,1998,HarperTorch
56447,61091480,3,Your Erroneous Zones,"Wayne W., Dr. Dyer",1997,HarperTorch
56447,64401510,9,Mrs. Piggle-Wiggle's Magic,Betty MacDonald,1985,HarperTrophy
56447,64407055,9,Ella Enchanted (Trophy Newbery),Gail Carson Levine,1998,HarperTrophy
56447,72347201,4,The Living World,George B. Johnson,2002,McGraw-Hill Science/Engineering/Math
56447,007248036X,6,Taking Sides: Clashing Views on Controversial Moral Issues (Taking Sides),Stephen Satris,2001,Dushkin/McGraw-Hill
56447,135276713,1,Leadership : Multidisciplinary Perspectives,Barbara Kellerman,1983,Pearson Education
56447,140067477,8,The Tao of Pooh,Benjamin Hoff,1983,Penguin Books
56447,140119906,6,Love in the Time of Cholera (Penguin Great Books of the 20th Century),Gabriel Garcia Marquez,1994,Penguin Books
56447,140481346,4,Death of A Salesman,Arthur Miller,1998,Penguin USA (Paper)
56447,142001619,8,Salt: A World History,Mark Kurlansky,2003,Penguin Books
56447,142002267,6,"Word Freak: Heartbreak, Triumph, Genius, and Obsession in the World of Competitive Scrabble Players",Stefan Fatsis,2002,Penguin Books
56447,142437174,7,The Adventures of Huckleberry Finn (Penguin Classics),Mark Twain,2002,Penguin Books
56447,146000366,8,The Black Monk (Penguin 60s S.),Anton Chekhov,1995,Penguin Books Ltd
56447,151004374,8,"The Iron Tonic: Or, A Winter Afternoon in Lonely Valley",Edward Gorey,2000,Harcourt
56447,192833669,8,"Frankenstein, Or, the Modern Prometheus: The 1818 Text (Oxford World's Classics)",Mary Wollstonecraft Shelley,1998,Oxford University Press
56447,198323727,7,Candide (Clarendon French Series),Francois M. De Voltaire,1968,Oxford University Press
56447,275961206,4,"Ethics, the Heart of Leadership",Joanne B. Ciulla,1998,Praeger Paperback
56447,275972801,7,Security in a Changing World : Case Studies in U.S. National Security Management,Volker C. Franke,2002,Praeger Paperback
56447,275978397,7,The United Nations and Iraq : Defanging the Viper,Jean E. Krasno,2003,Praeger Paperback
56447,310218039,8,Eli,Bill Myers,2000,Zondervan Publishing Company
56447,312278586,7,The Nanny Diaries: A Novel,Emma McLaughlin,2002,St. Martin's Press
56447,312860137,7,The Black Cat,Robert Poe,1997,Tor Books
56447,312868855,1,Hell House,Richard Matheson,1999,Tor Books
56447,316153664,6,Me and the Terrible Two,Ellen Conford,1991,Little Brown &amp; Co
56447,316666343,8,The Lovely Bones: A Novel,Alice Sebold,2002,"Little, Brown"
56447,316776963,7,Me Talk Pretty One Day,David Sedaris,2001,Back Bay Books
56447,345339495,8,Nerilka's Story (Dragonriders of Pern (Paperback)),Anne McCaffrey,1995,Del Rey Books
56447,345350588,7,Source of Magic (Xanth Novels (Paperback)),Piers Anthony,1990,Del Rey Books
56447,345413350,7,"The Golden Compass (His Dark Materials, Book 1)",PHILIP PULLMAN,1997,Del Rey
56447,345416260,9,Pope Joan (Ballantine Reader's Circle),Donna Woolfolk Cross,1996,Ballantine Books
56447,345418824,8,The Harlot by the Side of the Road: Forbidden Tales of the Bible,Jonathan Kirsch,1998,Ballantine Books
56447,375702709,7,A Lesson Before Dying (Vintage Contemporaries (Paperback)),Ernest J. Gaines,1997,Vintage Books USA
56447,380452030,8,Keeper of the Children,William H. Hallahan,1979,Harper Mass Market Paperbacks (Mm)
56447,380491710,9,"Good Work, Amelia Bedelia",Peggy Parish,1980,Harper Mass Market Paperbacks
56447,380708655,5,The Doll in the Garden,Mary Downing Hahn,1990,HarperTrophy
56447,380732181,3,An Underachiever's Diary,Benjamin Anastas,1999,Perennial
56447,380752859,8,For Love of Evil : Book Six of Incarnations of Immortality (Incarnations of Immortality (Paperback)),Piers Anthony,1990,Eos
56447,038077593X,7,The Druid Curse (An Avon Camelot Book),Lou Kassem,1994,Harpercollins Juvenile Books
56447,380789035,7,American Gods,Neil Gaiman,2002,HarperTorch
56447,380794934,6,The Calcutta Chromosome,Amitav Ghosh,1998,William Morrow
56447,380978407,8,"Lamb: The Gospel According to Biff, Christ's Childhood Pal",Christopher Moore,2002,William Morrow &amp; Company
56447,385474016,8,"Like Water for Chocolate: A Novel in Monthly Installments With Recipes, Romances and Home Remedies",Laura Esquivel,1994,Anchor Books/Doubleday
56447,393050939,8,Stiff: The Curious Lives of Human Cadavers,Mary Roach,2003,W. W. Norton &amp; Company
56447,394580613,7,A History of the World in 10-1/2 Chapters,Julian Barnes,1989,Random House Inc
56447,394702891,7,Harmless People,Elizabeth Marshall Thomas,1965,Random House Trade
56447,394747232,8,Maus a Survivors Tale: My Father Bleeds History,Art Spiegelman,1986,Pantheon Books
56447,439064872,8,Harry Potter and the Chamber of Secrets (Book 2),J. K. Rowling,2000,Scholastic
56447,439404371,10,The Thief Lord,Cornelia Funke,2002,Scholastic
56447,044017242X,6,"Reach for the Sky (Candlelight Ecstasy Supreme, No 73)",Barbara Andrews,1985,Dell Publishing
56447,440219078,8,The Giver (21st Century Reference),LOIS LOWRY,1994,Laure Leaf
56447,440402670,5,"Handle With Care (Pen Pals, No 7)",Sharon Dennis Wyeth,1990,Yearling Books
56447,440465230,5,Nobody's Fault,Patricia Hermes,1989,Yearling Books
56447,440479207,4,Star Shine,Constance Greene,1987,Yearling Books
56447,440943760,5,Karen,Marie Lyons Killilea,1987,Laurel-Leaf Books
56447,440995779,6,The Witch of Blackbird Pond (Laurel Leaf Books),ELIZABETH GEORGE SPEARE,1978,Laure Leaf
56447,441783589,7,Starship Troopers,Robert A. Heinlein,1987,Ace Books
56447,044900371X,6,The Orchid Thief (Ballantine Reader's Circle),Susan Orlean,2000,Ballantine Books
56447,449300242,7,Maggie: A Girl of the Streets,Stephen Crane,1995,Fawcett Books
56447,451129768,8,The Science fictional olympics (Isaac Asimov's wonderful worlds of science fiction),Isaac Asimov,1984,New American Library
56447,451134699,4,2001,Arthur Clarke,1982,Penguin Putnam~mass
56447,451183746,7,Road to Wellville,T. Coraghessan Boyle,1994,New Amer Library (Mm)
56447,452281148,8,Free Drinks for Ladies With Nuts: Delightfully Mangled English from Around the World,Jane O'Boyle,2000,Plume Books
56447,460876287,9,The Invisible Man: A Grotesque Romance (Everyman's Library(Paper)),H. G. Wells,1995,Everymans Library
56447,465026079,3,Good Work: When Excellence and Ethics Meet,Howard Gardner,2001,Basic Books
56447,515132187,8,The Villa,Nora Roberts,2002,Jove Books
56447,515133639,8,The Absence of Nectar,Kathy Hepinstall,2002,Jove Books
56447,517595338,8,203 Ways to Drive a Man Wild in Bed,Olivia St. Claire,1993,Harmony
56447,552143243,7,The Discworld Mapp,Terry Pratchett,1995,Corgi
56447,553158260,8,"The Ghost in the Attic (Haunting With Louisa, Book 1)",Emily Cates,1990,Skylark Books
56447,553212478,8,Frankenstein (Changing Our World),Mary Wollstonecraft Shelley,1984,Bantam
56447,553290797,4,Black Trillium,Marion Zimmer Bradley,1991,Bantam
56447,553298666,9,"Bridie of the Wild Rose Inn (Wild Rose Inn, No 1)",Jennifer Armstrong,1994,Starfire
56447,553573985,9,Gibbon's Decline and Fall,Sheri S. Tepper,1997,Bantam Books
56447,553584189,9,Night Fires,KAREN HARBAUGH,2003,Dell
56447,575056991,7,Mort Big Comic,Pratchett,1994,McClelland &amp; Stewart Ltd
56447,575600306,8,The Discworld Companion,Stephen Briggs,1997,Books Britain
56447,590044494,8,Ginnie's Baby Sitting Business,Catherine Woolley,1981,Scholastic
56447,059035342X,7,Harry Potter and the Sorcerer's Stone (Harry Potter (Paperback)),J. K. Rowling,1999,Arthur A. Levine Books
56447,590403885,8,Cassie Bowen Takes Witch Lessons,Anna Grossnickle Hines,1987,Scholastic Paperbacks (Mm)
56447,590403990,6,More Magic Science Tricks,Dinah Moche,1981,Scholastic Paperbacks (Mm)
56447,590406418,5,"Patti's Luck (Sleepover Friends, No 1)",Susan Saunders,1987,Scholastic Paperbacks
56447,590406434,5,"Kate's Surprise (Sleepover Friends, No 3)",Susan Saunders,1987,Scholastic
56447,590406442,5,"Patti's New Look (Sleepover Friends, No 4)",Susan Saunders,1988,Scholastic
56447,590409212,8,The Haunting of Grade Three (Lucky Star),Grace Maccarone,1987,Scholastic Paperbacks
56447,590409662,5,Rent a Third Grader (Little Apple),B.B. Hiller,1996,Scholastic
56447,590415034,5,"A Dog for Jesse (Animal Rescue Farm, No 3)",Sharon M. Hart,1989,Scholastic Paperbacks (Mm)
56447,590416677,5,Margaret's Moves,Berniece Rabe,1988,Scholastic Paperbacks (Mm)
56447,590417827,5,"Karen's Kittycat Club (Baby-Sitters Little Sister, 4)",Ann M. Martin,1989,Scholastic Paperbacks
56447,590419919,5,Second-Hand Magic,Ruth Chew,1986,Scholastic Paperbacks (Mm)
56447,590422677,8,Avalanche,Arthur Roth,1989,Scholastic Paperbacks (Mm)
56447,590428195,5,"Kate's Surprise Visitor (Sleepover Friends, No. 23)",Susan Saunders,1990,Scholastic
56447,590431897,5,"Kate the Boss (Sleepover Friends, No 29)",Susan Saunders,1990,Scholastic
56447,590431919,5,"Lauren's New Address (Sleepover Friends, No 28)",Susan Saunders,1990,Scholastic
56447,590431943,5,"Lauren's New Friend (Sleepover Friends, No 24)",Susan Saunders,1990,Scholastic
56447,590432117,6,Angela and the Broken Heart,Nancy K. Robinson,1992,Scholastic
56447,590433563,6,Family Picture,Dean Hughes,1990,Scholastic Paperbacks (Mm)
56447,590434616,5,The Dollhouse Murders,Betty Ren Wright,1989,Scholastic
56447,590435175,5,Lisa's War,Carol Matas,1995,Scholastic Paperbacks (Mm)
56447,590435736,5,"Dawn and the Big Sleepover (Baby-Sitters Club, 44)",Ann M. Martin,1992,Scholastic Paperbacks
56447,590439294,5,"Big Sister Stephanie (Sleepover Friends, No. 30)",Susan Saunders,1990,Scholastic Paperbacks (Mm)
56447,590440225,5,"The Mystery (Dear Diary, No 4)",Carrie Randall,1991,Scholastic
56447,590440284,5,"Friends 'Till the Ocean Waves (Friends 4-Ever, No. 6/Paperback Book and Friendship Bracelet)",Deidre Corey,1990,Scholastic Paperbacks (T)
56447,590456571,5,"Keep Out, Claudia! (Baby-Sitters Club, 56)",Ann M. Martin,1993,Scholastic
56447,590457551,5,Between Two Worlds,Candice F. Ransom,1994,Scholastic
56447,590460390,5,Valentine Frankenstein,Maggie Twohill,1994,Scholastic
56447,590461591,5,Bruce Coville's Book of Monsters: Tales to Give You the Creeps,Bruce Coville,1995,Scholastic Paperbacks (Mm)
56447,590473468,5,In Quest of Ghosts,Hans Holzer,1993,Scholastic Paperbacks (Mm)
56447,590509640,5,Turkey Trouble,Patricia Hermes,1996,Scholastic
56447,590996835,10,Matilda,Roald Dahl,1996,Scholastic Inc.
56447,061810450X,8,The Wind Done Gone: A Novel,Alice Randall,2001,Houghton Mifflin
56447,670869902,6,How Stella Got Her Groove Back,Terry McMillan,1996,Viking Books
56447,670887315,10,Disgrace,J. M. Coetzee,1999,Viking Books
56447,671002783,7,God on a Harley : Twelve Real Life Love Stories,Joan Brady,1996,Pocket
56447,671003755,8,She's Come Undone (Oprah's Book Club (Paperback)),Wally Lamb,1996,Washington Square Press
56447,671041789,10,The Green Mile,Stephen King,1999,Pocket
56447,671442686,8,Restaurant at the End of the Universe,Douglas Adams,1982,Pocket
56447,671496107,1,Immortal Poems of the English Language,Oscar Williams,1983,Pocket
56447,671560212,9,Miss Pickerell Goes to the Arctic,Ellen MacGregor,1981,Pocket Books
56447,671655507,8,FRANKENSTEIN PAPRS,Fred Saberhagen,1986,Baen
56447,671721135,6,THROUGH THE ICE,Piers Anthony,1992,Baen
56447,671733354,10,How to Stop Worrying and Start Living,Dale Carnegie,1990,Pocket
56447,672504774,7,Second-Hand Family,R. Parker,1966,Bobbs-Merrill Co
56447,679721037,6,Hiroshima,John Hersey,1989,Vintage Books USA
56447,679724222,5,Holidays in Hell,P.J. O'Rourke,1992,Vintage Books USA
56447,679729771,9,Maus a Survivors Tale: And Here My Troubles Begin (Maus),Art Spiegelman,1992,Pantheon Books
56447,679833692,7,Juniper,MONICA FURLONG,1992,Random House Books for Young Readers
56447,684800713,3,Sun Also Rises,Ernest Hemingway,1995,Scribner
56447,684818868,6,Lies My Teacher Told Me : Everything Your American History Textbook Got Wrong,James W. Loewen,1996,Touchstone
56447,684857820,8,Lucky,Alice Sebold,1999,Scribner
56447,688037852,7,Ramona Forever (Ramona Quimby (Hardcover)),Beverly Cleary,1984,HarperCollins
56447,689817851,7,Go Ask Alice,Anonymous,1998,Simon Pulse
56447,689821387,6,A Wolf At the Door,Ellen Datlow,2000,Simon &amp; Schuster Children's Publishing
56447,689860064,7,"Dragondrums (Mccaffrey, Anne. Harper Hall Trilogy, V. 3.)",Anne McCaffrey,2003,Aladdin
56447,740728946,7,Groovitude: A Get Fuzzy Treasury,Darby Conley,2002,Andrews McMeel Publishing
56447,760704066,8,The 101 Dalmations,Dodie Smith,1996,Barnes Noble
56447,764222120,6,The Crossroad,Beverly Lewis,1999,Bethany House Publishers
56447,764227173,7,The Covenant (Abram's Daughters),Beverly Lewis,2002,Bethany House Publishers
56447,764228765,7,"The Sacrifice (Lewis, Beverly)",Beverly Lewis,2004,Bethany House Publishers
56447,782480411,7,Mary Engelbreit's bountiful harvest,Mary Engelbreit,1994,Antioch Pub. Co
56447,786227133,6,The Postcard (Thorndike Large Print Christian Fiction),Beverly Lewis,2000,Thorndike Press
56447,786865504,8,World of Pies : A Novel,Karen Stolz,2000,Hyperion
56447,800781724,4,Raptured: A Novel on the Second Coming of the Lord!,Ernest W. Angley,1950,Spire Books
56447,801060044,5,Genesis Record: A Scientific and Devotional Commentary on the Book of Beginnings,Henry M. Morris,1981,Baker Books
56447,801064392,6,\But Don't All Religions Lead to God?\,Michael Green,2002,Baker Books
56447,802483305,10,And the Bride Wore White: The Seven Secrets to Sexual Purity (Fantastic Book for Teen Girls),Dannah Gresh,2000,Moody Publishers
56447,804106665,7,Paris 2005,Carlo Zezza,1991,Ivy Books
56447,804111154,7,Maybe (Maybe Not : Second Thoughts from a Secret Life),Robert Fulghum,1995,Ivy Books
56447,805055452,8,I Wouldn't Thank You for a Valentine : Poems For Young Feminists,Carol Ann Duffy,1997,Henry Holt and Co. (BYR)
56447,806638370,6,Hello Night!: Healing Thoughts for Sleepless Nights,Herbert F. Brokering,1999,Augsburg Fortress Publishers
56447,812514459,8,Thomas the Rhymer: A Romance,Ellen Kushner,1991,Tor Books (Mm)
56447,081297106X,8,Reading Lolita in Tehran: A Memoir in Books,Azar Nafisi,2003,Random House Trade Paperbacks
56447,816704678,5,Dorothy and the Wizard of Oz (Complete and Unabridged Classics),L. Frank Baum,1985,Troll Communications Llc
56447,816707960,5,Ozma of Oz,Frank L. Baum,1987,Troll Communications Llc
56447,816708487,5,Emerald City of Oz,Frank L. Baum,1987,Troll Communications Llc
56447,816722595,5,"Be Ever Hopeful, Hannalee (A Troll Book)",Patricia Beatty,1991,Troll Communications
56447,822216310,8,Santaland Diaries &amp; Seasons Greetings: 2 Plays,David Sedaris,1998,Dramatists Play Service Inc
56447,830902732,2,Book of Mormon (11-0176-5),Joseph Smith,1973,Herald Publishing House
56447,842329129,6,Left Behind: A Novel of the Earth's Last Days (Left Behind No. 1),Tim Lahaye,1996,Tyndale House Publishers
56447,842329242,9,Nicolae: The Rise of Antichrist (Left Behind No. 3),Tim F. Lahaye,1998,Tyndale House Publishers
