User-ID,ISBN,Book-Rating,Book-Title,Book-Author,Year-Of-Publication,Publisher
168954,765342308,5,Briar Rose,Jane Yolen,2002,Tor Teen
168954,767902890,8,The Things They Carried,TIM O'BRIEN,1998,Broadway
168954,767912233,7,Babyville,JANE GREEN,2003,Broadway
168954,802135226,9,The Passion,Jeanette Winterson,1997,Grove Press
168954,826328091,7,The Education of Little Tree,Forrest Carter,2001,University of New Mexico Press
168954,1556616074,9,"Dreamers (Legacies of the Ancient River, 1)",Angela Elwell Hunt,1996,Bethany House Publishers
168954,1556616082,9,Brothers (Legacies of the Ancient River),Angela Elwell Hunt,1997,Bethany House Publishers
168954,1556616090,8,Journey (Legacies of the Ancient River),Angela Elwell Hunt,1997,Bethany House Publishers
168954,1570083584,9,"So Great a Cause (Work and the Glory, Vol 8)",Gerald N. Lund,1997,Deseret Book Co
168959,312201656,7,I Capture the Castle,Dodie Smith,1999,St. Martin's Griffin
168963,140263357,9,Comfort Woman,Nora Okja Keller,1998,Penguin Books
168970,7110928,10,Billy,Pamela Stephenson,2002,HarperCollins Entertainment
168971,312983433,8,The Viking Funeral (A Shane Scully Novel),Stephen J. Cannell,2002,St. Martin's Paperbacks
168971,312995423,8,Digital Fortress : A Thriller,Dan Brown,2003,St. Martin's Press
168971,345446984,8,24/7,Jim Brown,2002,Ballantine Books
168971,039914563X,9,The Bear and the Dragon,Tom Clancy,2000,G. P. Putnam's Sons
168971,425147363,7,Tom Clancy's Op-Center (Tom Clancy's Op Center (Paperback)),Tom Clancy,1995,Berkley Publishing Group
168971,042517400X,8,"Night Moves (Tom Clancy's Net Force, No. 3)",Tom Clancy,2000,Berkley Publishing Group
168971,425187365,8,The Graveyard Shift,Jack Higgins,2002,Berkley Publishing Group
168971,440236053,7,Writ of Execution,Perri O'Shaughnessy,2002,Dell Publishing Company
168971,440241537,9,The King of Torts,JOHN GRISHAM,2003,Dell
168971,451204778,8,Impaired Judgement,David Compton,2001,Signet Book
168971,451205626,8,Cold Paradise (Stone Barrington Novels (Paperback)),Stuart Woods,2002,Signet Book
168971,451211561,7,Capital Crimes,Stuart Woods,2004,Signet Book
168971,515130095,7,Secret Honor (Honor Bound (Paperback)),W. E. B. Griffin,2000,Jove Books
168974,553582755,10,One Door Away from Heaven,Dean R. Koontz,2002,Bantam Books
168974,843951109,9,Under the Overtree (Leisure Horror),James A. Moore,2002,Leisure Books
168974,1585671975,6,The Company: A Novel of the CIA,Robert Littell,2002,Overlook Press
168976,61084409,7,The Beach House,Georgia Bockoven,1997,HarperTorch
168978,385314337,10,The Giant's House: A Romance,Elizabeth McCracken,1996,Bantam Dell Pub Group
168980,684853280,10,CHOCOLATE FOR A WOMAN'S SOUL P.O.B.,Kay Allenbaugh,1998,Fireside
168985,60169206,1,Smoked: A True Story About the Kids Next Door,Leon Bing,1993,Harpercollins
168985,140042520,8,Dharma Bums,Jack Kerouac,1991,Penguin Books
168985,140124020,6,Clara Bow: Runnin' Wild,David Stenn,1990,Penguin USA
168985,140149937,7,The Women of Deh Koh: Lives in an Iranian Village,Erika Friedl,1991,Penguin Books
168985,140235396,6,Memoirs of a Beatnik,Diane Di Prima,1998,Penguin Books
168985,345353943,8,Be True to Your School: A Diary of 1964,Bob Greene,1990,Ballantine Books
168985,345376641,8,He Was a Midwestern Boy on His Own,Bob Greene,1992,Ballantine Books
168985,038045534X,10,Mozart,Marcia Davenport,1991,Harper Mass Market Paperbacks (Mm)
168985,380698846,10,Mozart and Constanze,Francis Carr,1991,Harper Mass Market Paperbacks (Mm)
168985,385314337,7,The Giant's House: A Romance,Elizabeth McCracken,1996,Bantam Dell Pub Group
168985,393305422,7,Mexican Pet,Jan Brunvand,1988,W. W. Norton &amp; Company
168985,394488199,4,Edie: An American Biography,Jean Stein,1984,Smithmark Pub
168985,394715918,9,Mozart,Wolfgang Hildesheimer,1985,Vintage Books USA
168985,446355569,8,The City of Joy,Dominique Lapierre,1990,Warner Books
168985,451131185,7,On the Road,Jack Kerouac,1981,Signet Book
168985,451163966,9,One Flew Over the Cuckoo's Nest,Ken Kesey,1989,Signet Book
168985,515097128,7,I'm With the Band: Confessions of a Groupie,Pamela Des Barres,1991,Jove Books
168985,553213695,8,The Metamorphosis (Bantam Classics),FRANZ KAFKA,1972,Bantam
168985,553347292,8,YOUNG MEN/CAPITAL,JOEL ROSENMAN,1989,Bantam
168985,679409424,5,Exposure,Kathryn Harrison,1993,Random House Inc
168985,679446958,9,Hitler's Willing Executioners: Ordinary Germans and the Holocaust,Daniel Jonah Goldhagen,1996,Alfred A. Knopf
168985,679724222,8,Holidays in Hell,P.J. O'Rourke,1992,Vintage Books USA
168985,679732381,6,Down These Mean Streets,Piri Thomas,1991,Random House
168985,679737898,8,Parliament of Whores: A Lone Humorist Attempts to Explain the Entire U.S. Government,P. J. O'Rourke,1992,Vintage Books USA
168985,802115039,3,A Good House: Building a Life on the Land,Richard Manning,1993,Pub Group West
168985,805210407,8,The Trial,Franz Kafka,1995,Schocken Books
168985,088739230X,3,Screams in America,David Caylor,2000,Creative Arts Book Company
168985,089804801X,7,Fart Proudly,Benjamin Franklin,1990,Enthea Press
168985,939149869,5,Taxi from Hell: Confessions of a Russian Hack,Vladimir Lobas,1993,Soho Press
168985,096368292X,8,A Prince Albert wind : poems,Wilma Elizabeth McDaniel,0,Mother Road Publications
168985,963682954,10,alternative man,Michael Phillips,1997,Mother Road Pubns
168985,967378508,7,Growing Up Brady : I Was a Teenage Greg,Barry Williams,2000,Good Guy Entertainment
168985,1885710194,6,Bookstore,Kit Andis,1997,Geekspeak Unique Press
168985,3822881899,1,Araki: Tokyo Lucky Hole,Nobuyoshi Araki,1997,Benedikt Taschen Verlag
168994,1571973141,8,Down East on Nelson Island,Karen E. Dodd,2002,Pentland Press (NC)
168999,28631757,9,The Complete Idiot's Guide to Kickboxing,Guy Mezger,2000,Alpha Books
168999,312291639,8,The Nanny Diaries: A Novel,Emma McLaughlin,2003,St. Martin's Griffin
168999,312305060,7,The Hours: A Novel,Michael Cunningham,2002,Picador
168999,031242227X,9,Running with Scissors: A Memoir,Augusten Burroughs,2003,Picador USA
168999,385335482,8,Confessions of a Shopaholic (Summer Display Opportunity),SOPHIE KINSELLA,2001,Delta
168999,385335881,7,Shopaholic Takes Manhattan (Summer Display Opportunity),Sophie Kinsella,2002,Delta
168999,385336179,5,Shopaholic Ties the Knot,Sophie Kinsella,2003,Delta
168999,452282829,8,We Were the Mulvaneys,Joyce Carol Oates,1996,Plume
168999,067976674X,6,Selected Stories,Alice Munro,1997,Vintage Books USA
168999,684854333,9,Did Trojans Use Trojans? : A TRIP INSIDE THE CORNER DRUGSTORE,Vince Staten,2000,Simon &amp; Schuster
169005,590420402,8,Wishgiver,Bill Brittain,0,Scholastic Inc
169005,743460529,7,Daddy's Little Girl,Mary Higgins Clark,2003,Pocket
169006,375705856,8,Plainsong (Vintage Contemporaries),KENT HARUF,2000,Vintage
169006,385295081,6,Golden Cup,Belva Plain,1986,Bantam Dell Pub Group
169006,385311109,7,Promises,Belva Plain,1996,Bantam Dell Pub Group
169006,440216818,6,Daybreak,Belva Plain,1995,Dell Publishing Company
169006,449206475,8,The Witches of Eastwick,John Updike,1995,Fawcett Books
169006,451160525,8,"The Gunslinger (The Dark Tower, Book 1)",Stephen King,1994,New American Library
169006,451163524,8,"The Drawing of the Three (The Dark Tower, Book 2)",Stephen King,1997,Signet Book
169006,451172817,7,Needful Things,Stephen King,2004,Signet Book
169006,671673688,7,While My Pretty One Sleeps,Mary Higgins Clark,1990,Pocket
169006,671758896,7,"Loves Music, Loves to Dance",Mary Higgins Clark,1992,Pocket
169006,068482468X,8,Fatigue Artist,Lynne Sharon Schwartz,1996,Scribner
169014,971880107,5,Wild Animus,Rich Shapero,2004,Too Far
169017,28644670,10,"The Complete Idiot's Guide to Yoga Illustrated, Third Edition",Joan Budilovsky,2003,Alpha Books
169017,425192725,10,Q Is for Quarry,Sue Grafton,2003,Berkley Publishing Group
169019,553260111,7,The Bourne Identity,Robert Ludlum,1984,Bantam Books
169023,440237971,9,Midnight Predator,AMELIA ATWATER-RHODES,2003,Laurel Leaf
169024,136298419,5,Object-Oriented Modeling and Design,James R Rumbaugh,1990,Prentice Hall
169024,452272815,7,Napoleon Hill's Keys to Success: The 17 Principles of Personal Achievement,Napoleon Hill,1997,Plume Books
169025,385488440,8,Purple Cane Road,James Lee Burke,2000,Bantam Books
169027,764224204,9,"Angel of Mercy (Shannon Saga, 3)",Tracie Peterson,2002,Bethany House Publishers
169027,764224212,8,Written on the Wind (Daughters of Fortune),Judith Pella,2002,Bethany House Publishers
169027,764224522,8,"Highland Hopes: A Novel (Blue Ridge Legacy, 1)",Gary E. Parker,2001,Bethany House Publishers
169027,764224530,8,"Highland Mercies (Blue Ridge Legacy, 2)",Gary E. Parker,2002,Bethany House Publishers
169027,764225227,8,Saint Ben/ the Saints and Angels Song,John Fischer,2001,Bethany House Publishers
169027,764225286,8,"Second Opinion (The Healing Touch, 1)",Hannah Alexander,2002,Bethany House Publishers
169027,764225324,7,When Calls the Heart (Canadian West),Janette Oke,2001,Bethany House Publishers
169027,764225332,7,When Comes the Spring (Canadian West),Janette Oke,2001,Bethany House Publishers
169027,764225340,7,When Breaks the Dawn (Canadian West),Janette Oke,2001,Bethany House Publishers
169027,764225359,7,When Hope Springs New (Canadian West),Janette Oke,2001,Bethany House Publishers
169027,764226053,9,Twilight,Kristen Heitzmann,2002,Bethany House Publishers
169027,764226223,8,"The Fiery Ring (House of Winslow, 28)",Gilbert Morris,2002,Bethany House Publishers
169027,764226312,10,Arena,Karen Hancock,2002,Bethany House Publishers
169027,764226347,8,Success by Design: Ten Biblical Secrets to Help You Achieve Your God-Given Potential,Peter Hirsch,2002,Bethany House Publishers
169027,764227270,10,Not a Sparrow Falls,Linda Nichols,2002,Bethany House Publishers
169027,1577780728,10,"Jesus Freaks: DC Talk and The Voice of the Martyrs - Stories of Those Who Stood For Jesus, the Ultimate Jesus Freaks",DC Talk,1999,Bethany House Publishers
169027,1589199642,7,Avenged,A. R. Chandler,2002,Chariot Victor Pub
169029,446606456,8,An Isolated Incident,Susan R. Sloan,1999,Warner Books
169034,500274215,9,The Practical Guide to Marbling Paper,Anne Chambers,1986,W W Norton &amp; Co Inc
169034,806983264,5,Handmade greeting cards,Maureen Crawford,1991,Sterling
169034,823031292,8,Monotype: Mediums and Methods for Painterly Printmaking,Julia S. Ayres,1991,Watson-Guptill Publications
169034,1564961729,9,Creative Watercolor: Step-By-Step Guide and Showcase,Mary Ann Beckwith,1996,North Light Books
169037,312273142,9,"A Smile As Big As the Moon: A Teacher, His Class and Their Unforgettable Journey",Michael E. Kersjes,2002,St. Martin's Press
169037,679422080,7,Durable Goods,Elizabeth Berg,1993,Random House Inc
169037,679442405,10,Traveling Mercies: Some Thoughts on Faith,Anne Lamott,1999,Random House Inc
169037,1565115392,10,The Secret Life of Bees,Sue Monk Kidd,2002,Penguin Highbridge
169043,345305183,5,On a Pale Horse,Piers Anthony,1984,Ballantine Books
169043,385472951,5,The Partner,John Grisham,1997,Doubleday Books
169043,425097609,5,Whispers,Dean R. Koontz,1997,Berkley Publishing Group
169043,425097773,5,Mask,Dean R. Koontz,1989,Penguin Putnam~mass
169043,425099334,5,Shattered,Dean R. Koontz,1993,Berkley Publishing Group
169043,440170842,8,Punish the Sinners,John Saul,1990,Dell
169043,452257743,5,"The Bachman Books: Four Early Novels by Stephen King : Rage, the Long Walk, Roadwork, the Running Man",Stephen King,1985,Penguin USA
169052,312305060,10,The Hours: A Novel,Michael Cunningham,2002,Picador
169054,312958684,4,Awakening Your Psychic Powers : Open Your Inner Mind And Control Your Psychic Intuition Today,Henry Reed,1996,St. Martin's Paperbacks
169054,330493612,8,Revenge: A Love Story,Laura Blumenfeld,2002,Pan Macmillan
169054,345421477,9,Everybody Smokes In Hell,JOHN RIDLEY,2000,Ballantine Books
169054,374129983,2,The Corrections,Jonathan Franzen,2001,Farrar Straus &amp; Giroux
169054,380789019,8,Neverwhere,Neil Gaiman,1998,Avon
169054,425158640,8,Idoru,William Gibson,1997,Berkley Publishing Group
169054,451458583,6,Threshold: A Novel of Deep Time,Caitlin R. Kiernan,2001,Roc
169054,802138705,9,Baise-Moi (Rape Me),Virginie Despentes,2003,Grove Press
169054,915556278,8,Smart Moves: Why Learning Is Not All in Your Head,Carla Hannaford,1995,Great River Books
169054,1560254971,3,Liverpool Fantasy,Larry Kirwan,2003,Thunder's Mouth Press
169054,1570719438,3,The Last Boy,Robert Lieberman,2002,Sourcebooks Landmark
169057,60176806,9,Love in Another Town,Barbara Taylor Bradford,1995,Harpercollins
169057,61009059,9,One for the Money (Stephanie Plum Novels (Paperback)),Janet Evanovich,1995,HarperTorch
169057,312203039,9,High Five (A Stephanie Plum Novel),Janet Evanovich,1999,St. Martin's Press
169057,312265840,10,Seven Up (A Stephanie Plum Novel),Janet Evanovich,2001,St. Martin's Press
169057,312291639,4,The Nanny Diaries: A Novel,Emma McLaughlin,2003,St. Martin's Griffin
169057,312976275,10,Hot Six : A Stephanie Plum Novel (A Stephanie Plum Novel),Janet Evanovich,2001,St. Martin's Paperbacks
169057,312983867,8,Hard Eight : A Stephanie Plum Novel (A Stephanie Plum Novel),Janet Evanovich,2003,St. Martin's Paperbacks
169057,312991460,9,To the Nines (A Stephanie Plum Novel),Janet Evanovich,2004,St. Martin's Paperbacks
169057,446603929,6,See How They Run,James Patterson,1997,Warner Books
169057,446606189,10,Cat &amp; Mouse (Alex Cross Novels),James Patterson,1998,Warner Books
169057,446609323,5,Black Friday,James Patterson,1989,Warner Vision
169057,446611085,10,Suzanne's Diary for Nicholas,James Patterson,2003,Warner Books
169057,446612545,9,The Beach House,James Patterson,2003,Warner Books
169057,446613843,9,The Jester,James Patterson,2004,Warner Books
169059,425178765,7,Easy Prey,John Sandford,2001,Berkley Publishing Group
169059,515115231,8,Mirror Maze,William Bayer,1995,Jove Books
169065,312977026,10,K-Pax,Gene Brewer,2001,St. Martin's Paperbacks
169065,312982089,8,On a Beam of Light,Gene Brewer,2002,St. Martin's Paperbacks
169065,553582747,10,From the Corner of His Eye,Dean Koontz,2001,Bantam Books
169073,142001538,10,Baghdad Express: A Gulf War Memoir,Joel Turnipseed,2003,Penguin Books
169075,006101351X,7,The Perfect Storm : A True Story of Men Against the Sea,Sebastian Junger,1998,HarperTorch
169076,385265700,10,The Book of Ruth (Oprah's Book Club (Paperback)),Jane Hamilton,1990,Anchor
169076,671027646,10,The Christmas Box Collection : The Christmas Box Timepiece The Letter,Richard Paul Evans,1998,Pocket
169076,743436210,9,Hearts in Atlantis,Stephen King,2001,Pocket
169076,743439961,8,Have Tech Will Travel : SCE Omnibus,Keith R.A. DeCandido,2002,Star Trek
169076,765305623,10,Star Bright!: A Christmas Story,Andrew M. Greeley,2002,Forge Books
169093,312288115,8,Confessions of a Sociopathic Social Climber : The Katya Livingston Chronicles (Katya Livingston Chronicles (Hardcover)),Adele Lang,2002,Thomas Dunne Books
169093,446530239,9,If Looks Could Kill,Kate White,2002,Warner Books
169094,671003755,5,She's Come Undone (Oprah's Book Club (Paperback)),Wally Lamb,1996,Washington Square Press
169101,380973650,8,American Gods: A Novel,Neil Gaiman,2001,William Morrow
169101,786916591,9,"The Crane (Legend of the Five Rings:  Clan War, Third Scroll)",Ree Soesbee,2000,Wizards of the Coast
169101,786916842,8,"The Scorpion (Legend of the Five Rings:  Clan War, First Scroll)",Stephen D. Sullivan,2000,Wizards of the Coast
169101,786917989,7,"The Phoenix (Legend of the Five Rings: Clan War, Fourth Scroll)",Stephen D. Sullivan,2001,Wizards of the Coast
169101,786918799,8,"The Crab (Legend of the Five Rings:  Clan War, Fifth Scroll)",Stan Brown,2001,Wizards of the Coast
169101,786919043,8,The Lion (Clan War Â¿ Seventh Scroll),Stephen D. Sullivan,2001,Wizards of the Coast
169104,440180295,7,Slaughterhouse Five or the Children's Crusade: A Duty Dance With Death,Kurt Vonnegut,1991,Laurel
169105,440235162,7,The Smoke Jumper,Nicholas Evans,2002,Dell Publishing Company
169109,61097861,8,Hunting Badger (Joe Leaphorn/Jim Chee Novels),Tony Hillerman,2000,HarperCollins
169110,093143260X,10,"Embracing each other: Relationship as teacher, healer &amp; guide",Hal Stone,1989,New World Library
169119,1551667959,10,7b,Stella Cameron,2001,Mira
169130,61097578,7,One Heart : A Novel,Jane McCafferty,2000,Perennial
169130,312252854,9,The Music Lesson : A Novel,Katharine Weber,2000,Picador
169130,345446860,9,Back When We Were Grownups : A Novel (Ballantine Reader's Circle),ANNE TYLER,2002,Ballantine Books
169130,375705856,6,Plainsong (Vintage Contemporaries),KENT HARUF,2000,Vintage
169130,446670251,6,The Virgin Suicides,Jeffrey Eugenides,1994,Warner Books
169130,688173896,8,The Scandalous Summer of Sissy Leblanc: A Novel,Loraine Despres,2001,William Morrow &amp; Company
169130,743218035,9,The Keepers of Truth: A Novel,Michael Collins,2001,Scribner
169134,451184793,7,The Vulture Fund,Stephen W. Frey,1997,Signet Book
169140,786867213,10,The Color Code : A Revolutionary Eating Plan for Optimum Health,James A. Joseph,2002,Hyperion
169144,1857022165,7,Ruby and the Stone Age Diet,Martin Millar,1994,Fourth Estate
169145,486272788,9,Hamlet (Dover Thrift Editions),William Shakespeare,1992,Dover Publications
169146,385333706,10,After Long Silence: A Memoir,Helen Fremont,2000,Delta
169147,440229049,10,When Zachary Beaver Came to Town,KIMBERLY WILLIS HOLT,2001,Yearling
169147,679445315,7,Quite a Year for Plums,Bailey White,1998,Random House Inc
169152,140143505,9,84 Charing Cross Road,Helene Hanff,1990,Penguin Books
169155,446601640,8,Slow Waltz in Cedar Bend,Robert James Waller,1994,Warner Books
169161,345342968,9,Fahrenheit 451,RAY BRADBURY,1987,Del Rey
169163,60931418,7,Their Eyes Were Watching God,Zora Neale Hurston,1998,Perennial
169170,449910555,8,The Presence,John Saul,1997,Ballantine Books
169171,689716230,7,Dragon's Milk (Dragon Chronicles),Susan Fletcher,1997,Aladdin
169177,449218198,6,Murder at the Old Vicarage,Jill McGown,1991,Fawcett Books
169181,345314247,8,Blue Adept (Apprentice Adept (Paperback)),Piers Anthony,1982,Ballantine Books
169181,425083837,8,The Hunt for Red October,Tom Clancy,1985,Berkley Publishing Group
169181,449006522,5,Manhattan Hunt Club,JOHN SAUL,2002,Ballantine Books
169181,778320197,8,Home Before Dark,Susan Wiggs,2004,Mira
169181,1410766691,8,The Brazen Serpent Chronicles: Talon of Light,R. Dennis Baird,2003,1stBooks Library
169185,441783589,6,Starship Troopers,Robert A. Heinlein,1987,Ace Books
169188,679777539,7,"Imagining Characters: Conversations About Women Writers : Jane Austen, Charlotte Bronte, George Eliot, Willa Cather, Iris Murdoch, and Toni Morrison",A. S. Byatt,1997,Vintage Books USA
169192,26887533,5,Busy Baby (Hello Baby Books),Debby Slier,1988,Checkerboard Books
169192,26893304,5,Baby's Place,Debby Slier,1989,Not Avail
169192,030706140X,10,What Can Baby Do? (My First Golden Board Book),Lauren Ariev,1992,Golden Books
169192,307122522,10,The Poky Little Puppy's Counting Book (Golden Sturdy Shape Book),Jean Chandler,1980,Golden Books
169192,030720314X,10,Polite Elephant (The Little Golden Treasures Series),RICHARD SCARRY,1998,Golden Books
169192,385311923,6,Lightning,DANIELLE STEEL,1995,Delacorte Press
169192,394878841,5,"Yoo-Hoo, Little Rabbit! (Peek-a-Boo Books)",J.P. Miller,1986,Random House Trade
169192,399212302,7,Spot on the Farm (Board Books),Eric Hill,1985,Putnam Publishing Group
169192,439064864,10,Harry Potter and the Chamber of Secrets (Book 2),J. K. Rowling,1999,Scholastic
169192,439136350,10,Harry Potter and the Prisoner of Azkaban (Book 3),J. K. Rowling,1999,Scholastic
169192,439139597,10,Harry Potter and the Goblet of Fire (Book 4),J. K. Rowling,2000,Scholastic
169192,440226732,8,Downriver,WILL HOBBS,1995,Laurel Leaf
169192,590353403,10,Harry Potter and the Sorcerer's Stone (Book 1),J. K. Rowling,1998,Scholastic
169192,590462628,10,Little Bunny's Easter Surprise (Sparkling Egg Books),Tara Doyle,1993,Scholastic Paperbacks (T)
169192,609610597,10,"The Shelters of Stone (Earth's Children Series, No 5)",JEAN M. AUEL,2002,Crown
169192,671744216,9,The Secret,Julie Garwood,1992,Pocket
169192,694001848,7,Where's the Dog?,Harriet Ziefert,1987,Harpercollins Juvenile Books
169192,803709978,2,Shopping Trip (Dial Very First Books),Helen Oxenbury,1991,Dial Books
169192,803760698,5,Max's Ride (Very First Books),Rosemary Wells,1979,Penguin USA
169192,812036875,10,"Bantams: Husbandry and Care, Diseases, and Breeding With a Special Chapter on Understanding Bantams",Helga Fritzsche,1986,Barron's Educational Series
169192,812548477,6,The Firekeeper: A Narrative of the Eastern Frontier,Robert Moss,1996,St Martins Pr (Mm)
169192,861121961,10,Thank You God (First Prayer Ser),Stephanie Longfoot,1984,Brimax Books Ltd
169192,861126912,10,Ten Little Puppies (Board Counting Books),Books Brimax,1993,Byeway Books
169192,861128427,10,Animals' Counting Book (Board Counting Books),Brimax,1993,Brimax Books Ltd
169192,1562880853,5,Baby's Words (Hello Baby Books),Debby Slier,1988,Checkerboard Press
169192,1562881450,5,Words I Know: Hello Baby Books (Hello Baby Books),Debby Slier,1991,Holmes &amp; Meier Publishers
169192,158017325X,10,Storey's Guide to Raising Chickens,Gail Damerow,2001,Storey Books
169194,395926882,5,The Best American Short Stories 2001,Katrina Kenison,2001,Mariner Books
169209,60607343,10,Everyday Zen : Love and Work,Charlotte J. Beck,1989,HarperSanFrancisco
169210,037570504X,9,"Breath, Eyes, Memory",Edwidge Danticat,1998,Vintage Books USA
169211,61099279,10,King's Oak,Anne Rivers Siddons,1991,HarperTorch
169221,080596049X,10,Taneesha's Treasures of the Heart,M. Lavora Perry,2003,Dorrance Pub Co
169221,972910301,10,"Beyond Mars &amp; Venus: Lessons of Dialogue and Peace, a Buddhist's perspective",Susan M. Andrus,2003,Wordminder Press
169222,345396936,5,Cry to Heaven,Anne Rice,1995,Ballantine Books
169222,515117420,10,The Murderers,W. E. B. Griffin,1995,Jove Books
169223,441444253,6,Killobyte,Piers Anthony,1994,ACE Charter
169223,812507436,7,"People of the River (The First North Americans series, Book 4)",W. Michael Gear,1993,Tor Books
169223,812507479,7,"People of the Lakes (The First North Americans series, Book 6)",Kathleen O'Neal Gear,1995,Tor Books
169223,812515560,7,"People of the Lightning (The First North Americans series, Book 7)",Kathleen O'Neal Gear,1996,Tor Books
169223,812521331,7,"People of the Wolf (The First North Americans series, Book 1)",W. Michael Gear,1992,Tor Books
169223,812521501,6,"People of the Fire (The First North Americans series, Book 2)",Kathleen O'Neal Gear,1991,Tor Books
169223,812533666,7,Isle of Woman (Geodyssey),Piers Anthony,1994,Tor Fantasy
169223,812550919,7,Shame of Man (Geodyssey),Piers Anthony,1995,Tor Fantasy
169223,812571118,7,Hope of Earth (Geodyssey),Piers Anthony,1998,Tor Fantasy
169223,880381736,6,"Dragons of Autumn Twilight (Dragonlance Chronicles, Vol 1)",Margaret Weis,1990,TSR
169223,880381752,6,"Dragons of Spring Dawning (Dragonlance Chronicles, Vol 3)",Margaret Weis,1985,TSR
169223,088038266X,6,"War of the Twins (DragonLance Legends, Vol 2)",Margaret Weis,1986,TSR
169228,425083837,6,The Hunt for Red October,Tom Clancy,1985,Berkley Publishing Group
169231,385503822,7,The Summons,John Grisham,2002,Doubleday Books
169233,60080841,8,The Stepford Wives,Ira Levin,2002,Perennial
169233,142001430,9,Year of Wonders,Geraldine Brooks,2002,Penguin Books
169233,151008116,7,Life of Pi,Yann Martel,2002,Harcourt
169233,312954468,9,River God,Wilbur A. Smith,1995,St. Martin's Press
169233,345366239,9,The Eight,Katherine Neville,1995,Ballantine Books
169233,345378490,7,Congo,Michael Crichton,1995,Ballantine Books
169233,345443128,6,A False Sense of Well Being (Ballantine Reader's Circle),Jeanne Braselton,2002,Ballantine Books
169233,375700757,7,Cold Mountain : A Novel,CHARLES FRAZIER,1998,Vintage
169233,440212561,9,Outlander,DIANA GABALDON,1992,Dell
169233,446612545,7,The Beach House,James Patterson,2003,Warner Books
169233,067101532X,6,The Doublet Affair (Mystery at Queen Elizabeth I's Court (Paperback)),Fiona Buckley,1999,Pocket
169233,671693816,6,Wifey,Judy Blume,1989,Pocket
169233,671727583,6,Smart Women,Judy Blume,1990,Pocket Books
169233,679746048,5,"Girl, Interrupted",SUSANNA KAYSEN,1994,Vintage
169233,684852802,9,The Hypochondriac's Guide to Life. And Death.,Gene Weingarten,1998,Simon &amp; Schuster
169233,688177859,8,"Ahab's Wife: Or, The Star-Gazer: A Novel",Sena Jeter Naslund,2000,Perennial
169233,732909740,7,Heart of the Amazon,Yossi Ghinsberg,1999,Yossi Ghinsberg
169233,812013948,7,French at a Glance: Phrase Book &amp; Dictionary for Travelers (Barron's Languages at a Glance),Gail Stein,1992,Barrons Educational Series
169233,812968379,8,Funny in Farsi : A Memoir of Growing Up Iranian in America,FIROOZEH DUMAS,2004,Random House Trade Paperbacks
169234,670031909,5,Lost in a Good Book: A Thursday Next Novel,Jasper Fforde,2003,Viking Books
169234,671027360,3,Angels &amp; Demons,Dan Brown,2001,Pocket Star
169243,60185147,8,Courting Trouble,Lisa Scottoline,2002,HarperCollins Publishers
169243,006103102X,10,Murder Boogies with Elvis,Anne George,2002,Avon
169243,345391128,9,A Killing Cure (Jane Lawless Mysteries (Paperback)),Ellen Hart,1995,Fawcett Books
169243,425143503,9,A Taste for Murder,Claudia Bishop,1996,Berkley Publishing Group
169243,044900399X,5,The Defense,D.W. Buffa,1998,Fawcett Books
169243,515121495,10,The List,Steven Paul Martini,1997,Jove Books
169243,553582194,9,Unsigned: A Booklover's Mystery (Booklover's Mysteries),Julie Kaewert,2001,Crimeline
169243,743418131,10,Deck the Halls (Holiday Classics),Mary Higgins Clark,2002,Pocket
169243,765342529,6,The Eyes of Heisenberg,Frank Herbert,2002,Tor Books
169249,140280553,5,"Galileo's Daughter: A Historical Memoir of Science, Faith, and Love",Dava Sobel,2000,Penguin Books
