User-ID,ISBN,Book-Rating,Book-Title,Book-Author,Year-Of-Publication,Publisher
114178,746023189,7,Usborne Book of World History Dates (Illustrated World History Series),Jane Chisholm,1998,E.D.C. Publishing
114178,754803082,6,Fabulous Cookies: Scrumptious Recipes for Delicious Homemade Treats (Contemporary Kitchen),Hilaire Walden,2000,Lorenz Books
114178,761102426,9,Labor Day : Shared Experiences from the Delivery Room,Ann-Marie Giglio,1999,Workman Publishing
114178,767907809,10,Bookends,Jane Green,2002,Broadway Books
114178,771089554,6,The Innocent Traveller (New Canadian Library),Ethel Wilson,1995,New Canadian Library
114178,789401886,8,Eyewitness Travel Guide to Ireland,Lisa Gerard-Sharp,1997,Dorling Kindersley Publishing
114178,804101787,10,A Midwife's Story,Penny Armstrong,1988,Ivy Books
114178,804802777,10,Japan Unmasked.,IchirÃ?O. Kawasaki,1969,Tuttle Pub
114178,804809488,8,Noodle Words: An Introduction to Chinese and Japanese Characters (Tut L Books),Donald McLeish Murray,1971,Tuttle Publishing
114178,804819114,8,250 Essential Kanji for Everyday Use (Tuttle Language Library),Kanji Text Research Group,1993,Charles E. Tuttle Co.
114178,804820775,8,Kanji &amp; Kana: A Handbook of the Japanese Writing System (Tuttle Language Library),Wolfgang Hadamitzky,1997,Charles E. Tuttle Co.
114178,828862001,6,"Michelin Road Atlas to Europe, Scale 1:1,000,000",Michelin Travel Publications,2001,French &amp; European Publications Inc
114178,831758643,7,The Mushroom Cookbook,Victoria Lloyd-Davies,1995,Smithmark Publishers
114178,834804042,9,Japanese Particle Workbook,Taeko Kamiya,1997,Weatherhill Inc.
114178,836217241,10,The Far Side Gallery 4,Gary Larson,1993,Andrews McMeel Publishing
114178,844283452,10,Easy Japanese Crossword Puzzles : Using Kana,Rita  Lampkin,1998,McGraw-Hill
114178,087011039X,7,Japanese Kana Workbook,P.G. O'Neill,1957,Kodansha Amer Inc
114178,087131794X,5,Dr. Atkins' New Diet Cookbook,"Robert C., Md. Atkins",1995,M. Evans and Company
114178,878770453,8,Tarot: A New Handbook for the Apprentice: Volume I Original,Eileen Connolly,1991,Newcastle Publishing Company
114178,880799781,10,Runes (Predictions Library),David V. Barrett,1997,U.S. Games Systems
114178,907812937,5,Dreamers Dictionary,Stearn Robinson,1986,Treasure Press
114178,962813702,8,"Kanji Pict-O-Graphix: Over 1,000 Japanese Kanji and Kana Mnemonics",Michael Rowley,1992,Stone Bridge Press
114178,1558680713,8,Culture Shock! Japan (Culture Shock Series),Rex Shelley,1992,Graphic Arts Center Publishing Company
114178,1561385298,7,Coca-Cola: The Collector's Guide to New and Vintage Coca-Cola Memorabilia,Randy Schaeffer,1995,Running Press Book Publishers
114178,1564580911,9,Scorpio: October 24-November 22,Julia Parker,1996,Dorling Kindersley Publishing
114178,1564586464,9,Eyewitness Travel Guide to France,Rosemary Bailey,1998,Dorling Kindersley Publishing
114178,1567187226,7,Beneath a Mountain Moon,Silver Ravenwolf,1995,Llewellyn Publications
114178,1570430330,8,Herbs: The Magic Healers: A Complete Guide to Physical and Spiritual Well-Being,Paul Twitchell,1997,Eckankar
114178,1577170814,10,Pigs &amp; Wild Boars: A Portrait of the Animal World (Portraits of the Animal World),Ben Sonder,1998,"Todtri Productions, Ltd."
114178,1841721050,10,Easy Sushi,Emi Kazuko,2000,Ryland Peters &amp; Small Ltd
114178,1853263001,5,Dictionary of Phrase and Fable (Wordsworth Collection),E. C. Brewer,1999,Wordsworth Editions Ltd
114178,1857034244,8,Working in Japan: How &amp; Where to Find Well Paid Jobs in Every Sector (Living &amp; Working Abroad),Jonathan Hayter,1996,Trans-Atlantic Publications
114178,1859677207,7,Best-Ever Chicken: The Definitive Cook's Collection 200 Step-By-Step Chicken Recipes,Linda Fraser,1998,Natl Book Network
114178,1901970000,6,Alastair Sawday's Special Places to Stay in Britain (Alastair Sawday's Special Places to Stay),Alastair Sawday,1998,St Martins Pr
114178,2831508363,7,Berlitz European Phrase Book (Berlitz European Guides),Berlitz Publishing Company,1990,John Wiley &amp; Sons Inc
114178,4095100923,8,Shogakukan Dictionary of New English Edition,Stewart Flexner,1986,Shogakukan
114178,4311700024,8,Nippon the Land and Its People,Nippon Steel,0,Nippon Steel Metal Products Co
114178,4385102783,9,Daily Concise Japanese English Dictionary,Sanseido,0,Seven Hills Book+distributors
114178,4770018827,7,Japanese for Busy People (Japanese for Busy People),Association for Japanese-Language,1993,Kodansha International (JPN)
114178,4770023022,10,13 Secrets for Speaking Fluent Japanese,Giles Murray,1999,Kodansha International (JPN)
114178,9511101218,7,Food From Finland: A Finnish Cookbook,Anna-Maija Tanttu,1988,KustannusosakeyhtiÃ¶ Otava
114178,9625934456,7,Muffins (Le Cordon Bleu Home Collection),Kay Halsey,1999,Periplus Editions
114182,446611808,9,Envy,Sandra Brown,2002,Warner Books
114185,440211727,8,A Time to Kill,JOHN GRISHAM,1992,Dell
114185,446604801,10,Jack &amp; Jill (Alex Cross Novels),James Patterson,1997,Warner Books
114185,446611212,10,Violets Are Blue,James Patterson,2002,Warner Vision
114190,385240716,7,"My Husband, Rock Hudson: The Real Story of Rock Hudson's Marriage to Phyllis Gates",Phyllis Gates,1987,Doubleday Books
114193,679751602,10,Mama Makes Up Her Mind: And Other Dangers of Southern Living,Bailey White,1994,Vintage Books USA
114195,679785892,5,Fear and Loathing in Las Vegas : A Savage Journey to the Heart of the American Dream,HUNTER S. THOMPSON,1998,Vintage Books
114197,64400018,7,Little House in the Big Woods,Laura Ingalls Wilder,1953,HarperTrophy
114197,64400034,7,Farmer Boy (Little House),Laura Ingalls Wilder,1953,HarperTrophy
114197,64400050,7,By the Shores of Silver Lake (Little House),Laura Ingalls Wilder,1953,HarperTrophy
114197,006440031X,7,The First Four Years (Little House),Laura Ingalls Wilder,1953,HarperTrophy
114197,590300946,7,Long Winter,Laura Ingalls Wilder,1995,Scholastic
114197,770421083,6,Anne of the Island,Ian Montgomery,1983,Bantam Books
114199,553572326,4,Survival of the Fittest: An Alex Delaware Novel,Jonathan Kellerman,1998,Bantam
114200,373201346,9,Stanislaski Sisters (Harlequin by Request),Nora Roberts,1997,Harlequin
114200,373483554,8,Lilah and Suzanna: The Calhoun Women,Nora Roberts,1998,Silhouette
114200,373483694,9,Macgregor Grooms (Macgregors),Nora Roberts,1998,Silhouette
114200,380710218,10,Postmortem,Patricia Daniels Cornwell,1993,Harper Mass Market Paperbacks (Mm)
114200,042516019X,8,Masquerade,Gayle Lynds,1997,Berkley Publishing Group
114200,440225701,9,The Street Lawyer,JOHN GRISHAM,1999,Dell
114200,449219569,8,Comeback,Dick Francis,1994,Fawcett Books
114200,449221156,8,Bonecrack,Dick Francis,1993,Fawcett Books
114200,515118559,10,True Betrayals,Nora Roberts,1996,Jove Books
114200,051512317X,9,Rising Tides,Nora Roberts,2001,Jove Books
114200,515126772,10,Jewels of the Sun (Irish Trilogy),Nora Roberts,2004,Jove Books
114200,671014919,5,My Gal Sunday,Mary Higgins Clark,2003,Pocket
114200,821767089,5,If She Only Knew,Lisa Jackson,2000,Kensington Publishing Corporation
114200,1551664720,5,Afterglow,Catherine Coulter,1998,Mira
114202,312282540,6,"Harry Potter, You're the Best: A Tribute from Fans the World over",Sharon Moore,2001,St. Martin's Press
114203,60987103,7,Wicked: The Life and Times of the Wicked Witch of the West,Gregory Maguire,1996,Regan Books
114203,446401846,8,Child of Silence,Abigail Padgett,1994,Warner Books
114203,2070524558,10,Harry Potter et la chambre des secrets,J. K. Rowling,1999,Gallimard Jeunesse
114210,241141095,3,Hotel World,Ali Smith,2001,Hamish Hamilton
114210,452282128,9,Thirty Nothing,Lisa Jewell,2001,Plume Books
114210,671011375,10,Death du Jour,Kathy Reichs,2000,Pocket
114210,754802760,10,"The Complete Book of Candles: Creative Candle-Making, Candleholders and Decorative Displays",Gloria Nicol,2000,Lorenz Books
114210,086411415X,5,Classic Essential Pies (Hawthorn Mini Series),Not Applicable (Na ),1996,Graphic Arts Center Pub Co
114210,883964481,5,Always Believe in Yourself and Your Dreams: A Collection of Poems (Blue Mountain Arts Collection (Paperback)),Patricia Wayant,1997,Blue Mountain Arts
114210,1551101254,5,Irresistible Cookies and Crackers,Hawthorn Series,0,Graphic Arts Center Publishing
114216,20259409,7,NO FOOTPRINTS IN THE BUSH (Scribner Crime Classics),Arthur Upfield,1986,Touchstone
114216,140108270,9,Jumping the Queue (King Penguin),Mary Wesley,1988,Penguin Books
114216,140139427,9,Think on Death: A Hudson Valley Mystery (Ziza Todd Mystery Series),David Willis McCullough,1992,Penguin USA
114216,312951795,8,Scorpion In The Sea,P. T. Deutermann,1994,St. Martin's Paperbacks
114216,330341634,8,The Daughters of Cain,Colin Dexter,1995,Macmillan Pub Ltd
114216,345308239,9,March of Folly: From Troy to Vietnam,Barbara W. Tuchman,1992,Ballantine Books
114216,373222572,7,The Mummy Case (Harlequin Intrigue No. 257),Dawn Stewardson,1993,Harlequin
114216,380723638,8,Ill Wind (Anna Pigeon Mysteries (Paperback)),Nevada Barr,1997,Avon Books
114216,380727129,7,The Body in the Bog : A Faith Fairchild Mystery (Faith Fairchild Mysteries (Paperback)),Katherine Hall Page,1997,Avon
114216,380731177,8,The Jackal's Head,Elizabeth Peters,2002,Avon
114216,038081403X,7,"Peter Benchley's Amazon: The Ghost Tribe (Peter Benchley's Amazon, No 1)",Rob MacGregor,2000,HarperEntertainment
114216,425162400,8,The Maltese Goddess: An Archaeological Mystery (Archaeological Mysteries),Lyn Hamilton,1998,Prime Crime
114216,440202485,8,Snow in April,Rosamunde Pilcher,1994,Dell Publishing Company
114216,044020254X,8,The Empty House,Rosamunde Pilcher,1995,Dell Publishing Company
114216,440235146,8,A Sudden Change of Heart,Barbara Taylor Bradford,1999,Dell Publishing Company
114216,446606812,8,Message in a Bottle,Nicholas Sparks,1999,Warner Vision
114216,449208400,9,Mrs. Pollifax on the China Station,Dorothy Gilman,1990,Fawcett Books
114216,449216861,8,Silence in Hanover Close,Anne Perry,1996,Fawcett Books
114216,449219364,7,G Is for Gumshoe (Kinsey Millhone Mysteries (Paperback)),Sue Grafton,1991,Fawcett Books
114216,449221989,8,Carpool,Mary Cahill,1992,Fawcett Books
114216,449223604,7,M Is for Malice,Sue Grafton,1998,Fawcett Books
114216,449242374,8,Prelude to Terror-C,MacInnes,1979,Not Avail
114216,449908445,7,Ashworth Hall (Charlotte &amp; Thomas Pitt Novels (Hardcover)),Anne Perry,1997,Ballantine Books
114216,451096630,7,Dmitri,Jamey Cohen,1981,New American Library
114216,451166892,10,The Pillars of the Earth,Ken Follett,1996,Signet Book
114216,451192303,7,"Between a Wok and a Hard Place: A Pennsylvania Dutch Mystery With Recipes (Magdalena Yoder Mystery Series , No 5)",Tamar Myers,1998,Signet Book
114216,451199588,7,Murder Can Spoil Your Appetite: A Desiree Shapiro Mystery (Desiree Shapiro Mysteries),Selma Eichler,2000,New American Library
114216,553269895,8,Murder Unrenovated,P. M. Carlson,1987,Bantam Books
114216,553294229,7,Untimely Guest,Marian Babson,1992,Bantam Books
114216,553294393,8,Saint Mike,Jerry Oster,1991,Bantam Books
114216,553563718,6,Aliens Genocide (Aliens),David Bischoff,1994,Bantam
114216,553569317,7,Death in the Country,Christine Green,1995,Bantam Books
114216,553569406,8,Mistress,Amanda Quick,1995,Bantam Books
114216,553578375,8,Jane and the Stillroom Maid (Jane Austen Mysteries (Paperback)),Stephanie Barron,2001,Bantam Books
114216,671028375,9,Fatal Voyage,Kathy Reichs,2002,Pocket
114216,772004765,8,Girl in a Red River coat,Mary Peate,1970,"Clarke, Irwin"
114216,804104212,8,Fire Arrow,Franklin Allen Leib,1989,Ivy Books
114216,804112126,6,Death of a Glutton : A Hamish MacBeth Mystery,M.C. Beaton,1995,Fawcett Books
114216,812522486,9,The Little Country,Charles de Lint,1997,Tor Books (Mm)
114216,864921055,7,Last Tasmanian,Curtis,1993,Univ of Toronto Pr
114216,870441574,8,"Creepy, crawly things: Reptiles and amphibians (Books for young explorers)",National Geographic Society (U.S.),1974,National Geographic Society
114216,920953336,5,From the Foot of the Mountain,Claudia Morrison,1992,Univ of Toronto Pr
114216,1562820753,9,Panther Dream: A Story of the African Rainforest,Bob Weir,1991,Disney Pr
114216,1572972181,6,The Crow: City of Angels : A Novel,Chet Williamson,1996,Berkley Publishing Group
114217,7143907,6,Shrinking Violet,Jean Ure,2002,Collins
114217,7143923,7,Pumpkin Pie,Jean Ure,2002,Collins
114217,140282033,8,Chocolat,Joanne Harris,2000,Penguin Books
114217,380731851,8,Mystic River,Dennis Lehane,2002,HarperTorch
114217,380801566,3,Halfway to Paradise,Nessa Hart,1999,Avon
114217,425160815,6,I Want to Buy a Vowel: A Novel of Illegal Alienation,John Welter,1997,Berkley Publishing Group
114217,425162621,5,Begin to Exit Here: A Novel of the Wayward Press,John Welter,1998,Berkley Publishing Group
114217,440211727,5,A Time to Kill,JOHN GRISHAM,1992,Dell
114217,044022165X,5,The Rainmaker,JOHN GRISHAM,1996,Dell
114217,440295521,3,The Runaway Jury,John Grisham,1996,Dell Publishing Company
114217,671417614,4,HT ENJOY LIFE JOB,Dale Carnegie,1980,Pocket
114217,671891049,8,Giant Steps : Author Of Awaken The Giant And Unlimited Power,Anthony Robbins,1994,Fireside
114217,736906185,7,Phillips' Awesome Collection of Quips &amp; Quotes: Words to Laugh and Live by from A to Z,Bob Phillips,2001,Harvest House Publishers
114217,804106304,8,The Joy Luck Club,Amy Tan,1994,Prentice Hall (K-12)
114217,080410753X,9,The Kitchen God's Wife,Amy Tan,1992,Ivy Books
114217,804114986,7,The Bonesetter's Daughter,Amy Tan,2002,Ballantine Books
114217,081440765X,7,Delivering Knock Your Socks Off Service,Ron Zemke,2002,American Management Association
114217,842382127,6,Why You Act the Way You Do,Tim Dr. Lahaye,1988,Tyndale House Publishers
114217,1576734749,7,Stories for a Woman's Heart,Alice Gray,1999,Multnomah
114217,1902757513,6,The Babes' Bible,Elizabeth Hearn,2000,Quadrille Publishing
114218,439252962,5,Ricky Ricotta's Mighty Robot Vs. the Mecha-Monkeys from Mars: The Fourth Robot Adventure Novel (Ricky Ricotta),Dav Pilkey,2002,Blue Sky Press (AZ)
114218,590307207,5,Ricky Ricotta's Mighty Robot,Dav Pilkey,2000,Scholastic
114218,789452103,8,Walking with Dinosaurs Photo Journal,Stephen Cole,2000,Dorling Kindersley Publishing
114218,089272322X,5,Junior: A Little Loon Tale,John Hassett,1993,Down East Books
114218,895779757,8,Weather (Reader's Digest Explores Science &amp; Nature Series),Readers Digest,1997,Readers Digest
114218,1563318024,8,Weather : An Explore Your World Handbook,H. MICHAEL MOGIL,1999,Discovery Books
114219,670827592,10,The True Story of the 3 Little Pigs!,Jon Scieszka,1989,Viking Juvenile
114223,056353723X,9,Down to Earth: The Year of the Cornflake (Down to Earth),Faith Addis,2000,BBC Consumer Publishing
114226,441002137,5,The Caterpillar's Question,Anthony Piers,1995,Ace Books
114226,446606235,6,The Barbed Coil,J. V. Jones,1999,Warner Books
114226,671001744,6,GULLIVER'S TRAVELS : GULLIVER'S TRAVELS,Jonathan Swift,1996,Pocket
114231,689855516,1,Lost,Francine Pascal,2003,Simon Pulse
114237,044022165X,7,The Rainmaker,JOHN GRISHAM,1996,Dell
114240,8401326060,6,AcuÃ©rdate de mÃ­,Mary Higgins Clark,1995,Downtown Book Center
114241,039480001X,10,The Cat in the Hat,Dr. Seuss,1957,Random House Books for Young Readers
114243,440111811,8,Changes,Danielle Steel,1984,Dell
114243,440176484,8,Secrets,DANIELLE STEEL,1986,Dell
114243,440185327,8,Thurston House,Danielle Steel,1984,Dell
114243,440211727,8,A Time to Kill,JOHN GRISHAM,1992,Dell
114246,812576403,4,The Light of Other Days,Arthur C. Clarke,2001,Tor Books
114251,3404139011,6,Flug der StÃ?Â¶rche.,Jean-Christophe Grange,1997,LÃ?Â¼bbe
114251,3404146204,8,Zeit fÃ?Â¼r Plan B.,Jonathan Tropper,2001,LÃ?Â¼bbe
114251,3548359698,8,Warum MÃ?Â¤nner nicht zuhÃ?Â¶ren und Frauen schlecht einparken.,Allan Pease,2000,Ullstein Tb
114255,425104273,10,The First Deadly Sin,Lawrence Sanders,1993,Berkley Publishing Group
114255,440208319,8,The Switch,Elmore Leonard,1990,Dell
114255,451202473,8,Bones,Jan Burke,2001,Signet Book
114255,553585118,10,Once a Thief,Kay Hooper,2002,Bantam Books
114255,812520467,5,A Member of the Family,Nick Vasile,1995,Tor Books (Mm)
114258,60007788,8,Finding Fish: A Memoir,Antwone Q. Fisher,2001,Perennial
114258,60931949,9,House Made of Dawn (Perennial Classics),N. Scott Momaday,1999,Perennial Classics
114258,310209307,10,The Case for Christ:  A Journalist's Personal Investigation of the Evidence for Jesus,Lee Strobel,1998,Zondervan Publishing Company
114258,375500510,10,Black and Blue : A Novel,ANNA QUINDLEN,1998,Random House
114258,440220394,7,A Wrinkle in Time,L'Engle Madelein,1996,Laurel-Leaf Books
114258,446310786,9,To Kill a Mockingbird,Harper Lee,1988,Little Brown &amp; Company
114258,553269151,10,Inherit the Wind,JEROME LAWRENCE,1982,Bantam
114258,689817851,10,Go Ask Alice,Anonymous,1998,Simon Pulse
114258,880705485,7,Blood Money : How I Got Rich off a Woman's Right to Choose,Carol Everett,1992,Multnomah
114265,61091847,8,Mafia Dynasty: The Rise and Fall of the Gambino Crime Family,John H. Davis,1994,HarperTorch
114265,312269587,7,"Plane Insanity: A Flight Attendant's Tales of Sex, Rage, and Queasiness at 30,000 Feet",Elliott Hester,2002,St. Martin's Press
114265,312920687,8,Black Widow,R. Robin McDonald,1987,St Martins Pr (Mm)
114265,312921411,8,Silent Testimony,Roger Walker,1990,St. Martin's Press
114265,345391055,10,Disclosure,Michael Crichton,1994,Ballantine Books
114265,446600989,5,Prisoner's Hope (Seafort Saga),David Feintuch,1995,Warner Books
114265,451167716,9,The Godfather,Mario Puzo,2004,Signet Book
114265,451403576,8,"Innocent Victims (Onyx True Crime, Je 357)",Scott Whisnant,1993,Onyx Books
114265,451403878,7,"Murder Machine: A True Story of Murder, Madness, and the Mafia",Gene Mustain,1993,Onyx Books
114265,451406818,9,Gotti: Rise and Fall,Jerry Capeci,1996,Onyx Books
114265,553580264,6,Tropic of Creation,Kay Kenyon,2000,Spectra Books
114265,671001132,10,DEAD BY SUNSET : DEAD BY SUNSET,Ann Rule,1996,Pocket
114265,671025341,10,"A Rage To Kill and Other True Cases : Anne Rule's Crime Files, Vol. 6 (Ann Rule's Crime Files)",Ann Rule,1999,Pocket
114265,671666843,5,The AGENDA: INSIDE THE CLINTON WHITE HOUSE,Bob Woodward,1995,Pocket
114265,671868713,10,And Never Let Her Go : Thomas Capano: The Deadly Seducer,Ann Rule,2000,Pocket
114265,743202961,10,"Every Breath You Take : A True Story of Obsession, Revenge, and Murder",Ann Rule,2001,Free Press
114265,842329129,5,Left Behind: A Novel of the Earth's Last Days (Left Behind No. 1),Tim Lahaye,1996,Tyndale House Publishers
114265,1558533729,5,"America's Dumbest Criminals : Wild and Weird Stories of Fumbling Felons, Clumsy Crooks, and Ridiculous Robbers",Daniel R. Butler,1995,Rutledge Hill Press
114265,156554756X,5,The Family Story of Bonnie and Clyde,Phillip W. Steele,2000,Pelican Publishing Company
114265,1569801630,10,Lucky Luciano : The Man Who Organized Crime in America,Hickman Powell,2000,Barricade Books
114268,1564782379,8,Reckless Eyeballing,Ishmael Reed,2000,Dalkey Archive Press
114271,553260960,8,"The Mammoth Hunters (Auel, Jean M. , Earth's Children.)",Jean M. Auel,1986,Bantam Books
114271,157856283X,7,Mirth for the Millennium (The Holy Humor Series),Cal Samra,1999,Waterbrook Press
114271,1578562856,7,Rolling in the Aisles (The Holy Humor Series),Cal Samra,1999,Waterbrook Press
114271,1578562864,7,The Laughter Prescription (The Holy Humor Series),Cal Samra,1999,Waterbrook Press
114279,000649840X,9,Angelas Ashes,Frank Mccourt,0,Harpercollins Uk
114279,6551971,7,Swimmer,Bill Broady,2003,Trafalgar Square
114279,140430962,7,The Woman in White (The Penguin English Library),Wilkie Collins,1975,Penguin Books
114279,192829246,9,The Old Curiosity Shop: With the Original Illustrations (Oxford World's Classics),Charles Dickens,1998,Oxford University Press
114279,312862504,6,Aztec Autumn,Gary Jennings,1997,St Martins Pr
114279,316785261,9,The Fig Eater : A Novel,Jody Shields,2001,Back Bay Books
114279,037582233X,8,Stargirl,JERRY SPINELLI,2002,Knopf Books for Young Readers
114279,452282152,8,Girl with a Pearl Earring,Tracy Chevalier,2001,Plume Books
114279,571168361,7,They came from SW19,Nigel Williams,1993,Faber and Faber
114279,575400951,10,About a Boy Uk,Nick Hornby,1998,Trafalgar Square
114279,590112899,9,"The Subtle Knife (His Dark Materials, Book 2)",Philip Pullman,1998,Scholastic Point
114279,590139614,9,Northern Lights (His Dark Materials S.),Philip Pullman,1996,Scholastic Point
114279,701105224,10,The L-shaped Room,Lynne Reid Banks,1975,Vintage/Ebury (A Division of Random House Group)
114279,750915943,8,Mini Sagas,The Daily Telegraph Competition,1998,"Alan Sutton Publishing, Ltd."
114279,767907140,10,The Best a Man Can Get : A Novel,JOHN O'FARRELL,2002,Broadway
114279,860681297,7,The Edible Woman,Margaret Eleanor Atwood,1980,Virago Press (UK)
114279,089296619X,4,Bad Chili,Joe R. Lansdale,1997,Mysterious Press
114279,1840242639,3,You Know You're an E-mail Addict When... (Summersdale Humour: You Know You're A...),Louise Mckay,2002,Summersdale Publishers
114279,1841950947,9,Under the Skin,Michel Faber,2001,Canongate Books Ltd
114279,1857026853,8,Vicious Circle,Amanda Craig,0,Fourth Estate
114280,1881830365,10,Gathering Promises (Message),Garborgs Heart N Home,1998,Garborg's Heart 'n Home
114288,671028375,6,Fatal Voyage,Kathy Reichs,2002,Pocket
114288,971880107,5,Wild Animus,Rich Shapero,2004,Too Far
114292,60391626,10,I Know This Much Is True (Oprah's Book Club),Wally Lamb,1998,Regan Books
114292,609809431,9,Kick Me: Adventures in Adolescence,Paul Feig,2002,Three Rivers Press (CA)
114292,074323782X,10,Life's Greatest Lessons: 20 Things That Matter,Hal Urban,2002,Fireside
114298,61054909,4,Love in Vein,Poppy Z. Brite,1995,Eos
114298,452281431,10,Beauty's Punishment (Sleeping Beauty),A.N. Roquelaure,1984,Plume Books
114298,1573441333,8,Sweet Life: Erotic Fantasies for Couples,Violet Blue,2001,Cleis Press
114301,27110907,6,"Then Again, Maybe I Won't",Judy Blume,1982,Atheneum/Richard Jackson Books
114301,140327770,7,Games.... (Puffin Books),Robin Klein,1988,Puffin Books
114304,312983271,6,Full House (Janet Evanovich's Full Series),Janet Evanovich,2002,St. Martin's Paperbacks
114304,316690619,8,Cradle and All,James Patterson,2000,Little Brown and Company
114304,385508417,9,Skipping Christmas,JOHN GRISHAM,2002,Doubleday
114304,679884084,7,These Things I Love (Life Favors),Kim Anderson,1998,Random House Childrens Books
114304,1558743669,1,A Child Called \It\: One Child's Courage to Survive,Dave Pelzer,1995,Health Communications
114306,192815326,9,"Frankenstein: Or, the Modern Prometheus (World's Classics)",Mary Wollstonecraft Shelley,1982,Oxford University Press
114306,345361792,10,A Prayer for Owen Meany,John Irving,1990,Ballantine Books
114306,394404289,10,The Prophet,Kahlil Gibran,1973,Alfred A. Knopf
114306,440800056,6,Ramona Forever,Beverly Cleary,1984,Dell Publishing
114306,553242954,8,Anne of Green Gables (Bantam Starfire Book),L.M. Montgomery,1986,Bantam
114306,679745408,9,Technopoly: The Surrender of Culture to Technology,Neil Postman,1993,Vintage Books USA
114306,077109972X,8,Apprenticeship of Duddy Kravitz,Mordecai Richler,1989,New Canadian Library
114306,1573225517,9,High Fidelity,Nick Hornby,1996,Riverhead Books
114306,1573227331,9,About a Boy,Nick Hornby,1999,Riverhead Books
114306,1573228575,8,The Forest for the Trees: An Editor's Advice to Writers,Betsy Lerner,2001,Riverhead Books
114306,1878825089,8,The Common Good (The Real Story Series),Noam  Chomsky,2002,Odonian Press
114315,671039830,6,"Eye Of The Storm (Hudson, Book 3)",V.C. Andrews,2000,Pocket
114323,374284385,8,The Virgin Suicides,Jeffrey Eugenides,1993,Farrar Straus &amp; Giroux
114327,553076256,7,Half Asleep in Frog Pajamas,Tom Robbins,1994,Bantam Books
114335,671510053,8,SHIPPING NEWS,Annie Proulx,1994,Scribner
114337,141185082,10,Cannery Row (Penguin Modern Classics),John Steinbeck,2000,Penguin Books Ltd
114337,014118552X,9,Sweet Thursday (Penguin Modern Classics),John Steinbeck,2000,Penguin Books Ltd
114341,425184226,9,The Sum of All Fears,Tom Clancy,2002,Berkley Publishing Group
114343,618045996,8,Riding the Bus with My Sister: A True Life Journey,Rachel Simon,2002,Houghton Mifflin Company
114344,849915732,9,The Blue Bottle Club,Penelope Stokes,1999,WestBow Press
114345,307020487,7,A Child's Garden Of Verses (a Little Golden Book),Robert Louis Stevenson,1957,Western Publishing Company
114349,1573221937,6,How to Be Good,Nick Hornby,2001,Riverhead Books
114353,425144372,8,Clear and Present Danger,Tom Clancy,1994,Berkley Publishing Group
114353,553565222,6,The Last Bachelor,Betina M. Krahn,1994,Fanfare
114355,140174664,7,Red Dwarf Omnibus,Grant Naylor,1992,Penguin Putnam~trade
114355,345339703,7,"The Fellowship of the Ring (The Lord of the Rings, Part 1)",J.R.R. TOLKIEN,1986,Del Rey
114355,806994754,5,The Illustrated Dream Dictionary,Russell Grant,1996,Sterling Publishing
114360,811808734,7,The Snow Riders,Constance W. McGeorge,1995,Chronicle Books
114362,553579983,7,And Then You Die,Iris Johansen,1998,Bantam
114362,553580388,8,The Patient,Michael Palmer,2001,Bantam Books
114362,812563581,5,The Relic,Douglas Preston,1996,St Martins Press
114365,006019491X,8,Daughter of Fortune : A Novel (Oprah's Book Club (Hardcover)),Isabel Allende,1999,HarperCollins
114365,006052510X,5,Happiness : A Novel,Will Ferguson,2003,Perennial
114365,385502605,8,Coldwater,MARDI MCCONNOCHIE,2001,Doubleday
114365,452272726,8,The Eye in the Door,Pat Barker,1995,Plume Books
114365,051512558X,8,The Overseer,Jonathan Rabb,1999,Jove Books
114365,553571885,6,A Thin Dark Line (Mysteries &amp; Horror),TAMI HOAG,1998,Bantam
114365,743212967,6,The Jazz Bird,Craig Holden,2001,Simon &amp; Schuster
114365,1878067982,5,Femme D'Adventure: Travel Tales from Inner Montana to Outer Mongolia,Jessica Maxwell,1997,Seal Press (WA)
