User-ID,ISBN,Book-Rating,Book-Title,Book-Author,Year-Of-Publication,Publisher
25409,037325024X,7,Out of the Blue (Red Dress Ink (Paperback)),Isabel Wolff,2003,Red Dress Ink
25409,373250258,10,Fashionistas (Red Dress Ink (Paperback)),Lynn Messina,2003,Red Dress Ink
25409,373250266,8,Guilty Feet,Kelly Harte,2003,Red Dress Ink
25409,373250282,8,Engaging Men (Red Dress Ink (Paperback)),Lynda Curnyn,2003,Red Dress Ink
25409,373250290,8,Carrie Pilby (Red Dress Ink (Paperback)),Caren Lissner,2003,Red Dress Ink
25409,375718877,8,Inspired Sleep: A Novel,Robert Cohen,2002,Vintage Books USA
25409,375760628,8,Slave to Fashion : A Novel,REBECCA CAMPBELL,2002,Villard
25409,375760911,7,The Idiot Girls' Action Adventure Club,Laurie Notaro,2002,Villard Books
25409,380012057,8,"Gabriela, Clove and Cinnamon",Jorge Amado,1982,Avon
25409,038071129X,9,The Death of a Joyce Scholar : A Peter McGarr Mystery,Bartholomew Gill,2002,Avon
25409,380732688,8,Milk and Honey (Peter Decker/Rina Lazarus Novels),Faye Kellerman,2002,Avon
25409,380776626,7,Deep Valley Malice,Kirk Mitchell,1996,Harper Mass Market Paperbacks (Mm)
25409,380804212,9,Fury,G.M. Ford,2002,Avon
25409,380804921,6,The House of Seven Mabels : A Jane Jeffry Mystery (Jane Jeffry Mysteries (Paperback)),Jill Churchill,2003,Avon
25409,380806347,10,Cross Dressing,Bill Fitzhugh,2002,HarperTorch
25409,380808641,9,The Death of an Irish Sinner : A Peter McGarr Mystery (Peter McGarr Mysteries (Paperback)),Bartholomew Gill,2002,Avon
25409,380818876,9,Out of Hormone's Way : A Bel Barrett Mystery (Bel Barrett Mysteries (Avon Books)),Jane Isenberg,2002,Avon
25409,380818973,7,Asking for Trouble: A Novel,Elizabeth Young,2001,Avon Trade
25409,380819554,9,Grave Consequences : An Emma Fielding Mystery (Emma Fielding Mysteries),Dana Cameron,2002,Avon
25409,380819562,10,Past Malice : An Emma Fielding Mystery (Emma Fielding Mysteries),Dana Cameron,2003,Avon
25409,380820293,8,Last Chance Saloon,Marian Keyes,2002,Avon
25409,380820617,6,A Killing Season,Jessica Speart,2002,Avon
25409,380820994,8,Vineyard Shadows: A Martha's Vineyard Mystery,Philip R. Craig,2002,Avon
25409,385084765,5,The Hidden Dimension,Edward Twitchell Hall,1990,Anchor
25409,385335482,9,Confessions of a Shopaholic (Summer Display Opportunity),SOPHIE KINSELLA,2001,Delta
25409,038533656X,7,Apocalipstick,SUE MARGOLIS,2003,Delta
25409,385481713,8,The Alphabet of Modern Annoyances,Neil Steinberg,1996,Bantam Dell Pub Group
25409,038550084X,7,Fraud,DAVID RAKOFF,2001,Doubleday
25409,385720211,8,In the Drink,Kate Christensen,2000,Anchor Books/Doubleday
25409,385720920,8,Choke,CHUCK PALAHNIUK,2002,Anchor
25409,385722370,7,Up in the Air,Walter Kirn,2002,Anchor Books/Doubleday
25409,425169456,7,The Rich Man's Table,Scott Spencer,1999,Berkley Publishing Group
25409,425178854,9,"Murder, My Deer (Kate Jasper Mysteries (Paperback))",Jaqueline Girdner,2001,Berkley Publishing Group
25409,425179184,10,Crime Brulee (Culinary Mysteries (Paperback)),Nancy Fairbanks,2001,Berkley Publishing Group
25409,425179451,9,Death by Darjeeling (Tea Shop Mysteries),Laura Childs,2001,Berkley Publishing Group
25409,425184285,9,Arkansas Traveler (Benni Harper Mystery),Earlene Fowler,2002,Berkley Publishing Group
25409,425184315,8,Just Desserts,Claudia Bishop,2002,Berkley Publishing Group
25409,425184420,9,Death Dines at 8:30,Claudia Bishop,2002,Berkley Publishing Group
25409,425184544,8,Garden View (Gardening Mysteries (Paperback)),Mary Freeman,2002,Berkley Publishing Group
25409,425185222,8,Six Strokes Under,Roberta Isleib,2002,Berkley Publishing Group
25409,425185486,8,A Dying Art (Maggie Kean Mysteries (Paperback)),Nageeba Davis,2002,Prime Crime
25409,425187063,10,Death in Paradise,Robert B. Parker,2002,Berkley Publishing Group
25409,425187144,9,"Hanging by a Thread (Ferris, Monica. Needlecraft Mysteries.)",Monica Ferris,2003,Prime Crime
25409,425187403,9,Body of Intuition,Claire Daniels,2002,Prime Crime
25409,425188213,10,Shades of Earl Grey (A Tea Shop Mystery),Laura Childs,2003,Prime Crime
25409,042518885X,5,The Wicked Flea: A Dog Lover's Mystery (Dog Lover's Mysteries),Susan Conant,2003,Berkely Prime Crime
25409,425188876,9,Dead Frenzy (Mysteries &amp; Horror),Victoria Houston,2003,Berkley Publishing Group
25409,425189953,6,Murder Pans Out,Emily Toll,2003,Berkley Publishing Group
25409,425190773,8,An Opening for Murder,Nageeba Davis,2003,Berkley Publishing Group
25409,425191230,6,Material Girl (Berkley Sensation),Julia London,2003,Berkley Publishing Group
25409,425191311,8,"Hold the Cream Cheese, Kill the Lox",Sharon Kahn,2003,Berkley Publishing Group
25409,425192725,10,Q Is for Quarry,Sue Grafton,2003,Berkley Publishing Group
25409,425193292,9,The Bastard's Tale (Sister Frevisse Medieval Mysteries (Paperback)),Margaret Frazer,2003,Berkley Publishing Group
25409,425193314,10,A Puree of Poison,Claudia Bishop,2003,Berkley Publishing Group
25409,425193896,9,Cutwork,Monica Ferris,2004,Berkley Publishing Group
25409,425194612,8,The Ghost and Mrs. McClure (Prime Crime Mysteries),Alice Kimberly,2004,Berkley Publishing Group
25409,425196216,8,Legend of the Jade Dragon,Yasmine Galenorn,2004,Berkley Publishing Group
25409,439139597,10,Harry Potter and the Goblet of Fire (Book 4),J. K. Rowling,2000,Scholastic
25409,043935806X,10,Harry Potter and the Order of the Phoenix (Book 5),J. K. Rowling,2003,Scholastic
25409,440204739,8,The Missing Madonna,Carol Anne O'Marie,1989,Dell
25409,440224713,9,Total Recall: A V.I. Warshawski Novel,Sara Paretsky,2002,Dell Publishing Company
25409,440236738,9,Gone for Good,HARLAN COBEN,2003,Dell
25409,440237211,9,Splintered Bones,CAROLYN HAINES,2003,Dell
25409,044024093X,10,Crossed Bones,CAROLYN HAINES,2004,Dell Publishing
25409,441008534,9,Dead Until Dark (Southern Vampire Mysteries),Charlaine Harris,2001,Ace Books
25409,441010512,6,Club Dead (Southern Vampire Mysteries),Charlaine Harris,2003,Ace Books
25409,441790348,8,Stranger in a Strange Land (Remembering Tomorrow),Robert A. Heinlein,1995,ACE Charter
25409,446611360,10,Point Deception,Marcia Muller,2002,Warner Books
25409,446611476,8,Stone Kiss,Faye Kellerman,2003,Warner Books
25409,446611867,7,A Bend in the Road,Nicholas Sparks,2002,Warner Books
25409,446612529,10,Dead Midnight (Sharon McCone Mysteries (Paperback)),Marcia Muller,2003,Warner Books
25409,449000265,9,8 Weeks to Optimum Health,Andrew Weil M.D.,1998,Ballantine Books
25409,449005569,9,Love: A User's Guide,CLARE NAYLOR,1999,Ballantine Books
25409,449006417,7,Dying to Get Her Man,Judy Fitzwater,2002,Fawcett Books
25409,449007170,9,An Anniversary to Die For:  A Susan Henshaw Mystery,Valerie Wolzien,2002,Fawcett Books
25409,449007189,7,A Fashionable Murder,Valerie Wolzien,2003,Fawcett Books
25409,449007197,9,Death in a Beach Chair,VALERIE WOLZIEN,2004,Fawcett Books
25409,449007200,5,Give the Dog a Bone,Leslie O'Kane,2002,Fawcett Books
25409,449007294,7,The Bar Mitzvah Murder,LEE HARRIS,2004,Fawcett Books
25409,449007316,9,Death on a Silver Platter,ELLEN HART,2003,Fawcett
25409,451202503,10,The Songcatcher: A Ballad Novel,Sharyn McCrumb,2002,Signet Book
25409,451205480,8, Murder of a Sleeping Beauty (Scumble River Mysteries (Paperback)),Denise Swanson,2002,Signet Book
25409,451205669,5,Murder She Wrote : Provence to Die for,Donald Bain,2002,Signet Book
25409,451205855,8,Wolf Tracks (Annie O'Hara &amp; Claudius Mysteries),Ann Campbell,2002,Signet Book
25409,451206592,9,Who Invited the Dead Man?,Patricia Sprinkle,2002,Signet Book
25409,451207246,8,How to Murder a Millionaire,Nancy Martin,2002,Signet Book
25409,451208498,8,Thieves' Paradise,Eric Jerome Dickey,2003,Signet Book
25409,451208862,9,Dead Girls Don't Wear Diamonds (Blackbird Sisters Mysteries),Nancy Martin,2003,Signet Book
25409,451210727,6,Murder of a Barbie and Ken (National Bestselling Series),Denise Swanson,2003,Signet Book
25409,451210816,9,Murder Between the Covers: A Dead End Job Mystery,Elaine Viets,2003,Signet Book
25409,451211529,8,Murder Can Botch Up Your Birthday (Desiree Shapiro Mystery),Selma Eichler,2004,Signet Book
25409,451620585,10,The Bacchae,Euripides,1982,New American Library
25409,452277337,7,Le Divorce (William Abrahams Book),Diane Johnson,1997,Plume Books
25409,452282128,7,Thirty Nothing,Lisa Jewell,2001,Plume Books
25409,452283027,9,Farm Fatale: A Comedy of Country Manors,Wendy Holden,2002,Plume Books
25409,452283086,7,The Cross-Country Quilters,Jennifer Chiaverini,2002,Plume Books
25409,525946233,10,The Darwin Awards II: Unnatural Selection,Wendy Northcutt,2001,Dutton Books
25409,553579142,9,Cry Dance,Kirk Mitchell,2000,Bantam Books
25409,553581651,7,Die upon a Kiss,Barbara Hambly,2002,Bantam Books
25409,553582267,10,Wreck the Halls,SARAH GRAVES,2002,Bantam
25409,553582852,10,The Tail of the Tip-Off,RITA MAE BROWN,2004,Bantam
25409,553584340,8,A Puzzle in a Pear Tree (Puzzle Lady Mysteries (Paperback)),PARNELL HALL,2003,Bantam
25409,553586416,8,Dead Canaries Don't Sing : A Reigning Cats and Dogs Mystery (Reigning Cats &amp; Dogs Mysteries),CYNTHIA BAXTER,2004,Bantam
25409,582330866,10,Pride and Prejudice (Longman Study Texts),Jane Austen,1988,Longman Group United Kingdom
25409,609608126,9,A Year in Van Nuys,Sandra Tsing Loh,2001,Crown Publishing Group (NY)
25409,609805002,8,"My 1,000 Americans: A Year-Long Journey through the Personals",Rochelle Morton,2001,Three Rivers Press (CA)
25409,060980670X,4,"Beautiful Brows: The Ultimate Guide to Styling, Shaping, and Maintaining Your Eyebrows",Nancy Parker,2000,Three Rivers Press
25409,609808982,10,Nappily Ever After,Trisha R. Thomas,2001,Three Rivers Press (CA)
25409,061812733X,9,Stern Men,Elizabeth Gilbert,2001,Mariner Books
25409,618154442,9,My Life on A Plate,India Knight,2001,Mariner Books
25409,618231617,8,Almost: A Novel,Elizabeth Benedict,2002,Mariner Books
25409,671047442,10,Steppin' on a Rainbow (Kinky Friedman Novels (Paperback)),Kinky Friedman,2002,Pocket
25409,671047450,10,Meanwhile Back at the Ranch,Kinky Friedman,2003,Pocket Star
25409,671785214,9,Home Town,Tracy Kidder,2000,Washington Square Press
25409,679749535,8,Model Behavior,JAY MCINERNEY,2000,Vintage Books
25409,696217120,7,Trading Spaces Behind the Scenes: Including Decorating Tips and Tricks,Brian Kramer,2003,Meredith Books
25409,743203607,9,"Stiff Upper Lip, Jeeves",P.G. Wodehouse,2000,Touchstone
25409,743217144,5,Intimacy and Midnight All Day: A Novel and Stories,Hanif Kureishi,2001,Scribner
25409,743418174,10,Good in Bed,Jennifer Weiner,2002,Washington Square Press
25409,743418204,10,In Her Shoes : A Novel,Jennifer Weiner,2003,Washington Square Press
25409,743436679,8,The Bone Vault,Linda Fairstein,2003,Pocket Star
25409,743445007,6,Saturday the Rabbi Went Hungry : A Rabbi Small Mystery (Rabbi Small Mysteries (Ibooks)),Harry Kemelman,2002,I Books
25409,743457617,7,Game Over,Adele Parks,2004,Downtown Press
25409,743464672,8,Getting Over Jack Wagner,Elise Juska,2003,Downtown Press
25409,743471113,7,The Brush-Off : A Hair-raising Mystery,Laura Bradley,2004,Pocket
25409,758200412,8,Someone Killed His Boyfriend,David Stukas,2002,Kensington Publishing Corporation
25409,758202555,8,Any Kind of Luck,William Jack Sibley,2002,Kensington Publishing Corporation
25409,758203330,6,Thoughts While Having Sex,Stephanie Lehmann,2003,STRAPLESS
25409,765345889,7,I Love You Like a Tomato,Marie Giordano,2004,Forge
25409,767901592,7,Eat Me,LINDA JAIVIN,1998,Broadway
25409,767906543,9,Mr. Commitment,MIKE GAYLE,2002,Broadway
25409,767907817,9,Bookends : A Novel,Jane Green,2003,Broadway
25409,767908198,10,Auntie Mame: An Irreverent Escapade,Patrick Dennis,2001,Broadway Books
25409,767913000,8,Fourplay: A Novel,Jane Moore,2002,Broadway Books
25409,786864133,8,Napalm &amp; Silly Putty,George Carlin,2001,Hyperion
25409,786885688,10,Shopgirl,Steve Martin,2001,Hyperion
25409,078688861X,9,Men and Other Mammals,Jim Keeble,2003,Hyperion
25409,080214053X,8,Ice Cream,Helen Dunmore,2004,Grove Press
25409,804111278,9,Arms of Nemesis: A Novel of Ancient Rome,Steven Saylor,1995,Fawcett Books
25409,805056831,6,"Jumbo's Hide, Elvis's Ride, and the Tooth of Buddha: More Marvelous Tales of Historical Artifacts",Harvey Rachlin,2000,Henry Holt &amp; Company
25409,805063897,6,Nickel and Dimed: On (Not) Getting By in America,Barbara Ehrenreich,2002,Owl Books
25409,811828964,9,The Bad Girl's Guide to Getting What You Want,Cameron Tuttle,2000,Chronicle Books
25409,812570219,9,Cat in a Midnight Choir : A Midnight Louie Mystery (A Midnight Louie Mystery),Carole Nelson Douglas,2003,Forge Books
25409,812576071,7,Irish Stew! (Nuala McGrail Mystery),Andrew M. Greeley,2003,Forge Books
25409,081296666X,10,Things My Girlfriend and I Have Argued About: A Novel,Mil Millington,2003,Villard Books
25409,081296683X,9,Girls' Poker Night: A Novel,Jill Davis,2003,Random House Trade
25409,812967224,10,The Day I Turned Uncool: Confessions of a Reluctant Grown-Up,Dan Zevin,2002,Villard Books
25409,823073335,10,"Landscape Graphics: Plan, Section, and Perspective Drawing Landscape Spaces",Grant W. Reid,2002,Watson-Guptill Publications
25409,843711213,10,"Hammond Concise Atlas of World History (Hammond Concise Atlas of World History, 5th ed)",Geoffrey Barraclough,1998,Hammond
25409,880013516,9,Essential Haiku Volume 20 (Essential Poets),Hass,1995,Ecco
25409,903505460,7,The Vegetable &amp; Herb Expert (Expert),D.G. Hessayon,1997,Sterling Publishing
25409,1400031346,10,The No. 1 Ladies' Detective Agency,Alexander McCall Smith,2002,Anchor (UK)
25409,1401900259,5,Om Yoga Flash Cards (Om Yoga),Cyndi Lee,2002,Hay House Lifestyles
25409,1566192951,10,The Adventures of Huckleberry Finn,Mark Twain,1994,Barnes &amp; Noble
25409,157322930X,10,High Maintenance,Jennifer Belle,2002,Riverhead Books
25409,1575667274,9,Peaches and Screams: A Savannah Reid Mystery (Savannah Reid Mysteries (Paperback)),G. A. McKevett,2002,Kensington Publishing Corporation
25409,1575667290,8,Stabbing Stephanie: A Jane Stuart and Winky Mystery (Jane Stuart and Winky Mysteries (Paperback)),Evan Marshall,2002,Kensington Publishing Corporation
25409,1575668394,7,Mad As the Dickens (Laura Fleming Mystery),Toni L. P. Kelner,2002,Kensington Publishing Corporation
25409,1581822871,10,Skeleton Crew: A Lindsay Chamberlain Novel,Beverly Connor,2002,Cumberland House Publishing
25409,158243249X,7,A Woman of Salt,Mary Potter Engel,2003,Counterpoint Press
25409,158648141X,8,Tell Me a Story: Fifty Years and 60 Minutes in Television,Don Hewitt,2002,PublicAffairs
25409,1586482009,9,Common Nonsense,Andrew A. Rooney,2003,PublicAffairs
25409,1852427159,8,A Firing Offense (Five Star Title),George P. Pelecanos,1999,Serpent's Tail
25409,1862070059,8,Hidden Historie of Science,Robert Silvers,0,Edwards Famous Remainders
25409,1931686351,8,Night of a Thousand Boyfriends (Date With Destiny Aventures),Miranda Clarke,2003,Quirk Books
25409,1932407391,6,The Cat Who Killed Lilian Jackson Braun: A Parody,Robert Kaplow,2004,New Millennium
25410,60187263,2,The Antelope Wife,Louise Erdrich,1998,HarperCollins Publishers
25410,60935677,7,Thirteen Senses : A Memoir,Victor Villasenor,2002,Rayo
25410,014025448X,8,At Home in Mitford (The Mitford Years),Jan Karon,1996,Viking Books
25410,345417623,9,Timeline,MICHAEL CRICHTON,2000,Ballantine Books
25410,385336403,9,Cloud of Sparrows,TAKASHI MATSUOKA,2002,Delacorte Press
25410,399150803,9,Trojan Odyssey,Clive Cussler,2003,G. P. Putnam's Sons
25410,425188140,9,Bloodroot,Susan Wittig Albert,2003,Berkley Publishing Group
25410,441009700,7,Tathea,Anne Perry,2002,Ace Books
25410,446611867,8,A Bend in the Road,Nicholas Sparks,2002,Warner Books
25410,452260116,6,Song of Solomon (Oprah's Book Club (Paperback)),Toni Morrison,1987,Plume Books
25410,452283205,9,Falling Angels,Tracy Chevalier,2002,Plume Books
25410,515127221,8,Sullivan's Island: A Lowcountry Tale,Dorothea Benton Frank,2000,Jove Books
25410,609610597,7,"The Shelters of Stone (Earth's Children Series, No 5)",JEAN M. AUEL,2002,Crown
25410,679428895,9,Pompeii: A Novel,ROBERT HARRIS,2003,Random House
25410,076790592X,8,"Tuesdays with Morrie: An Old Man, a Young Man, and Life's Greatest Lesson",Mitch Albom,2002,Broadway
25411,517799529,7,Dave Barry's Gift Guide to End All Gift Guides,Dave Barry,1994,Random House Inc
25413,306805863,8,Comanches: The Destruction of a People,T. R. Fehrenbach,1994,Da Capo Press
25413,394743199,10,"Gods, Graves, and Scholars: The Story of Archaeology",C. W. Ceram,1986,Vintage Books USA
25413,671741020,4,Forbidden Flowers,Nancy Friday,1991,Pocket
25413,823032329,10,The Nude Figure: A Visual Reference for the Artist,Mark Smith,1998,Watson-Guptill Publications
25413,082306459X,10,Graphis Nudes,Annette Crandall,2001,Watson-Guptill Publications
25413,867195525,10,Orgasm XL,Tony Ward,2002,Last Gasp
25413,893815381,10,The Last Day of Summer,Jock Sturges,1993,Aperture
25413,938349759,8,Indian Depredations in Texas,W. J. Wilbarger,1991,McWhiney Foundation Press
25413,185868871X,10,Erotique Derrieres,The Carlton,2002,Carlton Books
25417,142003190,8,A Noble Radiance,Donna Leon,2003,Penguin Books
25419,929608178,8,The Legend of Fire (Ladd Family Adventure),Lee Roddy,1988,Tyndale House Pub (J)
25436,140184325,7,The Aran Islands (Penguin Twentieth Century Classics),J. M. Synge,1992,Penguin Books
25436,140621938,7,Five Children and It (Penguin Popular Classics),E. Nesbit,1995,Penguin Books Ltd
25436,312192339,9,Incident at Twenty-Mile,Trevanian,1998,St Martins Pr
25436,345319672,8,The Ballad of Typhoid Mary,J.F. Federspiel,1985,Ballantine Books
25436,349101779,9,The Wasp Factory,Iain Banks,0,Abacus
25436,374529035,8,Naked in Baghdad: The Iraq War as Seen by NPR's Correspondent Anne Garrels,Anne Garrels,2003,"Farrar, Straus and Giroux"
25436,553263978,9,"Trail of the Spanish Bit : Spanish Bit Saga, Number 1 (Spanish Bit Saga of the Plains Indians)",DON COLDSMITH,1987,Domain
25436,553268066,8,"Follow the Wind (Spanish Bit Saga Book, No 3)",Don Coldsmith,1991,Bantam Books
25436,553269380,9,"BUFFALO MEDICINE (Spanish Bit Saga Book, No 4)",DON COLDSMITH,1987,Domain
25436,553270672,7,Man Of The Shadows (Spanish Bit #5),Don Coldsmith,1988,Bantam
25436,553272098,9,Daughter of the Eagle (Spanish Bit Saga Ser. Bk 6),Don Coldsmith,1991,Bantam Books
25436,670030643,8,The Eyre Affair (Alex Awards (Awards)),Jasper Fforde,2002,Viking Books
25436,679732497,9,Pop. 1280 (Vintage Crime/Black Lizard),Jim Thompson,1990,Vintage Books USA
25436,786700416,8,The Chrysalids,John Wyndham,1993,Pub Group West
25436,1559029838,8,Call of the Wild,Jack London,0,Selldowns/no More Orders
25436,1841951439,8,"The Devil's Cup: Coffee, the Driving Force in History",Stewart Lee Allen,2001,Canongate Books Ltd
25436,2020302063,7,Le Golem,Marie-Pierre Bay,1997,Seuil
25436,2020306492,8,Acid test,Tom Wolfe,1996,Seuil
25436,2070364771,9,Les Justes,Albert Camus,1999,Schoenhof Foreign Books Inc
25436,2070366588,9,Aventures d'Arthur Gordon Pym,Edgar Allan Poe,1975,Gallimard
25436,2070422437,7,Trois chevaux,Erri De Luca,2002,Gallimard
25436,2070717399,8,M/T et l'histoire des merveilles de la forÃ?Âªt,KenzaburÃ?Â´ OÃ?Â©,1989,Gallimard
25436,2234054036,9,La Grammaire est une chanson douce,Erik Orsenna,2001,Stock
25436,2253072079,8,Le troupeau aveugle,John Brunner,1998,LGF
25436,2253150711,7,Stupeur Et Tremblements,Amelie Nothomb,2001,Distribooks
25436,2253154830,8,Portrait sÃ?Â©pia,Isabel Allende,2003,LGF
25436,2264016124,10,Dalva,Jim Harrison,1991,Editions 10/18
25436,2266127896,9,Nouvelles chroniques tÃ?Â©lÃ?Â©,Guy Carlier,2003,Pocket
25436,2277330140,8,Rencontre Du 3e Age,Lelong,0,Editions 84
25436,229030039X,10,Le Journal De Bridget Jones,Helen Fielding,1999,Editions 84
25436,2290302155,8,Debout les morts,Fred Vargas,2000,J'ai lu
25436,2290305537,7,Cantique de la racaille,Vincent Ravalec,2000,J'ai lu
25436,2290311294,8,Wang (2)- les aigles d'orient,Pierre Bordage,2001,J'ai lu
25436,2290327662,8,Les aventures extraordinaires d'AdÃ?Â¨le Blanc-Sec : Le secret de la salamandre,J. Tardi,2002,J'ai lu
25436,2290331333,9,Main courante,Didier Daeninckx,2002,J'ai lu
25436,2842192508,8,Ã?Â?thique en toc,Didier Daeninckx,1998,Baleine
25436,2877302202,10,La Tombe des lucioles,Akiyuki Nosaka,1988,Philippe Picquier
25436,2878580753,8,Un peu plus loin sur la droite (Chemins nocturnes),Fred Vargas,1996,V. Hamy
25441,8448040023,10,Lestat el Vampiro,Anne Rice,1996,Aims Intl Books Corp
25443,8838918600,10,Il Giro Di Boa,Andrea Camilleri,2003,Sellerio
25447,702226106,8,Gracey (Uqp Young Adult Fiction),James Moloney,1998,University of Queensland Pr (Australia)
25449,586059830,6,The Brotherhood: The Explosive Expose of the Secret World of the Freemasons,Stephen Knight,1985,"Acacia Press, Inc."
25449,812928377,7,Mean Business: How I Save Bad Companies and Make Good Companies Great,Albert J. Dunlap,1996,Crown Business
25452,609802224,5,Stealing Jesus : How Fundamentalism Betrays Christianity,BRUCE BAWER,1998,Three Rivers Press
25453,042515601X,7,Acts of War (Tom Clancy's Op Center (Paperback)),Tom Clancy,1997,Berkley Publishing Group
25453,449142183,5,Tall Stranger,Louis L'Amour,1982,Ballantine Books
25453,553149733,7,Sackett Brand,Louis Lamour,0,Bantam Doubleday Dell
25454,140062718,8,The Rebel Angels,Robertson Davies,1983,Penguin Books
25454,395869463,8,The Bookshop : A Novel,Penelope Fitzgerald,1997,Mariner Books
25454,449910830,8,The All-True Travels and Adventures of Lidie Newton: A Novel (Ballantine Reader's Circle),Jane Smiley,1999,Ballantine Books
25454,671741802,7,Simone de Beauvoir : A Biography,Deirdre Bair,1991,Touchstone
25454,880641622,8,Picasso and Dora: A Personal Memoir,James Lord,1994,Fromm Intl
25456,385484518,10,"Tuesdays with Morrie: An Old Man, a Young Man, and Life's Greatest Lesson",MITCH ALBOM,1997,Doubleday
25459,595205763,9,Dominoes Plus: The Dominoforms Handbook,Bill Perkins,2001,Writers Club Press
25466,425168956,7,The Titian Committee (Art History Mysteries),Iain Pears,1999,Berkley Publishing Group
25466,2070361837,7,Roses a Credit Lage De Nylon,Elsa Triolet,0,Gallimard French
25466,2070365832,10,L'Ã?Â®le,Robert Merle,1974,Gallimard
25466,2253012327,9,Pour Qui Sonne Le Glas,Ernest Hemingway,0,Livre De Poche French
25466,2253044903,6,Le Parfum : Histoire d'un meurtrier,Patrick SÃ?Â¼skind,1988,LGF
25466,2253057843,8,Le Joueur d'Ã?Â©checs,Stefan Zweig,1991,LGF
25466,2253076252,8,Le tableau du MaÃ?Â®tre flamand,Arturo PÃ?Â©rez-Reverte,1994,LGF
25466,2253170577,7,Le Vol des cigognes,Jean-Christophe GrangÃ?Â©,1999,LGF
25466,2253171670,8,Les RiviÃ?Â¨res pourpres,Jean-Christophe GrangÃ?Â©,2001,Le Livre de Poche
25466,2266031619,7,La dame de Berlin,Dan Franck,1991,Pocket
25466,2266046136,5,"Les Aventures de Boro reporter photographe, tome 2 : Le Temps des cerises",Dan Franck,1993,Pocket
25466,2277228508,5,Le Laquais et la Putain,Nina Berberova,1994,J'ai lu
25466,2290311782,9,Je Voudrais Que Quelqu'un M'Attende Quelque Part,Anna Gavalda,2001,Editions J'Ai Lu
25469,745940323,7,"The Dragon King Saga: In the Hall of the Dragon King, The Warlords of Nin, and The Sword and the Flame",Stephen Lawhead,2002,Lion Publishing Corporation
25471,140450270,8,"The Doctor's Dilemma: A Tragedy : Definitive Text (Shaw, Bernard, Bernard Shaw Library.)",Bernard Shaw,1987,Penguin Books
25471,515123498,7,Night Passage (Jesse Stone Novels (Paperback)),Robert B. Parker,1998,Jove Books
25471,812971442,8,Forty Ways to Look at Winston Churchill : A Brief Account of a Long Life,GRETCHEN RUBIN,2004,Random House Trade Paperbacks
25474,038518400X,5,The Robots of Dawn,Isaac Asimov,1983,Bantam Dell Pub Group
25474,671456105,5,"Star Trek II The Wrath of Kahn (Star Trek, No 7)",Vonda N. McIntyre (Adapter),1982,Star Trek
25478,2246548810,7,Les identitÃ©s meurtriÃ¨res,Amin Maalouf,1998,B. Grasset
25478,2841861961,2,SacrÃ?Â©s FranÃ?Â§ais ! : Un amÃ?Â©ricain nous regarde,Ted Stanger,2003,Michalon
25489,2211890,8,The devil is loose,Graham Shelby,1973,Collins
25489,246111259,8,The golden honeycomb,Vincent Cronin,1980,Granada
25494,553573926,5,Vertical Run,Joseph R. Garber,1996,Bantam Books
25500,60928336,8,Divine Secrets of the Ya-Ya Sisterhood: A Novel,Rebecca Wells,1997,Perennial
25511,872863026,9,Nice Boy: A Novel,George Veltri,1995,City Lights Publishers
25515,1932172033,8,Project 314,Bill Burgett,2002,McKenna Publishing Group
25517,038529932X,6,Tunnel Vision (V.I. Warshawski Novels (Hardcover)),Sara Paretsky,1994,Bantam Dell Pub Group
25517,399144315,6,The Cat Who Saw Stars,Lilian Jackson Braun,1999,Putnam Pub Group
25517,055309971X,6,Cat on the Scent,Rita Mae Brown,1999,Bantam
25518,394588428,8,The Secret Pilgrim,John LeCarre,1990,Knopf
25521,373250142,6,Dating Without Novocaine (Red Dress Ink),Lisa Cach,2002,Red Dress Ink
25521,1400048095,7,Hobo: A Young Man's Thoughts on Trains and Tramping in America,Eddy Joe Cotton,2003,Three Rivers Press (CA)
25521,1888125799,8,"Where in the Hell is Sourdough, Alaska",Josef Chmielowski,2001,Publication Consultants
25522,671795880,9,Best Destiny (Star Trek),Diane Carey,1993,Pocket
25525,3423128763,9,Der seltene Vogel.,Jostein Gaarder,2001,Dtv
25533,99771519,9,Memoirs of a Geisha Uk,Arthur Golden,0,Trafalgar Square
25533,224051709,5,Amsterdam,Ian McEwan,1998,Trafalgar Square
25533,330332775,7,Bridget Jones's Diary,Helen Fielding,1997,Picador (UK)
25533,333908198,9,Charlie Big Potatoes,Phil Robinson,2002,Pan Macmillan
25533,380807343,10,Coraline,Neil Gaiman,2003,HarperTrophy
25533,439010780,9,The Shadow in the North,Philip Pullman,1999,Scholastic Ltd
25533,441569595,8,Neuromancer (Remembering Tomorrow),William Gibson,1995,Ace Books
25533,460878018,10,Rupert Brooke &amp; Wilfred Owen (Everyman's Poetry Series),Rupert Brooke,1997,Everyman Paperback Classics
25533,552996181,5,Behind the Scenes at the Museum,Kate Atkinson,1996,Black Swan
