User-ID,ISBN,Book-Rating,Book-Title,Book-Author,Year-Of-Publication,Publisher
24624,764227033,7,"Together Is All We Need (Phillips, Michael R., Shenandoah Sisters,)",Michael Phillips,2004,Bethany House Publishers
24624,781440289,8,Startling Beauty : My Journey From Rape to Restoration,Heather Gemmen,2004,Cook Communications
24624,785261699,9,The Journey Home : Finishing with Joy,Bill Bright,2004,Nelson Books
24624,785264825,8,All For Jesus : A Devotional,Franklin Graham,2004,Nelson Books
24624,785266453,8,Praying God's Will For Your Life A Prayerful Walk To Spiritual Well Being,Stormie Omartian,2001,Nelson Books
24624,787957046,9,"Grace Matters :  A True Story of Race, Friendship,  and Faith in the Heart of the South",Chris P.  Rice,2002,Jossey-Bass
24624,840748493,8,"Gift Of The Blessing, The",Gary Smalley,1993,Nelson Books
24624,842353607,10,"Money, Possessions, and Eternity",Randy Alcorn,2003,Tyndale House Publishers
24624,842365826,8,And the Shofar Blew (Moving Fiction),Francine Rivers,2003,Tyndale House Publishers
24624,842381066,9,The Law of Rewards: Giving What You Can't Keep to Gain What You Can't Lose,Randy Alcorn,2003,Tyndale House Publishers
24624,849917867,8,Why: Trusting God When You Don't Understand,Anne Graham Lotz,2004,W Publishing Group
24624,849944716,7,Elixir,Davis Bunn,2004,WestBow Press
24624,849995442,7,The Bible Answer Book,Hank Hanegraaff,2004,J. Countryman
24624,875081886,9,Rees Howells: Intercessor,Norman Grubb,1997,Christian Literature Crusade
24624,087788630X,9,Orthodoxy (The Wheaton Literary Series),G. K. Chesterton,1994,Shaw Books
24624,882709496,7,His Greatest Sermons: Sinners in the Hands of an Angry God,Jonathan Edwards,2003,Bridge-Logos Publishers
24624,895261286,8,Jesus in Beijing: How Christianity Is Transforming China and Changing the Global Balance of Power,David Aikman,2003,Regnery Publishing
24624,896939383,7,Healing for Damaged Emotions (Personal Growth Bookshelf),David A. Seamands,1981,Chariot Victor Publishing
24624,898159520,6,277 Secrets Your Cat Wants You to Know: A Cat-Alog of Unusual and Useful Information,Paulette Cooper,1997,Ten Speed Press
24624,1563097613,8,Out of the Crescent Shadows: Leading Muslim Women into the Light of Christ,Ergun Mehmet Caner,2003,New Hope Publishers (AL)
24624,1565073541,8,The Power of a Praying Parent,Stormie Omartian,1995,Harvest House Publishers
24624,1576736881,7,A Violent Grace,Michael Card,2000,Multnomah
24624,1576833364,8,The Gospel for Real Life,Jerry Bridges,2002,Navpress Publishing Group
24624,1576834638,9,The Pursuit of Holiness (25th Anniversary Edition),Jerry Bridges,2003,Navpress Publishing Group
24624,1576834697,8,The Rabbi's Heartbeat,Brennan Manning,2003,Navpress Publishing Group
24624,1578562996,9,In Light of Eternity : Perspectives on Heaven,Randy Alcorn,1999,WaterBrook Press
24624,1578563909,7,Drummer in the Dark,T. DAVIS BUNN,2001,WaterBrook Press
24624,1578564999,8,"A Name of Her Own (Tender Ties Historical Series, 1)",Jane Kirkpatrick,2002,Waterbrook Press
24624,1578565006,8,"Every Fixed Star (Kirkpatrick, Jane, Tender Ties Historical Series, 2.)",Jane Kirkpatrick,2003,Waterbrook Press
24624,1578565014,8,"Hold Tight the Thread (Kirkpatrick, Jane)",JANE KIRKPATRICK,2004,WaterBrook Press
24624,1590520807,8,The Lights of Tenth Street,Shaunti Feldhahn,2003,Multnomah
24624,1591450187,9,Recapture the Wonder,Ravi Zacharias,2003,Integrity Publishers
24624,1591856132,8,Shadowmancer,G. P. Taylor,2004,Charisma House
24627,140293248,5,The Girls' Guide to Hunting and Fishing,Melissa Bank,2000,Penguin Books
24627,385285965,7,Legends of the Fall,Jim Harrison,1980,Delacorte Press
24627,385472951,5,The Partner,John Grisham,1997,Doubleday Books
24627,039480001X,10,The Cat in the Hat,Dr. Seuss,1957,Random House Books for Young Readers
24627,425140989,8,Thyme of Death: A China Bayles Mystery (West Coast Crime),Susan Wittig Albert,1994,Berkley Publishing Group
24627,425144062,8,Witches' Bane,Susan Wittig Albert,1994,Berkley Publishing Group
24627,425159418,8,Rueful Death: A China Bayles Mystery,Susan Wittig Albert,1997,Berkley Publishing Group
24627,425166112,8,Love Lies Bleeding: A China Bayles Mystery,Susan Wittig Albert,1998,Berkley Publishing Group
24627,425171477,8,Chile Death: A China Bayles Mystery,Susan Wittig Albert,1999,Prime Crime
24627,425177009,8,Lavender Lies: A China Bayles Mystery (Prime Crime Mysteries),Susan Wittig Albert,2000,Berkley Publishing Group
24627,425182010,8,Mistletoe Man,Susan Wittig Albert,2001,Berkley Publishing Group
24627,044651652X,6,The Bridges of Madison County,Robert James Waller,1992,Warner Books
24627,449911446,8,Before Women Had Wings (Ballantine Reader's Circle),Connie May Fowler,1997,Ballantine Books
24627,517605171,9,Anne of Green Gables: Three Volumes in One,L. M. Montgomery,1988,Random House Value Pub
24627,553250256,5,Catcher in the Rye,Salinger,1984,Bantam Books
24627,553299506,7,Private Eyes (Alex Delaware Novels (Paperback)),Jonathan Kellerman,1992,Bantam Books
24627,553562398,8,Rest in Pieces (Mrs. Murphy Mysteries (Paperback)),RITA MAE BROWN,1993,Bantam
24627,671027387,8,Deception Point,Dan Brown,2002,Pocket
24632,62514857,7,On My Own at 107: Reflections on Life Without Bessie,Sarah Louise Delany,1997,Harpercollins
24632,080242712X,7,"To Dust You Shall Return (A Lord Danvers Mystery , No 3)",Donna Fletcher Crow,1995,Moody Pr
24632,802482422,10,Damaged But Not Broken; A Personal Testimony of How to Deal with the Impact of Cancer,Larry Burkett,1996,Moody Pr
24632,836213068,10,Far Side Gallery 5,Gary Larson,0,Andrews Mcmeel
24632,945564473,5,Once Upon A Cross,Thom Lemmons,1993,Multnomah
24633,152008764,8,Hang a Thousand Trees with Ribbons: The Story of Phillis Wheatley,Ann Rinaldi,1996,Gulliver Books
24636,345295064,6,Shelley Also Known As Shirley,Shelley Winters,1981,Ballantine Books
24636,380727293,6,Dr. Atkins' New Diet Revolution,Robert C. Atkins,1997,Avon Books
24637,394569644,7,Living Out Loud,Anna Quindlen,1988,Random House Inc
24639,962959170,10,The Teenage Liberation Handbook: How to Quit School and Get a Real Life and Education,Grace Llewellyn,1998,Lowry House Pub
24640,226534154,8,How to Lie With Maps,Mark Monmonier,1991,Univ of Chicago Pr
24641,60927860,8,"Atticus : Novel, A",Ron Hansen,1997,Perennial
24641,66620112,7,What Would Machiavelli Do? The Ends Justify the Meanness,Stanley Bing,2000,HarperBusiness
24641,140143505,10,84 Charing Cross Road,Helene Hanff,1990,Penguin Books
24641,140360352,4,Gentle Ben,Walt Morey,1992,Puffin Books
24641,316107107,7,Bloom County: Loose Tails,Berke Breathed,1983,Little Brown &amp; Co
24641,375758372,7,"A Middle East Mosaic : Fragments of Life, Letters and History (Modern Library Classics)",BERNARD LEWIS,2001,Modern Library
24641,380016362,6,Laura : The Life of Laura Ingalls Wilder,Donald Zochert,1977,Avon
24641,394729846,6,You and Your Cat,David Taylor,1986,Alfred A. Knopf
24641,042517168X,4,"Love Always, Patsy: Patsy Cline's Letters to a Friend",Patsy Cline,1999,Berkley Publishing Group
24641,440180295,5,Slaughterhouse Five or the Children's Crusade: A Duty Dance With Death,Kurt Vonnegut,1991,Laurel
24641,044990542X,6,Tales from Margaritaville: Fictional Facts and Factual Fictions,Jimmy Buffett,1990,Fawcett Books
24641,486401588,6,101 Great American Poems (Dover Thrift Editions),The American Poetry &amp; Literacy Project,1998,Dover Publications
24641,517415127,6,Pride &amp; Prejudice : Cha Riv *NR* (Chatham River Press Classics),Jane Austen,1984,Random House Value Publishing
24641,553013769,5,The Food Additives Book/#31371,Nicholas Freydberg,1985,Bookthrift Co
24641,679745203,8,The English Patient,Michael Ondaatje,1996,Vintage Books USA
24641,786868619,6,Stolen Lives: Twenty Years in a Desert Jail,Malika Oufkir,2001,Talk Miramax Books
24641,802130208,5,A Confederacy of Dunces (Evergreen Book),John Kennedy Toole,1987,Grove Press
24641,806516674,5,What Happens When You Die: From Your Last Breath to the First Spadeful,Robert Hatch,1995,Carol Publishing Corporation
24641,089659419X,8,The Hawaiian Shirt: Its Art and History (Recollectibles),H. Thomas Steele,1984,Abbeville Press
24641,914676520,7,STORY OF THE LITTLE MOUSE TRAPPED IN A BOOK (Star &amp; Elephant Book),Monique Felix,1991,Simon &amp; Schuster Children's Publishing
24641,1585743941,6,Nineveh and Its Remains,Austen Henry Layard,2001,The Lyons Press
24641,1888173564,8,Parnassus on Wheels (Common Reader Editions),Christopher Morley,2000,Joiner/Oriel Inc
24642,140126023,7,Concubines Children,Denise Chong,0,Penguin Putnam~trade
24642,312195516,4,The Red Tent (Bestselling Backlist),Anita Diamant,1998,Picador USA
24642,451209907,6,Quentins,Maeve Binchy,2003,Signet Book
24642,671745239,7,MAMA : Using the Power of Pleasure to Have Your Way with the World,Terry McMillan,1991,Washington Square Press
24642,671872001,8,Disappearing Acts,Terry McMillan,1993,Pocket
24646,330303112,7,Deadlock,Colin Forbes,1988,Trans-Atlantic Publications
24648,60014342,3,In the Wake of the Plague: The Black Death and the World It Made,Norman Cantor,2002,Perennial
24651,786880252,8,Opera 101 : A Complete Guide to Learning and Loving Opera,Fred Plotkin,1994,Hyperion
24651,1573240249,8,"Women Who Love Books Too Much: Bibliophiles, Bluestockings, and Prolific Pens from the Algonquin Hotel to the Ya-Ya Sisterhood",Brenda Knight,2000,Conari Press
24659,050552287X,6,Enchanted Christmas (Heartspell),Emma Craig,1998,Love Spell
24662,9724119378,8,O Deus Das Pequenas Coisas,Roy,1998,Edicoes Asa
24664,971880107,8,Wild Animus,Rich Shapero,2004,Too Far
24672,330338390,6,Quite Contrary: an Autobiography,Mary Whitehouse,1994,Pan Macmillan
24677,038572179X,10,Atonement : A Novel,IAN MCEWAN,2003,Anchor
24682,3426614596,10,Frauen lÃ?Â¼gen besser.,Annemarie Schoenle,2000,Droemer Knaur
24682,3426615029,8,Der Buddha aus der Vorstadt. Roman.,Hanif Kureishi,1999,Droemer Knaur
24682,3453147235,8,Wassermelone.,Marian Keyes,1998,Heyne
24685,345384369,8,Intensity,DEAN KOONTZ,1996,Ballantine Books
24685,446363170,10,Cape Cod,William Martin,1992,Warner Books
24685,451126505,5,Cujo,Stephen King,1982,New American Library
24685,553241222,9,A Family Affair (The Rex Stout Library),Rex Stout,1993,Bantam Books
24689,753816733,5,The Story of My Face,Kathy Page,2003,Phoenix
24694,014044176X,8,Hero of Our Time (Penguin Classics),Paul Foote,1966,Penguin Books
24694,385491077,8,Bodily Harm,Margaret Atwood,1999,Anchor Books/Doubleday
24694,395477824,8,Selected Poems of Anne Sexton,Anne Sexton,1988,Houghton Mifflin
24694,451524063,8,"Four Major Plays: A Doll House, the Wild Duck, Hedda Gabler, the Master Builder (Signet Classics (Paperback))",Henrik Ibsen,1989,Signet Book
24694,452008492,8,World of Rome,Michael Grant,1987,Plume Books
24694,688178057,8,Culture Jam : How to Reverse America's Suicidal Consumer Binge--and Why We Must,Kalle Lasn,2000,Perennial Currents
24694,771098510,8,Crackpot : A Novel (New Canadian Library),ADELE WISEMAN,1989,New Canadian Library
24694,773727590,7,Thinking English Canada,Philip Resnick,1994,Stoddart Pub. Co
24694,876854374,8,Play the Piano Drunk Like a Percussion Instrument Until the Fingers Begin to Bleed a Bit,Charles Bukowski,1979,Black Sparrow Books
24694,889740321,5,Food and Spirits,Beth Brant,1997,Press Gang Publishers
24694,919754163,7,The Cost of Living,Kenneth Radu,1998,J. Gordon Shillingford Publishing
24694,207071523X,9,La Disparition (French Language Edition),Georges Perec,1990,Distribooks Inc
24694,2213613486,8,Les Nouveaux maÃ?Â®tres du monde et ceux qui leur rÃ?Â©sistent,Jean Ziegler,2002,Fayard
24694,2891980441,7,Les obsÃ©dÃ©s textuels: Roman humoristique,Jean Delisle,1983,Editions Asticou
24694,2894190263,7,Un homme est une valse: Roman,Pauline Harvey,1992,"Distribution, Diffusion Dimedia"
24697,61000671,6,Emerald Decision,Craig Thomas,1990,Harper Mass Market Paperbacks (Mm)
24697,312143060,5,Dance of the Scarecrows: A Jonathan Wilder Mystery,Ray Sipherd,1996,St. Martin's Press
24697,345311574,8,Master of Five Magics,Hart Hardy,1983,Del Rey Books
24697,345443683,5,"Blackwood Farm (Rice, Anne, Vampire Chronicles.)",ANNE RICE,2003,Ballantine Books
24697,394582616,7,Force Majeure,Bruce Wagner,1991,Random House Inc
24697,425045021,7,The Last Angry Man,Gerald Green,1980,Berkley Publishing Group
24697,425083837,8,The Hunt for Red October,Tom Clancy,1985,Berkley Publishing Group
24697,440225299,6,Numbered Account,CHRISTOPHER REICH,1998,Dell
24697,449142647,8,The Quick Red Fox,John D. MacDonald,1981,Fawcett Books
24697,1557731136,5,The Damnation Game,Clive Barker,1988,Jove Books
24699,60950552,10,Law School: A Survivor's Guide,"James D., III Gordon",1994,Harpercollins
24699,140049134,5,One L,Scott Turow,1978,Penguin USA
24702,141007338,10,About a Boy,Nick Hornby,2002,Penguin Books Ltd
24709,702804045,5,World Atlas,John Bartholomew,1982,Langenscheidt Pub Inc
24709,751514314,5,Flesh Wounds,Christopher Fowler,1995,Warner Books
24709,877957894,8,My Life With Goya,Andrew Potok,1986,Book Sales
24709,1871592607,8,Slaughter King,Simon Whitechafer,1998,Creation Books
24711,316693200,8,2nd Chance,James Patterson,2002,"Little, Brown"
24711,375413634,9,The Emperor of Ocean Park (Today Show Book Club #1),Stephen L. Carter,2002,Alfred A. Knopf
24717,2070415732,10,Fahrenheit 451 (Collection Folio),Ray Bradbury,2002,Distribooks Inc
24717,2707306959,8,L'Amant,Marguerite Duras,1984,Editions de Minuit
24727,446611085,5,Suzanne's Diary for Nicholas,James Patterson,2003,Warner Books
24727,3404142667,10,ZwÃ?Â¶lf goldene FÃ?Â¤den. Lebensweisheiten einer wundervollen Grossmutter.,Aliske Webb,1999,LÃ?Â¼bbe
24733,61091669,10,Marilyn Monroe: The Biography : Marilyn Monroe: The Biography,Donald Spoto,1994,HarperTorch
24733,224020927,5,Mouldy,Nicola Bayley,1988,Smithmark Pub
24733,307000435,5,Saggy Baggy Elephant: No Place for Me (Da Capo Series in Science),Gina Ingoglia,1989,Golden Books
24733,307001059,5,Little Mermaid (Little Golden Book),Michael Teitelbaum,1990,Random House Childrens Books
24733,307010007,5,Walt Disney's Mickey Mouse heads for the sky (Little golden books),Golden Books Little,1987,Western Pub. Co
24733,307020215,5,Bugs Bunny marooned! (A Little Golden book),Justine Korman,1985,Western Pub. Co
24733,307020231,5,Count All the Way to Sesame Street,Dina Anastasio,1985,Random House Childrens Books
24733,307020851,5,Theodore Mouse up in the air (A Little golden book),Michaela Muntean,1986,Western Pub. Co
24733,307021858,5,Pinocchio (A Little golden book),Little Golden Staff,1992,Random House Childrens Books
24733,307031152,5,The little golden book of holidays (A Little golden book),Jean Lewis,1985,Western Pub. Co
24733,307046028,5,Baby's Christmas,Ester Wilkin,1990,Golden Books
24733,316355151,6,Scoundrel Time,Lillian Hellman,1976,Little Brown &amp; Co
24733,373290381,7,"Three Dog Knight (The Cavendish Chronicles) (Harlequin Historicals, 438)",Tori Phillips,1998,Harlequin
24733,393962903,7,The Norton Anthology of English Literature (Norton Anthology of English Literature (Paperback)),M. H. Abrams,1993,W W Norton &amp; Co
24733,446363251,7,"Scarlett : The Sequel to Margaret Mitchell's \Gone With the Wind\""""",Alexandra Ripley,1992,Warner Books
24733,446525537,7,A Walk to Remember,Nicholas Sparks,1999,Warner Books
24733,449208184,7,The Ladies,Doris Grumbach,1985,Fawcett Books
24733,449227812,7,"An Eye for an Eye: The Doll (Blackstone Chronicles, No 1)",John Saul,1997,Fawcett Books
24733,449227847,6,"Twist of Fate: The Locket (The Blackstone Chronicles, No 2)",John Saul,1997,Fawcett Books
24733,449227863,6,"Ashes to Ashes: The Dragon's Flame (Blackstone Chronicles, Part 3)",John Saul,1997,Fawcett Books
24733,044922788X,6,"In the Shadow of Evil: The Handkerchief (The Blackstone Chronicles , No 4)",John Saul,1997,Fawcett Books
24733,449227898,6,"Day of Reckoning: The Stereoscope (Blackstone Chronicles, Part 5)",John Saul,1997,Fawcett Books
24733,449227944,6,"Asylum (Blackstone Chronicles, No 6)",JOHN SAUL,1997,Fawcett
24733,590409891,5,White Snow Bright Snow,Alvin Tresselt,0,Scholastic Inc
24733,729000664,10,Discover unexpected London,Andrew Lawson,1977,Elsevier-Phaidon
24733,761514252,10,"Creative Cash : How to Profit From Your Special Artistry, Creativity, Hand Skills, and Related Know-How",BARBARA BRABEC,1998,Prima Lifestyles
24733,764221973,10,Hidden Places: A Novel,Lynn N. Austin,2001,Bethany House Publishers
24733,859534030,5,Puzzle Island (Child's Play Library),Paul Adshead,1995,Child's Play International Ltd
24733,878575782,5,"Rodale's Book of Hints, Tips &amp; Everyday Wisdom",Carol Hupping,1985,St Martins Pr
24733,1558505814,5,Adams Streetwise Small Business Start-Up: Your Comprehensive Guide to Starting and Managing a Business (Adams Streetwise),Bob Adams,1996,Adams Media Corporation
24733,156836010X,8,Having Our Say: The Delany Sisters' First 100 Years,Sarah Louise Delany,1993,Kodansha America
24733,1574860488,10,Trash to Treasure: The Recycler's Guide to Creative Crafts (Memories in the Making Series),Anne Van Wagner Childs,1997,Leisure Arts Inc.
24737,3312008018,6,Einfach abhauen,Gudrun Pausewang,1996,Nagel &amp; Kimche
24746,316666343,7,The Lovely Bones: A Novel,Alice Sebold,2002,"Little, Brown"
24746,893757063,8,Wuthering Heights (Watermill Classic),Emily Bronte,1983,Troll Communications
24747,8486747627,9,El angel furioso (El juglar y la luna),R Blasco Romero,1992,SeuBa Ediciones
24751,345341228,7,Sins of the Flesh,Fern Michaels,1990,Ivy Books
24751,380756234,5,Night Storm,Catherine Coulter,1990,Avon
24751,446515051,5,Spencerville,Nelson Demille,1994,Replica Books
24751,449148866,6,Angel Face and Amazing Grace,Lori Copeland,1997,Ivy Books
24751,515118656,6,The Cove,Catherine Coulter,1996,Jove Books
24757,340620803,7,I-Ching for Beginners (Headway for Beginners),Krystina Arcarti,1994,Trafalgar Square Publishing
24757,671711172,7,Seven Habits of Highly Effective People,Stephen R. Covey,1992,Simon &amp; Schuster (Trade Division)
24757,903505193,9,The Flower Expert (Expert Series),"D.G., Dr. Hessayon",1998,Sterling Pub Co Inc
24767,28619463,8,The Complete Idiot's Guide to Leadership,Andrew J. DuBrin,1997,Penguin Putnam
24767,60929324,9,If You Had Controlling Parents : How to Make Peace with Your Past and Take Your Place in the World,Dan Neuharth,1999,Perennial Currents
24767,785280642,5,"God Said It, Don't Sweat It Sound Encouragement To Keep The Little Things From Overwhelming You",Neil Clark Warren,1998,Nelson Reference
24767,786866462,9,A Density of Souls,Christopher Rice,2000,Miramax
24767,786883448,8,Good Will Hunting : A Screenplay,Ben Affleck,1997,Miramax
24767,786884207,8,Don't Sweat the Small Stuff in Love,Richard Carlson,2000,Hyperion Press
24767,895263211,5,Low-Fat Lies: High Fat Frauds &amp; the Healthiest Diet in the World,Kevin Vigilante,1999,Regnery Publishing
24767,156592262X,7,"Java in a Nutshell, 2nd Edition (The Java Series)",David Flanagan,1997,O'Reilly
24767,1565923227,8,TCP/IP Network Administration,Craig Hunt,1998,O'Reilly
24767,1578700396,6,Solaris Advanced System Administrator's Guide (2nd Edition),Janice Winsor,1998,Que
24768,60393297,7,If They Only Knew,Chyna,2001,ReganBooks
24768,374252904,8,Russia: A Portrait,Lev Poliakov,1991,Farrar Straus &amp; Giroux
24768,394759923,8,In Search of Melancholy Baby,Vasilii Pavlovich Aksenov,1989,Vintage Books USA
24768,441003257,6,Good Omens,Neil Gaiman,1996,Ace Books
24768,452269520,8,Beyond Beef: The Rise and Fall of the Cattle Culture,Jeremy Rifkin,1993,Plume Books
24768,671474219,7,How To Start A Conversation And Make Friends,Don Gabor,1983,Fireside
24768,679760806,8,The Master and Margarita,Mikhail Bulgakov,1996,Vintage Books USA
24768,760307520,8,Subways of the World (Enthusiast Color),Stan Fischler,2000,Motorbooks International
24768,760730008,8,Robot Riots: The Good Guide to Bad Bots,Alison Bing and Erin Conley,2001,Barnes &amp; Noble
24768,802150594,8,Heart of a Dog,Mikhail Bulgakov,1987,Grove Press
24768,847811603,7,Invitation to Russia,Yuri Ovsianikov,1990,Rizzoli International Publications
24768,1559702680,7,"South Beach: America's Riviera, Miami Beach, Florida",Bill Wisser,1995,Little Brown &amp; Co
24768,157324550X,9,Eternally Bad: Goddesses with Attitude,Trina Robbins,2001,Conari Press
24769,312253435,10,The Cassandra Compact: A Covert-One Novel,Robert Ludlum,2001,St. Martin's Press
24769,312982615,8,Robert Ludlum's The Paris Option : A Covert-One Novel (A Covert-One Novel),Robert Ludlum,2003,St. Martin's Paperbacks
24769,425182673,7,"Cybernation (Tom Clancy's Net Force, No. 6)",Steve Perry,2001,Berkley Publishing Group
24769,451203933,5,Black Hawk Down: A Story of Modern War,Mark Bowden,2001,Signet Book
24769,451407423,8,Barracuda Final Bearing,Michael DiMercurio,1997,Onyx Books
24769,515134139,7,Target Lock,James H. Cobb,2002,Jove Books
24771,345417623,10,Timeline,MICHAEL CRICHTON,2000,Ballantine Books
24771,425177351,6,Bio-Strike (Tom Clancy's Power Plays (Paperback)),Jerome Preisler,2000,Berkley Publishing Group
24771,451172817,9,Needful Things,Stephen King,2004,Signet Book
24771,553580221,9,False Memory,Dean R. Koontz,2000,Bantam Books
24772,786890002,6,The Art of Deception,Ridley Pearson,2003,Hyperion
24773,375702652,9,Chasing Che: A Motorcycle Journey in Search of the Guevara Legend,Patrick Symmes,2000,Vintage Books USA
24773,441003257,6,Good Omens,Neil Gaiman,1996,Ace Books
24773,451528123,6,Democracy in America,Alexis De Tocqueville,2001,Signet Book
24773,452281156,9,Gods Go Begging,Alfredo Vea,2000,Plume Books
24773,802131867,7,Subterraneans,Jack Kerouac,1989,Grove Press
24778,140060669,7,Love Among the Butterflies: The Travels and Adventures of a Victorian Lady,Margaret Fountaine,1982,Penguin USA
24778,140176616,7,Asta's Book,Barbara Vine,1994,Penguin Uk
24778,140252800,7,The Brimstone Wedding,Barbara Vine,1997,Penguin Books Ltd
24778,246137339,7,Black Trillium,Julian May,1991,HarperCollins Publishers
24778,028399598X,8,The Official Prisoner Home Companion,Matthew White,1988,Pan Macmillan
24778,413537900,8,The Secret Diary of Adrian Mole Aged 13 3/4,Sue Townsend,1982,Methuen Publishing Ltd
24778,752818643,8,THE LITTLE BOOK OF MORNINGTON CRESCENT,Graeme Garden,2000,Trafalgar Square
24778,1853260258,9,The Odyssey,Homer,1998,NTC/Contemporary Publishing Company
24778,1856190676,8,In Search of Columbus,Hunter Davies,1992,"Sinclair-Stevenson, Limited"
24778,188691026X,9,Crusade in Jeans,Thea Beckman,2003,Front Street
24781,553278223,10,The Martian Chronicles,RAY BRADBURY,1984,Spectra
24790,345443284,8,While I Was Gone,Sue Miller,1999,Ballantine Books
24792,2277229938,5,Les Nuits Fauves/Savage Nights,Collard,1994,Distribooks Inc
24805,684808099,6,ANYTHING YOUR LITTLE HEART DESIRES : An American Family Story,Patricia Bosworth,1997,Simon &amp; Schuster
24807,3492235816,8,Das Achte Gebot,Anne Holt,2002,Distribooks Inc
24813,3453187008,8,Wassermelone.,Marian Keyes,2000,Heyne
24824,312195516,5,The Red Tent (Bestselling Backlist),Anita Diamant,1998,Picador USA
24825,3906647048,4,Das Schlampenbuch,Milena Moser,1992,KrÃ¶sus
24835,60554770,8,The Bang Devils,Patrick Foss,2003,Perennial Dark Alley
24835,140279474,9,Keys to the City: Tales of a New York City Locksmith,Joel Kostman,1999,Penguin Books
24835,312275420,9,Being Dead : A Novel,Jim Crace,2001,Picador
24835,312300387,8,"The Bride of Anguished English : A Bonanza of Bloopers, Blunders, Botches, and Boo-Boos",Richard Lederer,2002,St. Martin's Griffin
24835,385508409,8,The White Russian : A Novel,TOM BRADBY,2003,Doubleday
24835,425181626,10,Hook Man Speaks,Matt Clark,2001,Berkley Trade
24835,440237688,10,The Giver (Readers Circle),LOIS LOWRY,2002,Laurel Leaf
24835,688175724,10,"Touch (Leonard, Elmore, Elmore Leonard Library.)",Elmore Leonard,2000,Perennial (HarperCollins)
24835,789306808,8,Found on Ebay: 101 Genuinely Bizarre Items from the World's Online Yard Sale,Marc Hartzman,2002,Universe Publishing (NY)
24835,811215199,6,Cheops: A Cupboard for the Sun,Paul West,2003,New Directions Publishing Corporation
24835,940322560,8,The Pilgrim Hawk: A Love Story (New York Review Books Classics),Glenway Wescott,2001,New York Review of Books
24835,966347358,7,Rat City (A Jake Rossiter &amp; Miss Jenkins Mystery),Curt Colbert,2001,Uglytown Productions
24835,1400030366,9,Martyr's Day: Chronicle of a Small War,Michael Kelly,2001,Vintage Books USA
24835,1560254971,8,Liverpool Fantasy,Larry Kirwan,2003,Thunder's Mouth Press
24835,1573222453,10,The Kite Runner (Alex Awards (Awards)),Khaled Hosseini,2003,Riverhead Books
24835,1582340986,5,New York Sawed in Half : An Urban Historical (Urban Historicals),Joel Rose,2001,Bloomsbury USA
24835,1860491022,9,I Capture the Castle,Dodie Smith,1996,Trafalgar Square
24838,28604385,8,Traveling: Three Months on the Nba Road,John E. Nordahl,1995,MacMillan Publishing Company.
24838,60938455,10,Fast Food Nation: The Dark Side of the All-American Meal,Eric Schlosser,2002,Perennial
24838,034910509X,10,French Lessons in Africa:  Travels With My Briefcase Through French Africa,Peter Biddlecombe,2002,Abacus (UK)
24838,773760571,10,Ultimate Hockey,Glenn Weir,1999,Stoddart
24838,786887567,10,ESPN the Magazine Presents Answer Guy: Extinguishing the Burning Questions of Sports with the Water Bucket of Truth,Brendan O'Connor,2002,Hyperion
24838,802713491,10,The Basque History of the World,Mark Kurlansky,1999,Walker &amp; Company
24838,156282788X,10,"If You're Talking to Me, Your Career Must Be in Trouble: Movies, Mayhem, and Malice",Joe Queenan,1994,Hyperion Books
24838,1566563496,8,Mexico City: A Cultural and Literary Companion (Cities of the Imagination),Nick Caistor,2000,Interlick Books
24838,1581821875,5,The Summer That Saved Baseball : A 38-Day Journey to Thirty Major League Ballparks,Brad Null,2001,Cumberland House Publishing
