User-ID,ISBN,Book-Rating,Book-Title,Book-Author,Year-Of-Publication,Publisher
31556,821718436,5,Night Stone,Rick Hautala,1986,Zebra/pinnacle Books
31556,822492156,6,Last of the Mohicans (Pacemaker Classics),John Smith Harrison,1967,Globe Fearon
31556,826308791,7,The Education of Little Tree (A Zia Book),Forrest Carter,1986,University of New Mexico Press
31556,828004064,5,Give me a break,Colleen L Reece,1988,Review and Herald Pub. Association
31556,836220854,5,Far Side Gallery 2,Gary Larson,2003,Andrews McMeel Publishing
31556,836819675,7,The Kid's Nature Book: 365 Indoor/Outdoor Activities and Experiences (Kids Cani),Susan Milord,1997,Gareth Stevens Publishing
31556,836822323,6,Kids Create!: Art &amp; Craft Experiences for 3- To 9-Year Olds (Kids Can),Laurie Carlson,1999,Gareth Stevens Publishing
31556,842321934,7,The Vanishings (Left Behind: The Kids #1),Jerry B. Jenkins,1998,Tyndale House Publishers
31556,843103914,6,Wee Sing and Play Book,Pamela Conn Beall,1987,Price Stern Sloan
31556,084311438X,6,Wee Sing Nursery Rhymes &amp; Lullabies,Pamela Conn Beall,1985,Price Stern Sloan
31556,843127600,6,Wee Sing Fun 'n' Folk Book,Pamela Conn Beall,1989,Price Stern Sloan
31556,865303339,5,Preparing Students to Raise Achievement Scores Grades 5 to 6 (Kids' Stuff),Leland Graham,1996,Incentive Publications
31556,087666933X,8,Rats,Susan Fox,1988,TFH Publications
31556,877849455,7,Who You Are When No One's Looking,William Hybels,1987,InterVarsity Press
31556,887430023,5,Up Went the Goat,Barbara Gregouth,1984,School Zone Publishing Company
31556,887430058,5,Fox on the Box: Start to Read,Barbara Gregorich,1984,School Zone Publishing Company
31556,887430104,7,Good Night,Barbara Gregorich,1984,School Zone Publishing Company
31556,887430252,5,"Mouse and Owl Start to Read Level 3 (School Zone Start to Read Book, Level 3)",Joan Hoffman,2000,School Zone Publishing Company
31556,887432654,6,"New Bike (School Zone Start to Read Book, Level 2)",Marie Vinje,1992,School Zone Publishing Company
31556,887432689,5,The Last Game (A School Zone Start to Read Book. Level 3),Joan Hoffman,1992,School Zone Publishing Company
31556,887434010,5,I Want a Pet: Level 1 (Start to Read! Trade Edition Series),Barbara Gregorich,1992,School Zone Publishing Company
31556,893753440,10,Call of the Wild (A Watermill Classic),Jack London,1987,Troll Communications
31556,089375403X,8,Strange Stories of the Supernatural (A Watermill Classic),Troll Books,1993,Troll Communications
31556,893754064,5,Famous Ghost Stories (A Watermill Classic),Amelia B. Edwards,1993,Troll Communications
31556,893754102,8,The Hound of the Baskervilles (Watermill Classic),"Arthur Conan, Sir Doyle",1980,Dutton Books
31556,893755591,7,Amazing World Of Ants - Pbk,Francene Sabin,1997,Troll Communications
31556,893756083,9,Around the World in 80 Days,Jules Verne,1981,Troll Communications
31556,894800795,9,Shrinklits: Seventy of the World's Towering Classics Cut Down to Size,Maurice. Sagoff,1980,Workman Publishing
31556,916392295,7,Value of Responsibility: The Story of Ralph Bunche (Valuetales),Ann Donegan Johnson,1978,Value Communications
31556,931378028,8,"Earthquakes and Young Volcanoes Along the Eastern Sierra: At Mammoth Lakes, 1980, Lone Pine 1872, Inyo and Mono Craters",Charles Dean Rinehart,1982,Natl Book Network
31556,944708234,5,Organized to Be the Best!: New Timesaving Ways to Simplify and Improve How You Work,Susan Silver,1991,Adams Hall Pub
31556,1558743669,8,A Child Called \It\: One Child's Courage to Survive,Dave Pelzer,1995,Health Communications
31556,1561560103,7,How to Play Little League Baseball,Preller,1991,Kidsbooks.Com
31556,1562822500,6,Green-Eyed Pearl (Disney's the Little Mermaid Series),Suzanne Weyn,1992,Disney Pr
31556,1564134229,7,Las Vegas and Laughlin,Southern California Edit Auto Club,1998,Automobile Club of Southern California
31556,1564586626,8,DK Pockets: Dinosaurs,Neil Clark,1995,Treasure Chest Books
31556,1570642702,8,The Hunchdog of Notre Dame (The Adventures of Wishbone #5),Michael Jan Friedman,1997,Big Red Chair Books
31556,1570643059,8,"Moby Dog (Adventures of Wishbone , No. 10)",Alexander Steele,1998,Big Red Chair Books
31556,1570643296,7,"Unleashed in Space (Super Adventures of Wishbone, No 3)",Alexander Steele,1999,Big Red Chair Books
31556,1575050714,7,"Roller Coasters: Or I Had So Much Fun, I Almost Puked (Carolrhoda Photo Books (Hardcover))",Nick Cook,1998,Carolrhoda Books
31556,1575849771,5,Barbie Sticker Panorama Books Starlight Ball (Barbie),Linda Aber,2002,Reader's Digest
31556,1584852755,5,Samantha and the Missing Pearls (The American Girls Collection),Valerie Tripp,2001,Pleasant Company Publications
31556,158663061X,6,'N Sync,Lexi Martin,2000,MetroBooks (NY)
31556,1588650227,7,Against the Odds Four True Life Stories About Courage (Winner's Circle Values in Action),Justin Ray Thompson,2002,"Kidsbooks, Inc."
31556,1853913057,7,Create Your Own Cross Stitch: How to Turn Your Design Ideas into Reality,Shirley Watts,1994,Tuttle Publishing
31556,1881527360,5,How to Spot an Owl (The How to Spot Series),Patricia Taylor Sutton,1996,Houghton Mifflin Co
31556,1885222556,6,Disneys Out and About With Pooh Volume 1,Disney Enterprises Inc,1996,"Advance Publishing, Inc"
31560,440234743,6,The Testament,John Grisham,1999,Dell
31562,60172096,6,The Re-Enchantment of Everyday Life,Thomas Moore,1996,Harpercollins
31564,385720106,8,A Map of the World,Jane Hamilton,1999,Anchor Books/Doubleday
31564,440218535,5,Smilla's Sense of Snow,Peter Hoeg,1997,Island
31567,321125290,10,"The Macintosh Digital Hub: An Interactive Guide to iTunes, iPhoto, iMovie, and iDVD",Jim Heid,2002,Peachpit Press
31571,345332636,10,A Short History of a Small Place,T.R. Pearson,1991,Ballantine Books
31579,61097101,8,The Saving Graces: A Novel,Patricia Gaffney,2000,HarperTorch
31580,61056774,4,The X-Files: Ground Zero,Kevin J. Anderson,1996,HarperEntertainment
31580,441802087,5,Tekwar,William Shatner,1990,Ace Books
31586,671648586,6,His Little Women: A Novel,Judith Rossner,1990,Simon &amp; Schuster
31590,679456937,8,The Inn at Lake Devine: A Novel,Elinor Lipman,1998,Random House
31591,670881791,9,Chocolat: A Novel,Joanne Harris,1999,Viking Books
31593,1880966360,9,"Glimmer Train Stories, #37",Susan Burmeister-Brown,2000,Glimmer Train Pr Inc
31594,20080956,5,"The Elements of Business Writing: A Guide to Writing Clear, Concise Letters, Memos, Reports, Proposals, and Other Business Documents",Gary Blake,1992,MacMillan Publishing Company
31594,20136803,5,CassellÂ¿s French &amp; English Dictionary,J. H.  Douglas,1986,John Wiley &amp; Sons
31594,28626923,10,Arco Teach Yourself the Gmat Cat in 24 Hours (Arcos Teach Yourself in 24 Hours Series),Mark A. Stewart,1998,John Wiley &amp; Sons
31594,133331881,5,Frmr Italy 91,Haggart,1991,Prentice Hall
31594,138519323,8,Strategic Marketing for Nonprofit Organizations,Philip Kotler,1991,Prentice Hall
31594,375759093,7,The Summer They Came : A Novel,WILLIAM STORANDT,2002,Villard
31594,395712351,9,OB in action: Cases and exercises,Janet W Wohlberg,1995,Houghton Mifflin
31594,440221102,9,The Complete Book of Food Counts (Complete Book of Food Counts),Corinne T. Netzer,1998,Dell
31594,044651652X,5,The Bridges of Madison County,Robert James Waller,1992,Warner Books
31594,471352284,9,The Average Family's Guide to Financial Freedom How You can Save a Small Fortune on a Modest Income,Bill  Toohey,2000,Wiley
31594,684834995,5,"Ben Jerry's Double Dip : Lead With Your Values and Make Money, Too",Ben Cohen,1997,Simon &amp; Schuster
31594,761520295,5,"1,001 Ways to Keep Customers Coming Back: Wow Ideas That Make Customers Happy and Will Increase Your Bottom Line",Donna Greiner,1999,Prima Lifestyles
31594,785805826,5,Flavor of Normandy,Carole Clements,1996,Book Sales
31594,808002406,7,Business Plans That Work for Your Small Business: For Your Small Business (Cch Business Owner's Toolkit Series),Susan M. Jacksack,1998,CCH Incorporated
31594,831771593,8,'Webster's New Business Writer's Guide (Webster's Dictionary Series),Merriam-Webster,1998,Smithmark Publishers
31594,967907306,5,All Flowers Die,Andrew K. Stone,1999,So There Books
31594,1570712190,9,Your First Business Plan: A Simple Question and Answer Format Designed to Help You Write Your Own Plan (Your First Business Plan),Joseph Covello,1998,Sourcebooks
31594,1574101277,5,"Anatomy of a Business Plan: A Step-By-Step Guide to Starting Smart, Building the Business, and Securing Your Company's Future (Anatomy of a Business Plan)",Linda Pinson,1999,Dearborn Financial Publishing
31594,1861001568,5,Instant HTML Programmer's Reference Html,Alex Homer,1997,Peer Information Inc.
31598,883442809,8,Letters from the Desert,Carlos Carretto,1982,Orbis Books
31601,140060898,6,The Mosquito Coast,Paul Theroux,1996,Penguin Books
31609,60523883,4,Call Me the Breeze,Patrick McCabe,2003,HarperCollins
31609,60559128,4,"Holy Fools : A Novel (Harris, Joanne)",Joanne Harris,2004,William Morrow
31609,312305060,7,The Hours: A Novel,Michael Cunningham,2002,Picador
31609,312422156,9,Middlesex: A Novel,Jeffrey Eugenides,2003,Picador
31609,345450914,6,Seduction of Water (Ballantine Reader's Circle),CAROL GOODMAN,2003,Ballantine Books
31609,525947671,8,The Lady and the Unicorn,Tracy Chevalier,2003,Dutton Adult
31609,805073205,7,"Oracle Night : A Novel (Auster, Paul)",Paul Auster,2003,Henry Holt and Co.
31609,812971043,8,The Dante Club : A Novel,MATTHEW PEARL,2004,Random House Trade Paperbacks
31609,1400031699,7,The Little Friend,Donna Tartt,2003,Vintage
31609,1400042070,6,The Amateur Marriage: A Novel,ANNE TYLER,2004,Knopf
31609,1573226882,7,Fever Pitch,Nick Hornby,1998,Riverhead Books
31612,440213282,5,No Greater Love,Danielle Steel,1992,Dell
31614,425180964,9,The Bear and the Dragon (Jack Ryan Novels),Tom Clancy,2001,Berkley Publishing Group
31614,767902467,8,The Knot's Complete Guide to Weddings,CARLEY RONEY,1998,Broadway
31614,811816656,6,The Paranoid's Pocket Guide,Cameron Tuttle,1997,Chronicle Books
31614,836221966,5,You Don't Need Experience if You've Got Attitude,Scott Adams,1996,Andrews McMeel Publishing
31614,836221974,5,Conversations With Dogbert: A Dilbert Book,Scott Adams,1996,Andrews McMeel Publishing
31614,089480829X,9,What to Expect When You're Expecting (Revised Edition),Arlene Eisenberg,1996,Workman Pub Co
31614,1572151056,3,Crafts for the Home,Jilly Glassborrow,1995,"World Publications, Inc. (MA)"
31619,460874306,8,East Lynne (Everyman's Library),Mrs. Henry Wood,1994,Tuttle Pub
31620,345417623,7,Timeline,MICHAEL CRICHTON,2000,Ballantine Books
31624,62512021,6,The Knitting Sutra: Craft as a Spiritual Practice,Susan G. Lydon,1997,HarperSanFrancisco
31624,345346491,9,Walking Across Egypt,Clyde Edgerton,1989,Ballantine Books
31624,394589955,7,Vox,Nicholson Baker,1992,Random House Inc
31624,553578243,7,A Darker Place,Laurie R. King,1999,Bantam Books
31624,067087485X,5,Out to Canaan (The Mitford Years),Jan Karon,1997,Viking Books
31624,679403582,8,Dead Man Walking: An Eyewitness Account of the Death Penalty in the United States,Helen Prejean,1993,Random House
31624,1887374426,8,"The Complete Candlemaker: Techniques, Projects, and Inspirations",Norma Coney,1997,Sterling Pub Co Inc
31628,310252172,9,Rumors of Another World: What on Earth Are We Missing?,Philip Yancey,2003,Zondervan Publishing Company
31633,60987219,8,Polaroids from the Dead,Douglas Coupland,1997,Regan Books
31635,375760911,6,The Idiot Girls' Action Adventure Club,Laurie Notaro,2002,Villard Books
31639,439099404,7,Adventures of Tom Sawyer,Mark Twain,1999,Scholastic
31639,698118650,7,Backwater,Joan Bauer,2000,Putnam Publishing Group
31639,816714649,8,Adventures of Huckleberry Finn (Watermill),Mark Twain,1988,Troll Communications
31644,60193506,4,"Cybill Disobedience : How I Survived Beauty Pageants, Elvis, Sex, Bruce Willis, Lies, Marriage, Motherhood, Hollywood, and the Irrepressible Urge to Say What I Think",Cybill Shepherd,2000,HarperCollins Publishers
31647,142000205,9,Icy Sparks,Gwyn Hyman Rubio,2001,Penguin Books
31649,156000024,8,"Consider This, Senora",Harriet Doerr,1994,Harvest Books
31649,375700757,8,Cold Mountain : A Novel,CHARLES FRAZIER,1998,Vintage
31650,1568846355,8,Computer Security for Dummies,Peter T. Davis,1996,John Wiley &amp; Sons
31652,61093084,6,Everville : The Second Book of the Art,Clive Barker,1995,HarperTorch
31652,142001619,7,Salt: A World History,Mark Kurlansky,2003,Penguin Books
31652,345325265,6,Sounding,Hank Searles,1991,Ballantine Books
31652,373250150,5,Confessions of an Ex-Girlfriend,Lynda Curnyn,2002,Red Dress Ink
31652,038044156X,8,The Fly on the Wall,Tony Hillerman,1988,Harper Mass Market Paperbacks (Mm)
31652,440131855,5,GOD KNOWS,JOSEPH HELLER,1985,Dell
31652,051512608X,5,The Reef,Nora Roberts,1999,Jove Books
31652,670825379,3,The Satanic Verses,Salman Rushdie,1989,Viking Books
31652,671027360,9,Angels &amp; Demons,Dan Brown,2001,Pocket Star
31652,684838923,5,Dog Eat Dog : A Very Human Book About Dogs and Dog Shows,Michael Stern,1998,Fireside
31652,758204213,7,Masters of Midnight,Michael Thomas Ford,2003,Kensington Publishing Corporation
31652,821749749,6,Unquenchable,David Dvorkin,1995,Zebra Books
31652,1401088945,7,Ground Zero and Beyond,J. P. McCarthy,2003,Xlibris Corporation
31657,151008116,8,Life of Pi,Yann Martel,2002,Harcourt
31657,446394521,8,Daisy Fay and the Miracle Man,Fannie Flagg,1992,Warner Books
31657,689848218,10,A Charlie Brown Valentine (Peanuts),Charles  M. Schulz,2002,Little Simon
31658,312970943,10,Invitation to a Funeral,Molly Brown,1999,St. Martin's Dead Letter
31659,140296409,6,Disgrace,J. M. Coetzee,2000,Penguin Books
31659,312421273,6,The Corrections: A Novel,Jonathan Franzen,2002,Picador USA
31660,60959037,8,Prodigal Summer: A Novel,Barbara Kingsolver,2001,Perennial
31660,393315401,6,The End of a Primitive (Old School Books),Chester Himes,1997,W. W. Norton &amp; Company
31660,767902513,10,A Walk in the Woods: Rediscovering America on the Appalachian Trail,Bill Bryson,1998,Bantam Dell Pub Group
31660,1580050662,9,Drive: Women's True Stories from the Open Road,Jennie Goode,2002,Seal Press (WA)
31663,3548245897,9,Hin und weg.,Ethan Hawke,1999,Ullstein Buchverlage GmbH &amp; Co. KG / Ullstein Tas
31664,312289871,9,Robert Ludlum's The Paris Option : A Covert-One Novel (A Covert-One Novel),Robert Ludlum,2002,St. Martin's Griffin
31664,399133453,6,The Cardinal of the Kremlin,Tom Clancy,1988,Putnam Publishing Group
31664,679403566,3,White Shark,Peter Benchley,1994,Random House Inc
31667,60177888,10,All I Know About Animal Behavior I Learned in Loehmann's Dressing Room,Erma Bombeck,1995,Harpercollins
31668,385509456,8,The Curious Incident of the Dog in the Night-Time : A Novel,MARK HADDON,2003,Doubleday
31671,375703160,10,Beyond Belief : The Secret Gospel of Thomas (Vintage),ELAINE PAGELS,2004,Vintage
31674,671834975,5,BEST ROB SLVERBERG,Robert Silverberg,1980,Pocket
31677,316168815,8,The Lovely Bones,Alice Sebold,2004,Back Bay Books
31681,99288559,7,Welcome to the World Baby Girl,Fannie Flagg,0,Trafalgar Square
31681,140262385,10,All Points North Yorkshire,Simon Armitage,0,Penguin Uk
31681,330301497,8,Madwomans Underclothes Essays and Occasion,Germaine Greer,0,Pan Books Ltd
31681,034910476X,9,View From the Diners Club,Gore Vidal,0,Firebird Distributing
31681,413163806,5,Murder in the English Department,V. Miner,1988,Mandarin
31681,439997119,7,The Tin Princess,Philip Pullman,2000,Scholastic Ltd
31681,044022859X,9,Holes (Readers Circle),LOUIS SACHAR,2001,Laurel Leaf
31681,552990868,5,More Tales of the City,Maupin,0,Bantam Doubleday Dell
31681,586067353,9,The Diary of Elizabeth Pepys,Dale Spender,1991,HarperCollins Publishers
31681,590112899,9,"The Subtle Knife (His Dark Materials, Book 2)",Philip Pullman,1998,Scholastic Point
31681,061809542X,9,Absolutely American: Four Years at West Point,David Lipsky,2003,Houghton Mifflin Company
31681,185326086X,10,Dracula (Wordsworth Classics),B. Stoker,1997,NTC/Contemporary Publishing Company
31681,1853261580,10,The Little Prince (Wordsworth Collection),Antoine de Saint-ExupÃ©ry,1998,NTC/Contemporary Publishing Company
31681,1857026853,8,Vicious Circle,Amanda Craig,0,Fourth Estate
31683,345313860,6,"The Vampire Lestat (Vampire Chronicles, Book II)",ANNE RICE,1986,Ballantine Books
31683,044651652X,10,The Bridges of Madison County,Robert James Waller,1992,Warner Books
31688,345361792,10,A Prayer for Owen Meany,John Irving,1990,Ballantine Books
31688,451170385,8,Four Past Midnight,Stephen King,2001,Signet Book
31688,671776975,9,A RIVER RUNS THROUGH IT AND OTHER STORIES : AND OTHER STORIES,Norman Maclean,1992,Pocket
31688,688177867,7,The Book Borrower: A Novel,Alice Mattison,2000,Perennial
31688,743412028,8,Pay It Forward,Catherine Ryan Hyde,2000,Pocket
31688,804106304,9,The Joy Luck Club,Amy Tan,1994,Prentice Hall (K-12)
31692,380707063,5,An Alien Light,Nancy Kress,1989,Harper Mass Market Paperbacks (Mm)
31692,425128946,9,Reaper,C. Terry Cline,1991,Berkley Pub Group
31692,671867113,7,Moonlight Becomes You,Mary Higgins Clark,1997,Pocket
31694,60086386,8,Filthy Rich,Dorothy Samuels,2002,Avon Trade
31695,61097314,8,The Bean Trees,Barbara Kingsolver,1998,HarperTorch
31695,671040588,8,Boone's Lick : A Novel,Larry McMurtry,2002,Pocket
31695,684801051,10,TIME AND AGAIN,Jack Finney,1995,Touchstone
31698,671439960,8,WLD ACCORDNG GARP,Irving,1981,Pocket
31698,671468073,6,BY PRICKING THUMB,Agatha Christie,1983,Pocket
31701,037541309X,8,Balzac and the Little Chinese Seamstress,Dai Sijie,2001,Alfred A. Knopf
31702,373218036,6,"Truly, Madly Manhattan",Nora Roberts,2003,Silhouette
31702,375503757,3,"What She Saw in Roger Mancuso, Gunter Hopstock, Jason Barry Gold, Spitty Clark, Jack Geezo, Humphrey Fung, Claude Duvet, Bruce Bledstone, Kevin mcfeel: Ey, Arnold Allen, Pablo Miles, Anonymous 1-4, Nobody 5-8, Neil Schmertz, and Bo Pierce : A Novel",Lucinda Rosenfeld,2000,Random House
31702,670894710,8,Bitten,Kelley Armstrong,2001,Viking Books
31702,743411250,9,The Woman Next Door,Barbara Delinsky,2002,Pocket
31702,1891946013,8,Night Prayers: A Vampire Novel,P. D. Cacek,1998,Design Image Group Inc.
31709,440400759,8,Just As Long As We're Together,Judy Blume,1988,Yearling Books
31712,61099252,8,Family Pictures,Sue Miller,1991,HarperTorch
31712,64407853,9,"Welcome to the Grand View, Hannah!",Mindy Warshaw Skolsky,2000,HarperTrophy
31712,380706873,7,Always and Forever Friends,C. S. Adler,1990,Harpercollins Juvenile Books
31712,590486705,8,At Her Majesty's Request,Walter Dean Myers,1999,Scholastic Inc.
31714,312983271,6,Full House (Janet Evanovich's Full Series),Janet Evanovich,2002,St. Martin's Paperbacks
31714,552143774,8,Horse Whisperer,Nicholas Evans,0,Bantam Doubleday Dell
31714,553576143,8,The Cry of the Halidon,Robert Ludlum,1996,Bantam Books
31714,553578308,6,Tough Cookie,Diane Mott Davidson,2001,Bantam Books
31714,671568175,5,Let Me Call You Sweetheart,Mary Higgins Clark,1996,Pocket
31714,671758896,6,"Loves Music, Loves to Dance",Mary Higgins Clark,1992,Pocket
31714,804115621,9,Weighed in the Balance (William Monk Novels (Paperback)),Anne Perry,1997,Ivy Books
31717,325700544X,5,Das Biest des Monsieur Racine.,Tomi Ungerer,1999,Diogenes
31717,3257008422,7,Flix.,Tomi Ungerer,1997,"Diogenes Verlag, ZÃ?Â¼rich"
31718,786866020,6,Fish! A Remarkable Way to Boost Morale and Improve Results,Stephen C. Lundin,2000,Hyperion
31722,843175842,6,Titan A.E: The Junior Novelization (Titan a. E),C. R. Daly,2000,Price Stern Sloan
31736,688177751,7,Miss Julia Speaks Her Mind : A Novel,Ann B. Ross,2000,Perennial
31740,61097101,5,The Saving Graces: A Novel,Patricia Gaffney,2000,HarperTorch
31740,373218486,5,Going Home: Unfinished Business/ Island of Flowers/ Mind Over Matter,Nora Roberts,2002,Silhouette
31740,375725784,3,A Heartbreaking Work of Staggering Genius,Dave Eggers,2001,Vintage Books USA
31740,399141146,8,The Hundred Secret Senses,Amy Tan,1995,Putnam Pub Group
31740,425152251,3,Sophie's World: A Novel About the History of Philosophy,Jostein Gaarder,1996,Berkley Publishing Group
31740,446525731,6,The Christmas Train,David Baldacci,2002,Warner Books
31740,452282829,8,We Were the Mulvaneys,Joyce Carol Oates,1996,Plume
31740,670855049,6,Away: A Novel,Jane Urquhart,1994,Viking Books
31740,688176992,10,Finding Fish: A Memoir,Antwone Quenton Fisher,2001,William Morrow &amp; Company
31740,1573225789,10,The Color of Water: A Black Man's Tribute to His White Mother,James McBride,1997,Riverhead Books
31742,515127744,6,Bedazzled (Magical Love Romances),Christine Holden,2000,Jove Books
31742,067179938X,10,Son of the Morning,Linda Howard,1997,Pocket
31742,671887971,9,Ring of Truth,Nancy Pickard,2001,Atria
31750,385311044,10,Daybreak,Belva Plain,1994,Bantam Dell Pub Group
31751,672317249,5,Sams Teach Yourself Html 4 in 24 Hours (Sams Teach Yourself ... in 24 Hours),Dick Oliver,1999,Sams
31757,60186275,8,Dancing with the Witchdoctor,Kelly James,2001,William Morrow &amp; Company
31760,312244266,8,Winter Solstice,Rosamunde Pilcher,2000,Thomas Dunne Books
31761,743430999,10,The Looking Glass,Richard Paul Evans,2002,Pocket
31763,515127213,9,The Courtship,Catherine Coulter,2000,Jove Books
31766,789723700,8,The Art and Science of Web Design,Jeffrey Veen,2000,Pearson Education
31767,307261050,10,"I Like Stars (Step-Into-Reading, Step 1)",MARGARET WISE BROWN,1998,Random House Books for Young Readers
31768,1551666588,7,With Malice,Rachel Lee,2003,Mira Books
31775,446611867,7,A Bend in the Road,Nicholas Sparks,2002,Warner Books
31778,60193255,7,Celeste Ascending,Kaylie Jones,2000,HarperCollins Publishers
31779,316776963,5,Me Talk Pretty One Day,David Sedaris,2001,Back Bay Books
31779,452281725,5,The Quilter's Apprentice,Jennifer Chiaverini,2000,Plume Books
31779,609804138,7,The Sweet Potato Queens' Book of Love,JILL CONNER BROWNE,1999,Three Rivers Press
31779,786705973,4,South: A Memoir of the Endurance Voyage,Ernest Shackleton,1998,Carroll &amp; Graf Publishers
31785,786813369,10,Petey,Ben Mikaelsen,2000,Hyperion Books for Children
31786,767906632,9,Life Makeovers,CHERYL RICHARDSON,2000,Broadway Books
31790,316602051,2,The Jester,James Patterson,2003,"Little, Brown"
31790,316789976,7,The Weight of Water : A Novel Tag - Author of Resistance and Strange Fits of Passion,Anita Shreve,1997,"Little, Brown"
31791,142001805,8,The Eyre Affair: A Novel,Jasper Fforde,2003,Penguin Books
31791,452260116,7,Song of Solomon (Oprah's Book Club (Paperback)),Toni Morrison,1987,Plume Books
31796,042515579X,6,Hunting Game (Elena Jarvis Mystery),Nancy Herndon,1996,Berkley Publishing Group
31803,330332104,3,Streamskelter,Simon Harding,1994,Pan Macmillan
31810,596005830,10,Linux Unwired,Roger Weeks,2004,O'Reilly
31810,1593270348,10,Linux for Non-Geeks,Rickford Grant,2004,No Starch Press
31810,1886411999,10,Absolute OpenBSD: UNIX for the Practical Paranoid,Michael W. Lucas,2003,No Starch Press
31815,933670079,10,Braving the Waves: Rockaway Rises -- And Rises Again,Kevin Boyle,2002,Rising Star Press
31816,60502258,7,The Divine Secrets of the Ya-Ya Sisterhood: A Novel,Rebecca Wells,2002,HarperTorch
31816,312954468,10,River God,Wilbur A. Smith,1995,St. Martin's Press
31816,446363251,7,Scarlett : The Sequel to Margaret Mitchell's \Gone With the Wind\,Alexandra Ripley,1992,Warner Books
31816,446365386,9,Gone with the Wind,Margaret Mitchell,1993,Warner Books
31816,486209741,5,Five Acres and Independence: A Handbook for Small Farm Management,M. G. Kains,0,Dover Publications
31816,930031741,6,The Contrary Farmer (Real Goods Independent Living Book),Gene Logsdon,1995,Chelsea Green Publishing Company
31816,157061377X,6,The Encyclopedia of Country Living: An Old Fashioned Recipe Book,Carla Emery,2003,Sasquatch Books
31816,1577484495,7,Short Stories for Long Rainy Days: Simple Tales of Life and Love,K. Douglass,1999,Promise Press
31817,055337933X,8,Fierce Invalids Home from Hot Climates,TOM ROBBINS,2001,Bantam
31818,440211727,8,A Time to Kill,JOHN GRISHAM,1992,Dell
31820,038533334X,6,Charming Billy,Alice McDermott,1999,Delta
31820,1567430325,7,In the Spirit: The Inspirational Writings of Susan L. Taylor,Susan L. Taylor,1993,Amistad Press
31820,1573228281,7,A Gesture Life,Chang-Rae Lee,2000,Riverhead Books
31822,312952813,8,The Black Ice (Detective Harry Bosch Mysteries),Michael Connelly,1996,St. Martin's Press
31822,446602809,9,Romance,Ed McBain,1996,Warner Books
31822,553571923,7,Breakheart Hill,Thomas H. Cook,1996,Bantam Books
31822,786890002,9,The Art of Deception,Ridley Pearson,2003,Hyperion
31823,60929790,10,One Hundred Years of Solitude,Gabriel Garcia Marquez,1998,Perennial
31823,312272782,8,This Is Graceanne's Book : A Novel,P. L. Whitney,2001,St. Martin's Griffin
31826,28603958,10,Betty Crocker's New Cookbook: Everything You Need to Know to Cook (8th ed),Betty Crocker,1996,MacMillan Publishing Company.
31826,28604032,10,The New York Public Library Science Desk Reference (The New York Public Library Series),Patricia Barnes-Svarney,1995,MacMillan Publishing Company.
31826,28613228,10,The New York Public Library American History Desk Reference (New York Public Library Series),Frommer,1997,MacMillan Publishing Company.
31826,28631188,10,"Webster's New World College Dictionary, Indexed Fourth Edition",Michael E.  Agnes,1999,Webster's New World
31826,60161701,10,"I Want to Grow Hair, I Want to Grow Up, I Want to Go to Boise: Children Surviving Cancer",Erma Bombeck,1989,Harpercollins
31826,60172940,10,365 All-American Favorites,Sarah Reynolds,1997,HarperCollins Publishers
31826,60177888,10,All I Know About Animal Behavior I Learned in Loehmann's Dressing Room,Erma Bombeck,1995,Harpercollins
31826,60183225,10,A Marriage Made in Heaven... or Too Tired for an Affair,Erma Bombeck,1993,Harpercollins
31826,60263857,10,Charlotte's Web,E. B. White,1952,Harpercollins Juvenile Books
