User-ID,ISBN,Book-Rating,Book-Title,Book-Author,Year-Of-Publication,Publisher
114937,892749415,5,What Jesus Taught about Manifesting Abundance,John Avanzini,1996,Harrison House
114937,1556611188,10,The Calling of Emily Evans (Women of the West (Paperback Bethany House)),Janette Oke,1990,Bethany House Publishers
114937,1556611536,10,"Julia's Last Hope (Oke, Janette, Women of the West.)",Janette Oke,1990,Bethany House Publishers
114940,99771519,10,Memoirs of a Geisha Uk,Arthur Golden,0,Trafalgar Square
114942,60915544,8,The Bean Trees,Barbara Kingsolver,1989,Perennial
114949,60540753,9,Patron Saint of Liars : A Novel,Ann Patchett,2003,Perennial
114955,316789089,8,The Pilot's Wife : A Novel Tag: Author of the Weight of Water (Oprah's Book Club (Hardcover)),Anita Shreve,1999,"Little, Brown"
114959,1551669021,10,Like Silk,Mary Lynn Baxter,2002,Mira
114964,345419995,7,Dave Barry's Greatest Hits,Dave Barry,1997,Ballantine Books
114977,807070874,7,Waist-High in the World: A Life Among the Nondisabled,Nancy Mairs,1998,Beacon Press
114983,60972459,8,Tracks RI,Louise Erdrich,2004,Perennial
114983,99485206,5,Black Baron (Combat Heroes S.),Joe Dever,1986,Red Fox
114983,140431179,8,"The Strange Case of Dr. Jekyll and Mr. Hyde, and Other Stories (The Penguin English Library)",Robert Louis Stevenson,1979,Penguin Books
114983,192834401,8,The Castle of Otranto: A Gothic Story (Oxford World's Classics),Horace Walpole,1998,Oxford University Press
114983,192835904,5,The Private Memoirs and Confessions of a Justified Sinner (Oxford World's Classics (Paperback)),James Hogg,1999,Oxford Univ Press
114983,192836668,7,A Sicilian Romance (Oxford World's Classics),Ann Radcliffe,1998,Oxford University Press
114983,451454022,8,The Immortals,Tracy Hickman,1996,Roc
114983,971880107,2,Wild Animus,Rich Shapero,2004,Too Far
114987,380818973,8,Asking for Trouble: A Novel,Elizabeth Young,2001,Avon Trade
114987,679748261,5,"Goodbye, Columbus : And Five Short Stories (Vintage International)",Philip Roth,1993,Vintage Books USA
114987,1573221856,7,High Maintenance,Jennifer Belle,2001,Riverhead Hardcover
114988,7154607,8,Colors Insulting to Nature : A Novel,Cintra Wilson,2004,Fourth Estate
114988,60012331,7,The Amazing Maurice and His Educated Rodents,Terry Pratchett,2001,Harpercollins Juvenile Books
114988,60013117,8,Night Watch,Terry Pratchett,2002,HarperCollins
114988,60175966,7,The Professor and the Madman,Simon Winchester,1998,HarperCollins Publishers
114988,60185716,6,Triggerfish Twist: A Novel,Tim Dorsey,2002,William Morrow &amp; Company
114988,60195622,7,Set This House in Order: A Romance of Souls,Matt Ruff,2003,HarperCollins
114988,60391480,8,Microserfs,Douglas Coupland,1995,Harpercollins
114988,60507772,7,The Last Hero : A Discworld Fable,Terry Pratchett,2002,Eos
114988,60808233,8,Busman's Honeymoon: A Love Story with Detective Interruptions,Dorothy L. Sayers,1986,HarperCollins Publishers
114988,60920084,7,The Lost Continent: Travels in Small-Town America,Bill Bryson,1990,Perennial
114988,60931280,1,Bingo Queens of Paradise : A Novel,June Park,2000,Perennial
114988,60932902,8,Genome,Matt Ridley,2000,Perennial
114988,60934719,8,stardust,Neil Gaiman,2001,Perennial
114988,60972122,7,The Mysteries of Pittsburgh,Michael Chabon,1989,Perennial
114988,006098824X,7,Getting Over It,Anna Maxted,2001,Regan Books
114988,61043559,9,Murder Must Advertise,Dorothy L. Sayers,1995,HarperTorch
114988,62502182,7,The Alchemist: A Fable About Following Your Dream,Paulo Coelho,1995,HarperSanFrancisco
114988,64408655,8,"The Vile Village (A Series of Unfortunate Events, Book 7)",Lemony Snicket,2001,HarperCollins
114988,64408663,9,"The Hostile Hospital (A Series of Unfortunate Events, Book 8)",Lemony Snicket,2001,HarperCollins
114988,140244816,8,What's A Girl Gotta Do,Sparkle Hayter,1995,Penguin Books
114988,140244883,10,Restoration: A Novel of Seventeenth-Century England,Rose Tremain,1994,Penguin Books
114988,140245480,6,The Red Queen: Sex and the Evolution of Human Nature,Matt Ridley,1995,Penguin (Non-Classics)
114988,140262032,8,Revenge of the Cootie Girls: A Robin Hudson Mystery (Robin Hudson Mysteries (Paperback)),Sparkle Hayter,1998,Penguin Books
114988,140546235,6,The Day Jimmy's Boa Ate the Wash,Trinka Hakes Noble,1984,Puffin Books
114988,141002166,6,Blue Ridge,T. R. Pearson,2001,Penguin Books
114988,142000396,8,The Last Manly Man (Robin Hudson Mysteries (Paperback)),Sparkle Hayter,2001,Penguin Books
114988,014200362X,10,A Short History of a Small Place: A Novel,T. R. Pearson,2003,Penguin Books
114988,142004278,6,Big Fish,Daniel Wallace,2003,Penguin USA (Paper)
114988,015100692X,7,The Crimson Petal and the White,Michel Faber,2002,Harcourt
114988,151329168,5,The Four Loves,C. S. Lewis,1991,Harcourt
114988,312245556,9,Winter and Night,S. J. Rozan,2002,St. Martin's Minotaur
114988,312265867,6,To the Nines: A Stephanie Plum Novel,Janet Evanovich,2003,St. Martin's Press
114988,312271158,6,Never Count Out the Dead,Boston Teran,2001,St. Martin's Minotaur
114988,312274920,6,Round Ireland With a Fridge,Tony Hawks,2001,St. Martin's Press
114988,312291329,7,"Bone Dry : A Blanco County, Texas, Novel (Game Warden John Marlin, 2)",Ben Rehder,2003,St. Martin's Minotaur
114988,312291450,7,If Chins Could Kill : Confessions of a B Movie Actor,Bruce Campbell,2002,L.A. Weekly Books
114988,312306326,6,Visions of Sugar Plums,Janet Evanovich,2002,St. Martin's Press
114988,312858787,8,"Gun, With Occasional Music",Jonathan Lethem,1995,Tor Books
114988,312862202,5,Amnesia Moon,Jonathan Lethem,1996,Tor Books
114988,312956126,8,The Scold's Bridle,Minette Walters,1995,St. Martin's Press
114988,031298328X,1,Full Tilt (Janet Evanovich's Full Series),Janet Evanovich,2003,St. Martin's Paperbacks
114988,312983387,7,Killing the Shadows (St. Martin's Minotaur Mysteries),Val McDermid,2002,St. Martin's Paperbacks
114988,312983816,8,North of Nowhere : An Alex McKnight Novel (An Alex McKnight Novel),Steve Hamilton,2003,St. Martin's Minotaur
114988,312986769,7,In the Bleak Midwinter (A Rev. Clare Ferguson Mystery),Julia Spencer-Fleming,2003,St. Martin's Minotaur
114988,312992203,7,"Buck Fever (A Blanco County, Texas, Novel)",Ben Rehder,2003,St. Martin's Minotaur
114988,316153990,7,Blood Work (Blood Work),Michael Connelly,1998,"Little, Brown"
114988,316199648,9,Jim the Boy : A Novel,Tony Earley,2000,"Little, Brown"
114988,316313149,5,Drunk with Love,Ellen Gilchrist,1987,Back Bay Books
114988,316777730,7,Naked,David Sedaris,1998,Back Bay Books
114988,316779059,9,The Baby Book: Everything You Need to Know About Your Baby from Birth to Age Two,Martha Sears,1993,"Little, Brown"
114988,316779423,6,Barrel Fever : Stories and Essays (Barrel Fever),David Sedaris,1995,Back Bay Books
114988,316926108,7,Scoop,Evelyn Waugh,1999,Back Bay Books
114988,345319672,7,The Ballad of Typhoid Mary,J.F. Federspiel,1985,Ballantine Books
114988,345356535,7,Sick of Shadows,Sharyn McCrumb,1989,Ballantine Books
114988,345360362,8,Highland Laddie Gone,Sharyn McCrumb,1992,Ballantine Books
114988,345376749,7,Dead Folks' Blues (Harry James Denton Mysteries),Steven Womack,1993,Ballantine Books
114988,345379454,9,Missing Susan,SHARYN MCCRUMB,1992,Ballantine Books
114988,034538010X,7,Torch Town Boogie (Harry James Denton Mysteries),Steven Womack,1993,Ballantine Books
114988,345382323,9,The PMS Outlaws : An Elizabeth MacPherson Novel,Sharyn McCrumb,2001,Bantam Books
114988,345390431,7,Way Past Dead (Harry James Denton Mysteries),Steven Womack,1995,Ballantine Books
114988,345396871,7,Chain of Fools (Harry James Denton Mysteries),Steven Womack,1996,Ballantine Books
114988,034541215X,8,Bimbos of the Death Sun,SHARYN MCCRUMB,1996,Fawcett
114988,345436911,7,The Dress Lodger (Ballantine Reader's Circle),Sheri Holman,2001,Ballantine Books
114988,345460111,6,The Mommy Club (Ballantine Reader's Circle),SARAH BIRD,2003,Ballantine Books
114988,345460952,8,The Salmon of Doubt,DOUGLAS ADAMS,2003,Ballantine Books
114988,374525838,8,Family Man,Calvin Trillin,1999,"Farrar, Straus and Giroux"
114988,374526001,7,Travels with Alice,Calvin Trillin,1999,"Farrar, Straus and Giroux"
114988,375414207,8,A Handful of Dust (Everyman's Library (Cloth)),Evelyn Waugh,2002,Unknown Publisher - Being Researched
114988,375414878,9,Only Child : A Burke Novel (Burke Novels),ANDREW VACHSS,2002,Knopf
114988,375422366,6,Flynn's World : A Novel,GREGORY MCDONALD,2003,Pantheon
114988,375506276,9,The Fourth Hand,JOHN IRVING,2001,Random House
114988,375700757,5,Cold Mountain : A Novel,CHARLES FRAZIER,1998,Vintage
114988,375703632,8,The Love of a Good Woman : Stories,Alice Munro,1999,Vintage Books USA
114988,375708278,8,"Isaac's Storm: A Man, a Time, and the Deadliest Hurricane in History",Erik Larson,2000,Vintage Books USA
114988,375713123,8,The Rotters' Club (Vintage Contemporaries (Paperback)),Jonathan Coe,2003,Vintage Books USA
114988,375724672,5,True History of the Kelly Gang,Peter Carey,2001,Vintage Books USA
114988,375758224,10,"I Cannot Tell a Lie, Exactly: And Other Stories",Mary Ladd Gavell,2002,Random House Trade
114988,380710838,7,Fortune's Favorites,Colleen McCullough,1994,Avon
114988,380730200,10,The Giant's House : A Romance,Elizabeth McCracken,1997,Perennial
114988,380730790,10,Here's Your Hat What's Your Hurry: Stories,Elizabeth McCracken,1997,Perennial
114988,380789035,7,American Gods,Neil Gaiman,2002,HarperTorch
114988,380807343,8,Coraline,Neil Gaiman,2003,HarperTrophy
114988,380816555,6,Practical Demonkeeping,Christopher Moore,2000,Perennial
114988,380818191,8,"Truth, The",Terry Pratchett,2001,HarperTorch
114988,380975068,9,The Lust Lizard of Melancholy Cove,Christopher Moore,1999,Spike
114988,380976595,6,He Shall Thunder In The Sky: An Amelia Peabody Mystery,Elizabeth Peters,2000,William Morrow &amp; Company
114988,380978415,9,"Fluke : Or, I Know Why the Winged Whale Sings",Christopher Moore,2003,William Morrow &amp; Company
114988,385310161,5,Gai-Jin: A Novel of Japan,James Clavell,1993,Bantam Dell Pub Group
114988,038533558X,8,Gone For Good,HARLAN COBEN,2002,Delacorte Press
114988,385336489,10,Niagara Falls All Over Again,Elizabeth McCracken,2002,Delta
114988,385337388,8,The House of God: The Classic Novel of Life and Death in an American Hospital,Samuel Shem,2003,Delta Trade Paperbacks
114988,385485182,7,Girl in Landscape,Jonathan Lethem,1998,Bantam Dell Pub Group
114988,385489129,6,My Losing Season (Alex Awards (Awards)),Pat Conroy,2002,Nan A. Talese
114988,038549744X,9,English Passengers,Matthew Kneale,2001,Anchor Books/Doubleday
114988,385506198,6,The Natural: The Misunderstood Presidency of Bill Clinton,JOE KLEIN,2002,Doubleday
114988,385507593,7,Jennifer Government : A Novel,Max Barry,2003,Doubleday
114988,385720955,5,The Blind Assassin,Margaret Atwood,2001,Anchor Books/Doubleday
114988,385721420,10,Three Junes,JULIA GLASS,2003,Anchor
114988,393316041,8,"\Surely You're Joking, Mr. Feynman!\: Adventures of a Curious Character",Richard P. Feynman,1997,W. W. Norton &amp; Company
114988,394572343,8,Breathing Lessons,Anne Tyler,1988,Random House Inc
114988,394721411,7,The high window,Raymond Chandler,1976,Vintage Books
114988,394825993,7,"The Shadow in the North (Sally Lockhart Trilogy, Book 2)",PHILIP PULLMAN,1989,Laurel Leaf
114988,399141146,6,The Hundred Secret Senses,Amy Tan,1995,Putnam Pub Group
114988,399145672,7,Big Trouble,Dave Barry,1999,Putnam Publishing Group
114988,399150544,8,Fox Evil,Minette Walters,2003,G. P. Putnam's Sons
114988,039952438X,7,The Girlfriends' Guide to Toddlers,Vicki Iovine,1999,Perigee Books
114988,425132153,8,"Good Omens: The Nice and Accurate Prophecies of Agnes Nutter, Witch",Neil Gaiman,1995,Berkley Pub Group
114988,425175510,7,"A Little Traveling Music, Please (Honey Huckleberry Mysteries)",Margaret Moseley,2000,Berkley Prime Crime
114988,425184730,8,A Playdate With Death (Mommy-Track Mysteries (Hardcover)),Ayelet Waldman,2002,Berkley Publishing Group
114988,425190145,9,Death Gets a Time-Out (Mommy-Track Mysteries (Hardcover)),Ayelet Waldman,2003,Berkley Publishing Group
114988,440145465,7,King Rat,James Clavell,1993,Dell Publishing Company
114988,440178002,7,Shogun,JAMES CLAVELL,1986,Dell
114988,044022165X,4,The Rainmaker,JOHN GRISHAM,1996,Dell
114988,440225957,7,King Suckerman,George P. Pelecanos,1998,Dell Publishing Company
114988,440236053,4,Writ of Execution,Perri O'Shaughnessy,2002,Dell Publishing Company
114988,440237688,7,The Giver (Readers Circle),LOIS LOWRY,2002,Laurel Leaf
114988,440414806,9,Holes (Yearling Newbery),LOUIS SACHAR,2000,Yearling
114988,445409029,7,Edwin of the Iron Shoes,Marcia Muller,1990,Warner Books
114988,446357723,8,Fool On the Hill,Matt Ruff,1989,Warner Books
114988,446360589,6,The Burden of Proof,Scott Turow,1991,Warner Books
114988,446400688,7,Death and the Joyful Woman,Ellis Peters,1995,Warner Books
114988,446400807,8,Southern Discomfort (Deborah Knott Mysteries (Paperback)),Margaret Maron,1994,Warner Books
114988,446401870,8,Mucho Mojo,Joe R. Lansdale,1995,Warner Books
114988,446404152,7,One Coffee With (Sigrid Harald Mystery),Margaret Maron,1995,Warner Books
114988,446600660,7,Strip Tease,Carl Hiaasen,1994,Warner Books
114988,446601934,7,The Mummy Case,Elizabeth Peters,1995,Warner Books
114988,446610798,7,Right as Rain,George P. Pelecanos,2002,Warner Books
114988,446610879,7,Uncommon Clay,Margaret Maron,2002,Warner Books
114988,446611611,7,City of Bones,Michael Connelly,2003,Warner Books
114988,446612979,7,Slow Dollar (Deborah Knott Mysteries (Paperback)),Margaret Maron,2003,Warner Books
114988,446677922,9,The Bottoms,Joe R. Lansdale,2001,Mysterious Press
114988,446679062,9,"Ode to a Banker (Davis, Lindsey. Falco Series.)",Lindsey Davis,2002,Mysterious Press
114988,449005615,10,Seabiscuit: An American Legend,LAURA HILLENBRAND,2002,Ballantine Books
114988,449207145,8,My Name Is Asher Lev,Chaim Potok,1990,Fawcett Books
114988,451166892,7,The Pillars of the Earth,Ken Follett,1996,Signet Book
114988,451206525,8,Dead Sleep,Greg Iles,2002,Signet Book
114988,045121157X,5,Monkeewrench,P. J. Tracy,2004,Signet Book
114988,451518616,7,Kim,Rudyard Kipling,1984,Signet Book
114988,452278988,8,Love Warps the Mind a Little,John Dufresne,1998,Plume Books
114988,452282152,7,Girl with a Pearl Earring,Tracy Chevalier,2001,Plume Books
114988,452283205,6,Falling Angels,Tracy Chevalier,2002,Plume Books
114988,452285186,7,The Book of Bunny Suicides,Andy Riley,2003,Plume Plume
114988,486270696,8,The Mysterious Stranger and Other Stories (Dover Thrift Editions),Mark Twain,1992,Dover Publications
114988,515120456,8,The Dark Room,Minette Walters,1997,Jove Books
114988,515127485,7,Archangel,Robert Harris,2000,Jove Books
114988,515128821,8,The Breaker,Minette Walters,2000,Jove Books
114988,051513306X,8,The Shape of Snakes,Minette Walters,2002,Jove Books
114988,525947299,8,No Second  Chance,Harlan Coben,2003,Dutton Books
114988,525947914,7,Just One Look,Harlan Coben,2004,Dutton Books
114988,553268937,7,The Water Is Wide,PAT CONROY,1987,Bantam
114988,553456210,8,Neither Here Nor There: Travels in Europe (Travels in Europe),Bill Bryson,1999,Random House Audio Publishing Group
114988,553578308,6,Tough Cookie,Diane Mott Davidson,2001,Bantam Books
114988,609610538,7,Backyard Brawl: Inside the Blood Feud Between Texas and Texas A &amp; M,W. K. Stratton,2002,Crown Publishers
114988,670031909,7,Lost in a Good Book: A Thursday Next Novel,Jasper Fforde,2003,Viking Books
114988,067101675X,3,Bloodstream: A Novel of Medical Suspense,Tess Gerritsen,1998,Atria
114988,671040588,4,Boone's Lick : A Novel,Larry McMurtry,2002,Pocket
114988,067122350X,3,Eloise (Eloise Series),Kay Thompson,1969,Simon &amp; Schuster Children's Publishing
114988,671736582,7,SHE WALKS IN BEAUTY : SHE WALKS IN BEAUTY,Sarah Shankman,1992,Pocket
114988,679403922,2,The Cold Six Thousand: A Novel,James Ellroy,2001,Alfred A. Knopf
114988,679419829,8,Stormy Weather,Carl Hiaasen,1995,Alfred A. Knopf
114988,679429220,7,Midnight in the Garden of Good and Evil: A Savannah Story,John Berendt,1994,Random House
114988,679452206,10,Where the Truth Lies : A Novel,RUPERT HOLMES,2003,Random House
114988,679462988,9,The Bullfighter Checks Her Makeup: My Encounters With Extraordinary People,Susan Orlean,2001,Random House
114988,067972477X,7,"I, Claudius : From the Autobiography of Tiberius Claudius, Born 10 B.C., Murdered and Deified A.D. 54 (Vintage International)",Robert Graves,1989,Vintage Books USA
114988,684853523,7,On Writing,Stephen King,2000,Scribner
114988,684857820,9,Lucky,Alice Sebold,1999,Scribner
114988,688066631,6,Whirlwind,Clavell,1986,Harpercollins
114988,689711816,9,From the Mixed-Up Files of Mrs. Basil E. Frankweiler,E.L. Konigsburg,1998,Aladdin Library
114988,743218795,7,It Takes a Village Idiot : A Memoir of Life After the City,Jim Mullen,2002,Simon &amp; Schuster
114988,743249992,9,Bringing Down the House: The Inside Story of Six M.I.T. Students Who Took Vegas for Millions,Ben Mezrich,2003,Free Press
114988,074340615X,3,"Two O'Clock, Eastern Wartime",John Dunning,2002,Pocket
114988,074340713X,4,Never Cross a Vampire,Stuart M. Kaminsky,2000,I Books
114988,767902521,7,A Walk in the Woods: Rediscovering America on the Appalachian Trail (Official Guides to the Appalachian Trail),Bill Bryson,1999,Broadway Books
114988,767903854,9,In a Sunburned Country,Bill Bryson,2000,Broadway Books
114988,767910427,8,Bryson's Dictionary of Troublesome Words,Bill Bryson,2002,Broadway Books
114988,786808772,9,Summerland,Michael Chabon,2002,Miramax Kids
114988,786817070,7,"Artemis Fowl (Artemis Fowl, Book 1)",Eoin Colfer,2002,Miramax Kids
114988,786867345,10,Carter Beats the Devil,Glen Gold,2001,Hyperion Press
114988,802111157,7,Rebuilding Coventry: A Tale of Two Cities,Sue Townsend,1990,Pub Group West
114988,804119120,3,A Conspiracy of Paper : A Novel (Ballantine Reader's Circle),DAVID LISS,2001,Ballantine Books
114988,080505622X,7,The Stargazey (Richard Jury Mystery Series/Martha Grimes),Martha Grimes,1998,Henry Holt &amp; Company
114988,807219916,8,"Series of Unfortunate Events #2: The Reptile Room (Series of Unfortunate Events, 2)",LEMONY SNICKET,2003,Listening Library (Audio)
114988,812544161,6,The Saxon Shore: The Camulod Chronicles (Camulod Chronicles (Paperback)),Jack Whyte,1999,Tor Books
114988,812551400,7,The Eagles' Brood: The Camulod Chronicles (Camulod Chronicles (Paperback)),Jack Whyte,1998,Tor Books
114988,812968190,9,Revenge: A Novel,Stephen Fry,2003,Random House Trade
114988,865475083,8,But Beautiful : A Book about Jazz,Geoff Dyer,1997,North Point Press
114988,871138700,7,The Final Confession of Mabel Stark: A Novel,Robert Hough,2003,Atlantic Monthly Press
114988,892962933,8,L.A. Confidential,James Ellroy,1990,Mysterious Press
114988,892966203,7,Rumble Tumble,Joe R. Lansdale,1998,Warner Books Inc
114988,892967714,8,A Body in the Bathhouse,Lindsey Davis,2002,Mysterious Press
114988,971880107,1,Wild Animus,Rich Shapero,2004,Too Far
114988,1400031354,7,Tears of the Giraffe (No.1 Ladies Detective Agency),Alexander McCall Smith,2002,Anchor
114988,1400031362,8,Morality for Beautiful Girls (No.1 Ladies Detective Agency),Alexander McCall Smith,2002,Anchor
114988,1400033349,7,The Solace of Leaving Early,Haven Kimmel,2003,Anchor Books/Doubleday
114988,1400034779,7,The No. 1 Ladies' Detective Agency (Today Show Book Club #8),Alexander McCall Smith,2003,Anchor
114988,1400041732,7,Down Here: A Burke Novel,Andrew Vachss,2004,Knopf
114988,1402200129,8,The Last Noel: A Novel,Michael Malone,2002,Sourcebooks Landmark
114988,140220096X,9,Daughter's Keeper,Ayelet Waldman,2003,Sourcebooks Landmark
114988,1565117212,8,Summerland,Michael Chabon,2002,Highbridge Audio
114988,1565120507,5,"Night of the Avenging Blowfish: A Novel of Covert Operations, Love, and Luncheon Meat",John Welter,1994,Algonquin Books of Chapel Hill
114988,1569472025,8,Moab Is My Washpot: An Autobiography,Stephen Fry,2000,Soho Press
114988,1573227889,7,Tipping the Velvet,Sarah Waters,2000,Riverhead Books
114988,1586215027,10,Dress Your Family in Corduroy and Denim,David Sedaris,2004,Time Warner Audiobooks
114988,1590071476,8,The Wind in the Willows,Kenneth Grahame,2002,New Millennium Audio
114988,1901297586,8,Beastly Chronicles of of Saki,Saki,1999,Pickwick Group Limited (ABM)
114989,373034547,10,"Fate Takes A Hand (Harlequin Romances, No 3454)",Betty Neels,1997,Harlequin
114996,553250426,9,The Clan of the Cave Bear (Earth's Children (Paperback)),Jean M. Auel,1984,Bantam Books
114996,553250531,10,The Valley of Horses,JEAN M. AUEL,1984,Bantam
115002,60092149,5,Married to the Viscount,Sabrina Jeffries,2003,Avon
115002,60092645,8,My Favorite Bride,Christina Dodd,2002,Avon
115002,60508116,7,Fool for Love,Eloisa James,2003,Avon
115002,60513640,6,One Night of Scandal,Teresa Medeiros,2003,Avon Books
115002,60517611,5,The Lady in Question,Victoria Alexander,2003,Avon
115002,60526211,5,Kiss Me Again,Margaret Moore,2004,Avon
115002,60531231,9,When He Was Wicked (Bridgerton Family Series),Julia Quinn,2004,Avon
115002,60549300,4,It Takes a Hero,Elizabeth Boyle,2004,Avon
115002,60560789,7,Your Wicked Ways,Eloisa James,2004,Avon
115002,60561661,5,Three Nights...,Debra Mullins,2004,Avon
115002,61010979,7,Rekindled,Barbara Delinsky,1998,HarperTorch
115002,61013668,8,Here Comes the Bride,Pamela Morsi,2000,Avon
115002,156030209,7,Life of Pi : Student Edition,Yann Martel,2004,Harvest Books
115002,263790568,5,A Captive Heart (Romance),Sally Carr,1995,Harlequin Mills &amp; Boon Ltd
115002,026382540X,5,The Sicilian's Passion (Modern Romance: Passion),Sharon Kendrick,2001,Harlequin Mills &amp; Boon Ltd
115002,312983123,7,The Heartbreaker,Rexanne Becnel,2003,St. Martin's Press
115002,031298328X,7,Full Tilt (Janet Evanovich's Full Series),Janet Evanovich,2003,St. Martin's Paperbacks
115002,312983298,5,Full Speed (Janet Evanovich's Full Series),Janet Evanovich,2003,St. Martin's Paperbacks
115002,312983867,8,Hard Eight : A Stephanie Plum Novel (A Stephanie Plum Novel),Janet Evanovich,2003,St. Martin's Paperbacks
115002,345347153,8,Mirror Her Drms-O M,Stephen R. Donaldson,1987,Del Rey Books
115002,345386744,8,The Talismans of Shannara (Heritage of Shannara (Paperback)),Terry Brooks,1994,Del Rey Books
115002,373105924,6,Dark Seduction (Harlequin Presents),Flora Kidd,1983,Harlequin
115002,373122977,7,Desert Affair  (Surrender to the Sheikh),Kate Walker,2003,Harlequin
115002,373168454,6,"Wild Thing (Harlequin American Romance, No. 845)",Anne Stuart,2000,Harlequin
115002,373243243,6,"Sheik'S Arranged Marriage (Desert Rogues) (Special Edition, 1324)",Susan Mallery,2000,Silhouette
115002,373273134,5,Night Watch,Suzanne Brockmann,2003,Silhouette
115002,373292384,5,Lord Sebastian's Wife,Katy Cooper,2002,Harlequin
115002,373709188,4,"Last Man In Texas (The Malloy Men) (Superrromance, 918)",Jan Freed,2000,Harlequin
115002,373762976,5,"Tough To Tame (Man Of The Month) (Desire, 1297)",Jackie Merritt,2000,Silhouette
115002,373765193,6,Scenes of Passion,Suzanne Brockmann,2003,Silhouette
115002,373790260,3,"Bare Facts (Blaze, 22)",Karen Anders,2002,Harlequin
115002,380016990,3,The Kadin,Bertrice Small,1978,Avon
115002,380753006,6,Savage Thunder,Johanna Lindsey,1989,Avon
115002,380755556,8,Tiger's Eye,Karen Robards,1989,Avon
115002,380767619,4,Remember Summer,Elizabeth Lowell,1999,Avon
115002,380781484,3,Captive,Brenda Joyce,1996,Avon
115002,380799367,6,Cherish,Catherine Anderson,1998,Avon
115002,380803291,7,A Rogue in Texas,Lorraine Heath,1999,Avon
115002,038080591X,6,My True Love (An Avon Romantic Treasure),Karen Ranney,2000,Avon
115002,380810484,7,How to Trap a Tycoon (Avon Light Contemporary Romances),Elizabeth Bevarly,2000,Avon
115002,380810662,8,All Night Long (Avon Romance),Michelle Jerott,1999,Avon
115002,380812975,8,Untie My Heart,Judith Ivory,2002,Avon
115002,380815680,6,Seen By Moonlight,Kathleen Eschenburg,2003,Avon
115002,380818337,4,The Lady Is Tempted,Cathy Maxwell,2002,Avon
115002,380819074,7,Marry Me,Susan Kay Law,2002,Avon
115002,380819635,7,Lost in Your Arms (Avon Romance),Christina Dodd,2002,Avon
115002,038082079X,8,"Affair to Remember, An",Karen Hawkins,2002,Avon
115002,380820803,7,Confessions of a Scoundrel,Karen Hawkins,2003,Avon
115002,038082082X,6,The Rake: Lessons in Love,Suzanne Enoch,2002,Avon
115002,380820838,8,London's Perfect Scoundrel : Lessons in Love (Lessons in Love),Suzanne Enoch,2003,Avon
115002,380820897,7,One Night of Passion (Avon Romantic Treasures),Elizabeth Boyle,2002,Avon
115002,385338252,8,The Immortal Highlander,Karen Marie Moning,2004,Delacorte Press
115002,425186865,8,The Forest Lord,Susan Krinard,2002,Berkley Publishing Group
115002,425194833,7,Miss Wonderful (Berkley Sensation),Loretta Chase,2004,Berkley Publishing Group
115002,042519485X,6,Undead and Unwed (Berkley Sensation),Mary Janice Davidson,2004,Berkley Publishing Group
115002,440125022,7,The Fen Tiger,Catherine Marchant,1981,Dell Publishing
115002,440208297,9,One Summer,Karen Robards,1993,Dell
115002,044022389X,7,The Sound of Snow,Katherine Kingsley,1999,Dell Publishing Company
115002,440226007,6,One Night for Love,Mary Balogh,1999,Dell Publishing Company
115002,445406518,7,Crocodile on the Sandbank,Elizabeth Peters,1988,Warner Books
115002,446353914,7,Night Magic,Karen Robards,1988,Warner Books
115002,446364266,5,French Silk,Sandra Brown,1993,Warner Books
115002,446609625,4,Under Suspicion,Rachel Lee,2001,Warner Forever
115002,446610542,7,The Bachelor (Warner Books Contemporary Romance),Carly Phillips,2002,Warner Forever
115002,446611298,7,Seduced,Pamela Britton,2003,Warner Forever
115002,446611409,7,Sweet Hush,Deborah Smith,2004,Warner Books
115002,446611905,6,Coming Home,Shirlee Busbee,2003,Warner Books
115002,446614238,8,Rules of Engagement,Kathryn Caskie,2004,Warner Books
