User-ID,ISBN,Book-Rating,Book-Title,Book-Author,Year-Of-Publication,Publisher
78588,890815038,6,Out on a Broken Limb: A Response to Shirley McClaine,F. LeGard Smith,1985,Harvest House Pub
78589,60174714,4,Mars and Venus in Love: Inspiring and Heartfelt Stories of Relationships that Work,John Gray,1996,HarperCollins Publishers
78589,60392665,5,I Refuse to Raise a Brat: Straightforward Advice on Parenting in an Age of Overindulgence,Marilu Henner,1999,ReganBooks
78589,380775980,4,A Wife's Little Instruction Book: Your Survival Guide to Marriage Without Bloodshed,Diana Jordan,1994,Quill
78589,038531292X,5,The Gift,Danielle Steel,1994,Delacorte Press
78589,452267242,10,Natural Childbirth the Bradley Way,Susan McCutcheon-Rosegg,1984,Penguin USA
78589,553382179,10,Sink Reflections,MARLA CILLEY,2002,Bantam
78589,067976402X,1,Snow Falling on Cedars,David Guterson,1995,Vintage Books USA
78589,684832291,5,My Gal Sunday,Mary Higgins Clark,1996,Simon &amp; Schuster
78589,1576600505,5,201 Great Ideas for Your Small Business,Jane Applegate,1998,W W Norton &amp; Co
78589,1576739759,10,Secrets of the Vine: Breaking Through to Abundance,Bruce Wilkinson,2001,Multnomah
78589,188939209X,10,"Baby Bargains: Secrets to Saving 20% to 50% on Baby Furniture, Equipment, Clothes, Toys, Maternity Wear and Much, Much More!",Denise Fields,2001,Windsor Peak Press
78589,1889540625,2,Cats Are Better Than Dogs: From a Cat's Eye View,Bob Lovka,2001,BowTie Press
78590,553583468,5,"Whisper of Evil (Hooper, Kay. Evil Trilogy.)",Kay Hooper,2002,Bantam Books
78596,1410729435,10,Lucy's Treasure,G. E. Dabbs,2003,Authorhouse
78597,1582401837,6,Powers: Who Killed Retro Girl?,Brian Michael Bendis,2001,Image Comics
78603,316693294,10,Cat and Mouse,James Patterson,1997,Replica Books
78605,1577484274,7,One More Chance,Kimberely Comeaux,1987,Barbour Publishing
78612,805016511,10,Real Ponies Don't Go Oink,Patrick F. McManus,1991,Henry Holt &amp; Co
78617,345387651,9,The Cider House Rules,John Irving,1994,Ballantine Books
78617,689703317,5,SNOW WHITE (Snow White 191),D. Barthelme,1972,Scribner Paper Fiction
78617,743463544,8,The Man I Should Have Married,Pamela Redmond Satran,2003,Downtown Press
78617,080410882X,8,Dinner at the Homesick Restaurant,Anne Tyler,1992,Ivy Books
78619,44409109,9,"The Good, the Bad and the Gorgeous: Popular Culture's Romance With Lesbianism",Diane Hamer,1994,Pandora Press (GB)
78619,60663006,8,"Motherpeace: A Way to the Goddess through Myth, Art, and Tarot",Vicki Noble,1983,Harper &amp; Row
78619,006091291X,9,Goddesses in Everywoman: A New Psychology of Women,Jean Shinoda Bolen,1985,Perennial
78619,62505939,8,Chalk Talks on Alcohol (Quicksilver Book),Joseph C. Martin,1989,HarperSanFrancisco
78619,62508164,10,"Truth or Dare : Encounters with Power, Authority, and Mystery",Starhawk,1989,HarperSanFrancisco
78619,006250939X,8,Women's Rituals : A Sourcebook,Barbara G. Walker,1990,HarperSanFrancisco
78619,62510037,7,Amazon,Barbara Walker,0,Harpercollins Publisher
78619,140167064,9,The Penguin Book of Lesbian Short Stories,Margaret Reynolds,1994,Penguin Books Ltd
78619,140177213,8,Forest House,Marion Zimmer Bradley,1995,Penguin Books Ltd
78619,140274162,9,To the Lighthouse (Essential.penguin S.),Virginia Woolf,2004,Penguin Books Ltd
78619,140420428,9,William Blake: A Selected Poems and Letters (Poets S.),J. Bronowski,1958,Penguin USA
78619,312239866,8,In Defense of Sin,John Portmann,2001,Palgrave
78619,380781239,9,Tasting Life Twice: Literary Lesbian Fiction by New American Writers,E.J. Levy,1995,Harpercollins
78619,520206371,5,"Mirror of Modernity: Invented Traditions of Modern Japan (Twentieth-Century Japan, the Emergence of a World Power , No 9)",Stephen Vlastos,1998,University of California Press
78619,674471849,7,The Japanese Today: Change and Continuity,Edwin O. Reischauer,1995,Belknap Press
78619,701160853,7,Fire With Fire: The New Female Power and How It Will Change the 21st Century,Naomi Wolf,1993,Chatto Windus
78619,704338408,9,Herland,Charlotte Perkins Gilman,1979,The Women's Press
78619,072251557X,8,"Fatigue: How to Fight Fatigue Through the Use of Diet, Exercise, and Other Natural Methods (The New Self Help Series)",Leon Chaitow,1988,Natl Book Network
78619,722532466,7,Success From Setbacks,Gael Lindenfield,1999,Thorsons Publishers
78619,722539916,5,Get the Life You Want: 101 Ways to Use Your Social IQ,Kristina Downing-Orr,2001,Thorsons Publishers
78619,791445003,8,Taming Oblivion: Aging Bodies and the Fear of Senility in Japan (Suny Series in Japan in Transition),John W. Traphagan,2000,State University of New York Press
78619,807067393,8,A Passion for Friends: Toward a Philosophy of Female Affection,Janice G. Raymond,1987,Houghton Mifflin
78619,810140004,10,Improvisation for the Theater: A Handbook of Teaching and Directing Techniques,Viola Spolin,1983,Northwestern Univ Pr
78619,875427618,8,The Women's Spirituality Book (Llewellyn's New Age Series),Diane Stein,1986,Llewellyn Pubns
78619,882143689,9,The Japanese Psyche: Major Motifs in the Fairy Tales of Japan,Hayao Kawai,1996,Spring Publications
78619,892540192,7,Weaving Woman: Musings and Meditations on the Feminine Mythos,Barbara Black Koltuv,1990,Nicolas-Hays
78619,895944758,9,Ariadne's Thread: A Workbook of Goddess Magic,Shekhinah Mountainwater,1991,Crossing Press
78619,906500214,9,Incidents Involving Warmth a Collection,Anna Livia,0,Onlywomen Press
78619,910383189,8,Love and Politics: Radical Feminist and Lesbian Theories,Carol Anne Douglas,1990,Ism Press
78619,934411255,10,Intricate Passions,Tee Corinne,1989,Banned Books
78619,941524841,10,Empowerment Through Reiki,Paula Horan,1998,Lotus Press
78619,961512911,9,Lesbian Bedtime Stories,Terry Woodrow,1989,Tough Dove Books
78619,1555831060,9,Unbroken Ties: Lesbian Ex-Lovers,Carol S. Becker,1992,Consortium Book Sales &amp; Dist
78619,1568211864,8,Recovery from Alcoholism,Jerome D. Levin,1994,Jason Aronson
78619,1852911417,7,Just Say a Few Words,Bob Monkhouse,1999,Virgin Books
78619,1853270822,7,The Reluctant Adult: An Exploration of Choice,Jill Hall,1994,Anglophone
78619,1853814733,10,Breaking Down the Wall of Silence: To Join the Waiting Child,Alice Miller,1992,Time Warner Books UK
78619,1857022424,10,Shipping News,E Annie Proulx,0,Fourth Estate
78619,1872642225,9,Diving Deeper: More Erotic Lesbian Love Stories,Katherine V. Forrest,1994,Silver Moon Books
78621,130206016,7,UNIX System Administration Handbook (3rd Edition),Evi Nemeth,2000,Prentice Hall PTR
78621,130273635,10,Thinking in Java (2nd Edition),Bruce Eckel,2000,Prentice Hall
78621,201541998,10,The Latex Companion (Addison-Wesley Series on Tools and Techniques for Computer T),Michel Goossens,1993,Addison-Wesley Professional
78621,596001703,9,Java Cookbook,Ian F. Darwin,2001,O'Reilly
78621,596001975,8,"Java &amp; XML, 2nd Edition: Solutions to Real-World Problems",Brett McLaughlin,2001,O'Reilly
78621,782128270,6,Java Developer's Guide to E-Commerce with XML and JSP,William B. Brogden,2001,Sybex Books
78621,789719274,8,UNIX Hints and Hacks,Kirk Waingrow,1999,Que
78621,1565928466,10,Practical PostgreSQL (O'Reilly Unix),Command Prompt Inc,2002,O'Reilly
78621,193011043X,9,Bitter Java,Bruce Tate,2002,Manning Publications
78631,006098824X,8,Getting Over It,Anna Maxted,2001,Regan Books
78631,446610127,5,Fearless Jones (Fearless Jones Novels (Paperback)),Walter Mosley,2002,Warner Vision
78631,451205146,9,Black Hawk Down (Movie Tie-in),Mark Bowden,2002,Signet
78631,553260111,10,The Bourne Identity,Robert Ludlum,1984,Bantam Books
78634,375726403,8,Empire Falls,Richard Russo,2002,Vintage Books USA
78637,971880107,8,Wild Animus,Rich Shapero,2004,Too Far
78642,3423129158,10,Arnes NachlaÃ?Â?.,Siegfried Lenz,2001,Dtv
78655,807537810,8,Jason's Miracle: A Hanukkah Story,Beryl Lieff Benderly,2000,Albert Whitman &amp; Company
78659,553348973,5,Still Life with Woodpecker,TOM ROBBINS,1990,Bantam
78667,201354934,10,"HTML 4 for the World Wide Web, Fourth Edition: Visual QuickStart Guide (4th Edition)",Elizabeth Castro,1999,Peachpit Press
78667,240803884,3,"The Radio Station, Fifth Edition",Michael C. Keith,2000,Focal Press
78670,1890208299,7,"Heartshot (Missing Mystery, #16)",Steven F. Havill,2000,Poisoned Pen Press
78673,140348107,10,My Side of the Mountain,Jean Craighead George,2000,Scott Foresman (Pearson K-12)
78673,141312351,8,Frightful's Mountain,Jean Craighead George,2001,Puffin Books
78673,141312416,6,On the Far Side of the Mountain,Jean Craighead George,2001,Puffin Books
78673,141312424,9,My Side of the Mountain,Jean Craighead George,2001,Puffin Books
78673,439425085,7,Darkest Hour (Heartland),Lauren Brooke,2003,Scholastic Paperbacks
78673,044022814X,10,Where the Red Fern Grows: The Story of Two Dogs and a Boy,Wilson Rawls,1998,Yearling Books
78673,440414806,10,Holes (Yearling Newbery),LOUIS SACHAR,2000,Yearling
78673,440904196,10,"Are You There God?  It's Me, Margaret",Judy Blume,1991,Laure Leaf
78673,553140051,10,Cyoa By Balloon to the Sahara,D Terman,0,Bantam Doubleday Dell
78673,590487922,9,Zlata's Diary: A Child's Life in Sarajevo,Zlata Filipovic,0,Scholastic Inc
78673,590920685,10,Ella Enchanted,Gail Carson Levine,1997,Scholastic Books
78675,765340747,8,"The Pillars of Creation (Sword of Truth, Book 7)",Terry Goodkind,2002,Tor Books
78682,345353145,6,Sphere,MICHAEL CRICHTON,1988,Ballantine Books
78692,671727796,9,The Color Purple,Alice Walker,1990,Pocket
78692,1576831027,9,The Message: New Testament (Mass Market Edition),Eugene H. Peterson,2000,Navpress Publishing Group
78701,345369947,7,The Mummy or Ramses the Damned,Anne Rice,1991,Ballantine Books
78703,345339711,8,"The Two Towers (The Lord of the Rings, Part 2)",J.R.R. TOLKIEN,1986,Del Rey
78712,670894605,8,The Secret Life of Bees,Sue Monk Kidd,2002,Viking Books
78719,140440046,6,Candide (Penguin Classics),Francois M. Voltaire,1990,Penguin Books
78719,345413369,9,"The Subtle Knife (His Dark Materials, Book 2)",PHILIP PULLMAN,1998,Del Rey
78719,385333471,8,"God Bless You, Mr. Rosewater: Or Pearls Before Swine",Kurt Vonnegut,1998,Delta
78719,440180295,9,Slaughterhouse Five or the Children's Crusade: A Duty Dance With Death,Kurt Vonnegut,1991,Laurel
78719,446603775,10,Dawn (Xenogenesis),Octavia E. Butler,1997,Warner Books
78719,451527895,6,Lysistrata (Signet Classics (Paperback)),Aristophanes,2001,Signet Classics
78719,486270629,4,A Doll's House,Henrik Ibsen,1992,Dover Publications
78719,486270645,5,The Necklace and Other Short Stories (Dover Thrift Editions),Guy De Maupassant,1992,Dover Publications
78719,486287149,3,Death in Venice (Dover Thrift Editions),Thomas Mann,1995,Dover Publications
78719,486290301,8,The Metamorphosis and Other Stories (Dover Thrift Editions),Franz Kafka,1996,Dover Publications
78719,553262505,6,"A Wizard of Earthsea (Earthsea Trilogy, Book 1)",URSULA K. LE GUIN,1984,Bantam
78719,067972754X,6,Dictionary of the Khazars (F) (Vintage International),MILORAD PAVIC,1989,Vintage
78719,679750169,6,The Romance of Tristan and Iseult (Vintage Classics),Joseph Bedier,1994,Vintage Books USA
78719,679761675,8,Martian Time-Slip,Philip K. Dick,1995,Vintage Books USA
78719,684833395,9,Catch 22,Joseph Heller,1996,Simon &amp; Schuster
78719,689845332,5,Tehanu : The Earthsea Cycle,Ursula K. Le Guin,2001,Simon Pulse
78719,805062971,8,Fight Club,Chuck Palahniuk,1999,Owl Books
78719,819562718,6,"Neveryona, or: The Tale of Signs and Cities : Some Informal Remarks Towards the Modular Calculus, Part Four",Samuel R. Delany,1993,Wesleyan University Press Distributed by Univ
78719,893753475,8,The War of the Worlds (A Watermill Classic),H. G. Wells,1993,Troll Communications
78722,60952970,10,Ophelia Speaks : Adolescent Girls Write About Their Search for Self,Sara Shandler,1999,Perennial
78722,141309199,9,Slam (Alloy Books),Cecily Von Ziegesar,2000,Puffin Books
78722,142300675,8,Dreamland,Sarah Dessen,2002,Puffin Books
78722,345391802,4,The Hitchhiker's Guide to the Galaxy,Douglas Adams,1995,Ballantine Books
78722,038078341X,6,Almost Lost : The True Story of an Anonymous Teenager's Life on the Streets (Avon Flare Book),Beatrice Sparks,1996,Avon
78722,449005550,7,Candles on Bay Street,K.C. McKinnon,2000,Ballantine Books
78722,671695304,5,"FOREVER : A Novel of Good and Evil, Love and Hope",Judy Blume,1989,Pocket
78722,689817851,7,Go Ask Alice,Anonymous,1998,Simon Pulse
78722,068982193X,5,Slave Day,Rob Thomas,1998,Simon Pulse
78722,689824149,6,DOING TIME,Rob Thomas,1999,Simon Pulse
78722,078688567X,9,Picture the Girl : Young Women Speak Their Minds,Audrey Shehyn,2000,Hyperion
78722,1575420600,8,Write Where You Are: How to Use Writing to Make Sense of Your Life : A Guide for Teens,Caryn Mirriam-Goldberg,1999,Free Spirit Publishing
78725,449912558,10,The Sparrow,MARY DORIA RUSSELL,1997,Fawcett Books
78727,553250442,8,Sweet Valley High #02: Secrets (Sweet Valley High (Numbered Paperback)),Francine Pascal,1984,Bantam Books
78735,816032130,7,"Alternative Realities: The Paranormal, the Mystic and the Transcendent in Human Experience",Leonard George,1995,Facts on File
78736,385334036,9,The Smoke Jumper,Nicholas Evans,2001,Delacorte Press
78736,786868015,9,The Diary of Ellen Rimbauer: My Life at Rose Red,Joyce Reardon,2001,Hyperion
78738,385334036,8,The Smoke Jumper,Nicholas Evans,2001,Delacorte Press
78744,446532231,10,"Dude, Where's My Country?",Michael Moore,2003,Warner Books
78744,743205111,8,Fun Run and Other Oxymorons : Singular Reflections of an Englishman Abroad,Joe Bennett,2000,Simon &amp; Schuster UK
78744,743219473,3,Bear v. Shark: The Novel,Chris Bachelder,2002,Scribner
78746,1566199697,8,Metamorphoses and Other Stories,Franz Kafka,1996,Dorset Press
78746,1573220027,5,The Holy Man,Susan Trott,1995,Putnam Pub Group
78749,152017178,9,Mary Poppins (Odyssey Classics),P. L. Travers,1997,Odyssey Classics
78754,440234743,8,The Testament,John Grisham,1999,Dell
78755,380002930,10,Watership Down,Richard Adams,1976,Avon
78755,394546911,5,The Universe: A Three-Dimensional Study,Heather Couper,1985,Random House
78755,517118297,10,Jane Austen: The Complete Novels,JANE AUSTEN,1994,Gramercy
78755,718127250,4,"Evolution, the story of the origins of humankind: A three-dimensional book",Raymond Hawkey,1986,M. Joseph
78755,3257200951,5,HÃ¶rspiele (Diogenes-Taschenbuch ; 1/3),Alfred Andersch,1973,Diogenes-Verlag
78755,3257260075,7,JosÃ© Guadalupe Posada (Diogenes Kunst Taschenbuch),JosÃ© Guadalupe Posada,1979,Diogenes
78755,342303002X,10,dtv - Atlas Weltgeschichte 2. Von der FranzÃ?Â¶sischen Revolution bis zur Gegenwart.,Hermann Kinder,2002,Dtv
78755,342324111X,10,Der seltene Vogel.,Jostein Gaarder,1997,Dtv
78755,3426031760,8,Ein Mensch namens Jesus. Roman.,Gerald Messadie,1991,"Droemersche Verlagsanstalt Th. Knaur Nachf., GmbH &amp; Co."
78755,3442084962,5,Mistrals Tochter. Roman.,Judith Krantz,1986,Goldmann
78755,3442449170,8,Nacht ohne Gesicht.,Rennie Airth,2000,Goldmann
78755,344272757X,7,"England, England.",Julian Barnes,2001,Btb Bei Goldmann
78755,3446124233,9,Der Garten des Menschlichen: BeitrÃ¤ge zur geschichtlichen Anthropologie,Carl Friedrich WeizsÃ¤cker,1977,C. Hanser
78755,3446173471,10,Sofies Welt. Ein Roman Ã?Â¼ber die Geschichte der Philosophie. ( Ab 14 J.).,Jostein Gaarder,1993,Carl Hanser
78755,3446177108,10,Das Kartengeheimnis. ( Ab 13 J.).,Jostein Gaarder,1995,Carl Hanser
78755,3446180710,10,"Durch einen Spiegel, in einem dunklen Wort.",Jostein Gaarder,1996,Carl Hanser
78755,3453195809,1,Nacht des Schicksals.,Karen Robards,2002,Heyne
78755,3458319247,9,Die ErzÃ?Â¤hlungen aus den Tausendundein NÃ?Â¤chten. 12 BÃ?Â¤nde.,Enno Littmann,1997,"Insel, Frankfurt"
78755,3462021966,5,"Guten Tach. Auf Wiedersehn. Autobiographie, Teil 1.",Helge Schneider,1992,Kiepenheuer &amp; Witsch
78755,3462023020,5,TrÃ?Â¤nen im Aquarium. Ein Kurzausflug ans Ende des Verstandes.,Harald Schmidt,1993,Kiepenheuer &amp; Witsch
78755,3462023845,5,"Zieh dich aus, du alte Hippe.",Helge Schneider,1994,Kiepenheuer &amp; Witsch
78755,3462024000,10,Choral am Ende der Reise.,Erik Fosnes Hansen,1995,Kiepenheuer &amp; Witsch
78755,3492230857,10,Novecento. Die Legende vom Ozeanpianisten.,Alessandro Baricco,2000,Piper
78755,3499130114,9,Tochter ihrer Mutter. Roman.,Marilyn French,1991,Rowohlt Tb.
78755,3518381768,8,Das Geisterhaus. Roman.,Isabel Allende,1989,Suhrkamp
78755,3548310702,8,Per Anhalter Durch Die Galaxis,Douglas Adams,0,Ein Ullstein Buch
78755,359615152X,8,Marcus und Eneides. GroÃ?Â?druck.,Marianne Fredriksson,2000,"Fischer (Tb.), Frankfurt"
78755,3596237467,8,Der scharlachrote Gesang. Roman.,Mariama Ba,2000,"Fischer (Tb.), Frankfurt"
78755,3761005830,5,Die Frau im Strom: Roman,Karl Heinz Jakobs,1982,Autoren Edition
78755,3761080557,8,Vaterspuren: Eine ErzÃ¤hlung,Sigfrid Gauch,1979,AthenÃ¤um
78755,3761081251,6,"Vielleicht auf Knien, aber vorwÃ¤rts!: GesprÃ¤che mit Lech WaÂ±esa",Jule Gatter-Klenk,1981,AthenÃ¤um
78755,3801230058,8,Wie Mutlu Ã?ztÃ¼rk schwimmen lernen muss: Ein Lebenslauf (Dietz Taschenbuch),Paul Geiersbach,1983,J.H.W. Dietz
78755,3810506338,10,Hannas TÃ?Â¶chter.,Marianne Fredriksson,1997,"KrÃ?Â¼ger, Frankfurt"
78755,3879751536,5,"Gertrud Meyer, die Frau mit grÃ¼nen Haaren",Gertrud Meyer,1978,VSA
78755,3882432314,6,Mafia im Staat: Deutschland fÃ¤llt unter die RÃ¤uber,Hans Leyendecker,1992,Steidl
78755,3888800579,6,Die Vernichtung der Weisen Frauen: BeitrÃ¤ge zur Theorie und Geschichte von BevÃ¶lkerung und Kindheit,Gunnar Heinsohn,1985,MÃ¤rz Verlag
78755,3891050119,6,Demokratie oder Eliteherrschaft?: Sind die BÃ¼rger nur Statisten?,GÃ¼nter Lambertz,1984,La Fleur-Verlag
78755,3891360118,5,"Hitlers Sternstunde: Kujau, Heidemann und die Millionen",Manfred Bissinger,1984,Rasch und RÃ¶hring
78761,3150000335,7,Kabale Und Liebe,Schiller,0,"Philipp Reclam, Jun Verlag GmbH"
78761,3150031737,7,Maria Magdalena,Hebbel,0,"Philipp Reclam, Jun Verlag GmbH"
78761,345832965X,7,"Feuer in der Seele. Gedanken zum Leben, zur Liebe und zur Kunst.",Vincent van Gogh,2003,"Insel, Frankfurt"
78761,3492045170,7,Stupid White Men. Eine Abrechnung mit dem Amerika unter George W. Bush,Michael Moore,2003,Piper
78761,3717515640,7,MeistererzÃ?Â¤hlungen.,Edgar Allan Poe,1999,Manesse-Verlag
78761,3778736248,7,Abnehmen mit Apfelessig. Auf sanfte Weise zur Idealfigur.,Klaus Oberbeil,1997,"Ludwig, MÃ?Â¼nchen"
78761,3821800976,7,Der Junior- Chef. Das Neue Testament lammfromm neu erzÃ?Â¤hlt.,Michael Korth,1992,Eichborn
78761,382521317X,7,Wirtschaftspolitik. Eine praxisorientierte EinfÃ?Â¼hrung.(7.Auflage),JÃ?Â¶rn Altmann,2000,"UTB, Stuttgart"
78766,8408040235,8,Once,Patricia Highsmith,2003,Planeta
78768,671025864,5,Was It Something I Said,Valerie Block,1998,Washington Square Press
78770,385335482,9,Confessions of a Shopaholic (Summer Display Opportunity),SOPHIE KINSELLA,2001,Delta
78772,3257233396,8,Feine Freunde. Commissario Brunettis neunter Fall.,Donna Leon,2002,Diogenes Verlag
78772,3404148800,10,Panik. Thriller.,R. J. Pineiro,2003,LÃ?Â¼bbe
78772,3453158903,8,Das Ã?Â?lschieferskelett. Eine Zeitreise.,Bernhard Kegel,1999,Heyne
78772,3462032283,8,ZwÃ?Â¶lf.,Nick McDonell,2003,Kiepenheuer &amp; Witsch
78772,3548310702,10,Per Anhalter Durch Die Galaxis,Douglas Adams,0,Ein Ullstein Buch
78773,3423078006,8,Damals War Es Fredrich,Hans Peter Richter,1998,Distribooks Inc
78773,342370330X,10,"Hauptsache Zusammen! (Fiction, Poetry and Drama)",Ahrendt,0,Deutscher Taschenbuch Verlag (DTV)
78773,3442435951,6,Ich schenk Dir meinen Mann.,Claudia Keller,1997,Goldmann
78773,3791530321,10,PÃ?Â¼nktchen und Anton. Ein Roman fÃ?Â¼r Kinder. ( Ab 10 J.).,Erich KÃ?Â¤stner,1999,Dressler Verlag
78774,6371647,8,ANOTHER VOICE,Auberon Waugh,1987,HarperCollins Publishers
78774,6546684,8,Postcards,E Annie Proulx,0,Flamingo
78774,140156801,9,India: A Million Mutinies Now,V.S. Naipaul,1992,Penguin USA
78774,151005141,10,The Headless Bust: A Melancholy Meditation for the False Millennium,Edward Gorey,1999,Harcourt
78774,452277337,8,Le Divorce (William Abrahams Book),Diane Johnson,1997,Plume Books
78774,552996009,8,Notes From a Small Planet,Bill Bryson,0,Bantam Doubleday Dell
78774,3492045170,9,Stupid White Men. Eine Abrechnung mit dem Amerika unter George W. Bush,Michael Moore,2003,Piper
78777,192834835,10,Don Quixote De LA Mancha (Oxford World's Classics),Miguel De Cervantes Saavedra,1998,Oxford University Press
78777,044651652X,10,The Bridges of Madison County,Robert James Waller,1992,Warner Books
78777,671724738,6,Postcards from the Edge,Carrie Fisher,1990,Pocket
78777,080410753X,9,The Kitchen God's Wife,Amy Tan,1992,Ivy Books
78777,809237628,6,"Chris-In-The-Morning: Love, Life, and the Whole Karmic Enchilada",Louis Chunovic,1993,McGraw-Hill
78777,8432246395,10,Maluco: LA Novela De Los Descubridores (Biblioteca Del Sur. Novelas.),N. Baccino Ponce De Leon,1995,Planeta Pub Corp
78777,9500703874,10,Historias de Cronopios y de Famas,Julio Cortazar,1995,Sudamericana
78777,9500707241,5,El Plan Infinito,Isabel Allende,1996,Sudamericana
78778,60086386,5,Filthy Rich,Dorothy Samuels,2002,Avon Trade
78778,60932813,7,Waiting: The True Confessions of a Waitress,Debra Ginsberg,2001,Perennial
78778,140179836,8,The Liar's Club: A Memoir,Mary Karr,1998,Penguin USA (Paper)
78778,140244824,9,Songs in Ordinary Time (Oprah's Book Club (Paperback)),Mary McGarry Morris,1996,Penguin Books
78778,156007479,7,Slammerkin,Emma Donoghue,2002,Harvest Books
78778,312291639,9,The Nanny Diaries: A Novel,Emma McLaughlin,2003,St. Martin's Griffin
78778,373250428,8,Up &amp; Out (Red Dress Ink),Ariella Papa,2003,Red Dress Ink
78778,380817683,6,Rachel's Holiday,Marian Keyes,2001,Avon Books
78778,449908798,7,Duplicate Keys,Jane Smiley,1993,Ballantine Books
78778,451203771,6,Scarlet Feather,Maeve Binchy,2002,Signet Book
78778,804117683,5,Moo,Jane Smiley,1998,Ivy Books
78778,080411935X,10,Standing in the Rainbow,FANNIE FLAGG,2003,Ballantine Books
78779,081297106X,6,Reading Lolita in Tehran: A Memoir in Books,Azar Nafisi,2003,Random House Trade Paperbacks
78779,1573229725,7,Fingersmith,Sarah Waters,2002,Riverhead Books
78783,60149906,8,Cinnamon Skin (The Travis McGee series),John D. MacDonald,1982,Harpercollins
78783,60521848,7,"Angus, Thongs and Full-Frontal Snogging (rack) : Confessions of Georgia Nicolson (Confessions of Georgia Nicolson)",Louise Rennison,2003,Avon
78783,60922532,8,Pigs in Heaven,Barbara Kingsolver,1994,Perennial
78783,006092991X,9,"Beauty Fades, Dumb Is Forever: The Making of a Happy Woman",Judy Sheindlin,2000,Perennial
78783,60938412,8,The Accidental Virgin,Valerie Frankel,2003,Avon Trade
78783,60987529,5,Confessions of an Ugly Stepsister : A Novel,Gregory Maguire,2000,Regan Books
78783,61007536,8,Baby Names for the New Century,Pamela Samuelson,1994,HarperTorch
78783,61011886,8,Enter Whining : Enter Whining,Fran Drescher,1997,Regan Books
78783,140293248,7,The Girls' Guide to Hunting and Fishing,Melissa Bank,2000,Penguin Books
78783,312423799,8,Dry : A Memoir,Augusten Burroughs,2004,Picador
78783,316168815,9,The Lovely Bones,Alice Sebold,2004,Back Bay Books
78783,316611166,9,"The Road to Success is Paved with Failure : How Hundreds of Famous People Triumphed Over Inauspicious Beginnings, Crushing Rejection, Humiliating Defeats and Other Speed Bumps Along Life's Highway",Joey Green,2001,"Little, Brown"
78783,316666343,10,The Lovely Bones: A Novel,Alice Sebold,2002,"Little, Brown"
78783,316898163,8,"River, Cross My Heart : A Novel",Breena Clarke,2000,"Little, Brown"
78783,345377702,9,Me: Stories of My Life,Katharine Hepburn,1992,Ballantine Books
78783,345394402,9,Dave Barry's Homes and Other Black Holes,Dave Barry,1995,Ballantine Books
78783,345423291,10,What We Keep : A Novel (Ballantine Reader's Circle),Elizabeth Berg,1999,Ballantine Books
78783,345443284,8,While I Was Gone,Sue Miller,1999,Ballantine Books
78783,345445848,10,Big Cherry Holler: A Big Stone Gap Novel (Ballantine Reader's Circle),Adriana Trigiani,2002,Ballantine Books
78783,345468627,6,The Hot Flash Club,NANCY THAYER,2003,Ballantine Books
78783,373290284,8,"Flower And The Sword (Historical , No 428)",Jacqueline Navin,1998,Harlequin
78783,373765134,6,Shameless,Ann Major,2003,Silhouette
78783,373790899,7,"By the Book (Harlequin Blaze, No 85)",Nancy Warren,2003,Harlequin
78783,373835876,7,Simply Sinful (Simply (Harlequin)),Carly Phillips,2003,Harlequin
78783,380002922,7,Having a Baby Can Be a Scream,Joan Rivers,1987,Avon Books
78783,380718340,9,Cruel &amp; Unusual (Kay Scarpetta Mysteries (Paperback)),Patricia D. Cornwell,1994,Avon
78783,380727293,8,Dr. Atkins' New Diet Revolution,Robert C. Atkins,1997,Avon Books
78783,038079487X,8,What Looks Like Crazy On An Ordinary Day,Pearl Cleage,1998,Perennial
78783,038081918X,7,Getting Lucky (Avon Light Contemporary Romances),Susan Andersen,2003,Avon
78783,385318782,9,Talk Before Sleep,Elizabeth Berg,1997,Dell
78783,385335482,8,Confessions of a Shopaholic (Summer Display Opportunity),SOPHIE KINSELLA,2001,Delta
78783,385335881,9,Shopaholic Takes Manhattan (Summer Display Opportunity),Sophie Kinsella,2002,Delta
78783,385336179,9,Shopaholic Ties the Knot,Sophie Kinsella,2003,Delta
78783,385720106,9,A Map of the World,Jane Hamilton,1999,Anchor Books/Doubleday
78783,393324826,10,Stiff: The Curious Lives of Human Cadavers,Mary Roach,2004,W. W. Norton &amp; Company
78783,394407555,8,Your Baby and Child from Birth to Age Five (512p),Penelope Leach,1978,Random House
78783,425068471,8,New Hope for Problem Pregnancies: Helping Babies Before They're Born,Dianne Hales,1984,Berkley Pub Group
78783,425147622,10,The Body Farm,Patricia Daniels Cornwell,1995,Berkley Publishing Group
78783,425163407,9,Unnatural Exposure,Patricia Daniels Cornwell,1998,Berkley Publishing Group
78783,425169863,10,Point of Origin,Patricia Daniels Cornwell,1999,Berkley Publishing Group
