User-ID,ISBN,Book-Rating,Book-Title,Book-Author,Year-Of-Publication,Publisher
168307,451166345,10,The Male Mid-Life Crisis: Fresh Start After Forty,Nancy Mayer,1986,Signet Book
168307,671792245,10,EVOLUTION OF CONSCIOUSNESS: THE ORIGINS OF THE WAY WE THINK,Robert Ornstein,1992,Simon &amp; Schuster
168307,767903323,10,Buddhism Plain and Simple,Steve Hagen,1998,Broadway Books
168307,786862181,10,"Surrendering to Marriage: Husbands, Wives, and Other Imperfections",Iris Krasnow,2001,Miramax
168307,802130550,10,An Introduction to Zen Buddhism,D. T. Suzuki,1991,Grove/Atlantic
168307,871401673,7,Mosquitoes: A Novel,William Faulkner,1996,Liveright Publishing Corporation
168307,1558509607,10,Why Love is Not Enough,Sol Gordon,1988,Adams Media Corporation
168307,1568381972,10,"When Is Enough, Enough?: What You Can Do If You Never Feel Satisfied",Laurie Ashner,1997,Hazelden Publishing &amp; Educational Services
168307,1569752311,10,The Gospel of Thomas: Unearthing the Lost Words of Jesus,John Dart,2000,Ulysses Press
168307,1573220183,10,"Living Buddha, Living Christ",Thich Nhat Hanh,1995,Riverhead Books
168307,1851682090,10,Baha'i Faith,Moojan Momen,1999,Oneworld Publications
168311,1850150281,10,Secret of How to Win Freedom from Clutter,Don Aslett,1985,Exley Publications Ltd
168312,014026020X,8,The Hunchback of Notre Dame,Victor Hugo,1996,Penguin Books Ltd
168312,863161995,4,Clowns for Beginners (Writers and Readers Documentary Comic Book.),Joe Lee,1995,Writers &amp; Readers Publishing
168312,186105193x,7,Uri Geller's Little Book of Mind-Power: Maximize Your Will to Win,Uri Geller,1999,Robson Books
168314,312966067,9,A Wreath for Rivera (Wreath for Rivera),Ngaio Marsh,1998,St. Martin's Press
168315,894803204,8,The Book of Questions,Gregory Stock,1987,Workman Publishing
168317,195015541,3,The Story of Rock,Carl Belz,1972,Oxford Univ Pr
168317,252062590,10,Chicago Soul (Music in American Life (Paperback)),Robert Pruter,1992,University of Illinois Press
168317,312687982,7,Rocking America: An Insider's Story,Rick Sklar,1985,St Martins Pr
168317,679741747,9,Rhythm Oil: A Journey Through the Music of the American South,Stanley Booth,1993,Vintage Books USA
168317,688066151,7,Cousin Brucie: My Life in Rock 'N' Roll Radio,Cousin Bruce Morrow,1987,Harpercollins Childrens Books
168327,3442241774,6,Der Herr der Augenringe.,Dschey Ar TollkÃ?Â¼hn,2001,Goldmann
168327,3453177746,10,Hannibal,Thomas Harris,2001,Wilhelm Heyne Verlag
168327,3928983865,7,Benjamins Tagebuch,Michael Sollorz,2000,MÃ¤nnerschwarmSkript
168331,451451848,8,"Decision at Thunder Rift (Battletech, No 6)","Jr.,  William H. Keith",1992,Roc
168332,812511816,8,"The Eye of the World (The Wheel of Time, Book 1)",Robert Jordan,1990,Tor Fantasy
168336,60956534,6,The Palace : A Novel,Lisa St. Aubin de Teran,2000,Ecco
168336,031215075X,8,Carry Me Back,Laura Watt,1997,St. Martin's Press
168336,031215223X,7,A Timely Death,Janet Neel,1997,St Martins Pr
168336,312858035,7,The Talk Show Defense: A Maggie Van Zandt Novel (Maggie Van Zandt Novels (Hardcover)),Ken Gross,1997,Forge
168336,316124664,7,Black Queen Stories,Barry Callaghan,0,Little Brown Company
168336,385494238,6,Amsterdam,Ian McEwan,1999,Nan A. Talese
168336,425167135,5,A Blessing on the Moon,Joseph Skibell,1999,Berkley Publishing Group
168336,425192725,6,Q Is for Quarry,Sue Grafton,2003,Berkley Publishing Group
168336,440212316,4,Thus Was Adonis Murdered,Sarah Caudwell,1994,Dell Publishing Company
168336,670854549,5,The end,Roch Carrier,1994,Viking
168336,679426620,7,Havana Bay: A Novel,Martin Cruz Smith,1999,Random House Trade
168336,684809346,7,Mulching of America,Harry Crews,1995,Simon &amp; Schuster
168336,771011326,4,Way Out West : On the Trail of an Errant Ancestor,MICHAEL BOND,2001,McClelland &amp; Stewart
168336,771014899,6,Verdict in Blood (Joanne Kilbourn Mysteries (Paperback)),GAIL BOWEN,1999,McClelland &amp; Stewart
168336,771034385,5,Heartbreaker: A Willows and Parker Mystery,Laurence Gough,1997,McClelland &amp; Stewart Ltd
168336,962750999,6,A Place in Mind,Dulce D. Moore,1992,Baskerville Publishers Inc.
168337,241001943,9,The Garlic Ballads,Mo Yan,1995,Hamish Hamilton
168337,330345656,10,A Perfect Execution,Tim Binding,1997,Pan Macmillan
168337,385262647,2,Puzzles of the Black Widowers,Isaac Asimov,1990,Bantam Dell Pub Group
168337,836217632,9,The Curse of Madame C : A Far Side Collection,Gary Larson,1994,Andrews McMeel Publishing
168337,836218655,6,Wiener Dog Art,Gary Larson,1990,Andrews McMeel Publishing
168338,140154078,8,The Music of Chance,Paul Auster,1993,Penguin Books
168341,773731946,9,From Naked Ape to Super Species: A Personal Perspective on Humanity and the Global Ecocrisis,David T. Suzuki,1999,Stoddart
168346,60391480,7,Microserfs,Douglas Coupland,1995,Harpercollins
168346,674805704,6,The Shape of Content,Ben Shahn,1957,Harvard University Press
168346,767902521,8,A Walk in the Woods: Rediscovering America on the Appalachian Trail (Official Guides to the Appalachian Trail),Bill Bryson,1999,Broadway Books
168346,1873176449,7,Scum Manifesto,Valerie Solanas,1996,AK Press
168347,805006427,7,"Calling Dr. Whoopee: A Doonesbury Book (Trudeau, G. B., Doonesbury Book.)",G. B. Trudeau,1987,Henry Holt &amp; Co
168348,380015188,8,Rascal,Sterling North,1986,Harper Mass Market Paperbacks (Mm)
168348,553203487,8,Franny and Zooey,J.D. Salinger,1969,Bantam Books
168349,816635366,8,Eternal Curse on the Reader of These Pages,Puig Manuel,1999,University of Minnesota Press
168350,425065553,7,White Plague,Frank Herbert,1983,Penguin Putnam~mass
168369,812062108,10,My Rabbit Bobbie,Donna Bryant,1991,Barron's Educational Series
168372,440220602,8,The Chamber,John Grisham,1995,Dell Publishing Company
168376,64471047,9,"The Lion, the Witch, and the Wardrobe (The Chronicles of Narnia, Book 2)",C. S. Lewis,1994,HarperCollins
168377,440225892,7,"The Heiress (Bride Quest Series, 3)",Claire Delacroix,1999,Dell Publishing Company
168378,812532651,8,Universe 15,Terry Carr,1987,Tor Books
168383,373484232,9,Stanislaski Sisters,Nora Roberts,2001,Silhouette
168383,553582135,8,Final Target,Iris Johansen,2002,Bantam Books
168383,842342702,9,Left Behind: A Novel of the Earth's Last Days (Left Behind #1),Tim Lahaye,2000,Tyndale House Publishers
168383,1551668726,5,Death Qualified (Barbara Holloway Novels (Paperback)),Kate Wilhelm,2002,Mira
168387,64400069,10,The Long Winter (Little House),Laura Ingalls Wilder,1953,HarperTrophy
168387,64407373,8,Little House by Boston Bay (Little House),Melissa Wiley,1999,HarperTrophy
168387,140119906,7,Love in the Time of Cholera (Penguin Great Books of the 20th Century),Gabriel Garcia Marquez,1994,Penguin Books
168387,140286276,7,The Deep End of the Ocean (Oprah's Book Club),Jacquelyn Mitchard,1999,Penguin Books
168387,141302291,6,The Magic Finger,Roald Dahl,1998,Puffin Books
168387,330356682,8,"The Third Day, The Frost",John Marsden,1996,Pan
168387,345339258,9,Dibs in Search of Self,Virginia M. Axline,1990,Ballantine Books
168387,373194447,7,"Mercenary'S Woman (Soldiers Of Fortune) (Romance, 1444)",Diana Palmer,2000,Silhouette
168387,373263511,6,Audition For Murder (Morgan Taylor Mysteries),Susan Sussman,2000,Worldwide Library
168387,380772531,10,The Thread That Binds the Bones,Nina Kiriki Hoffman,1993,Harper Mass Market Paperbacks (Mm)
168387,515132020,8,Heaven and Earth (Three Sisters Island Trilogy),Nora Roberts,2003,Jove Books
168387,525945814,9,Falling Angels,Tracy Chevalier,2001,Dutton Books
168387,552143774,7,Horse Whisperer,Nicholas Evans,0,Bantam Doubleday Dell
168387,571197604,8,Three Dollars,Elliot Perlman,1999,Faber and Faber Ltd
168387,671014196,5,The Summerhouse,Jude Deveraux,2002,Pocket
168387,671027360,8,Angels &amp; Demons,Dan Brown,2001,Pocket Star
168387,671041622,7,The Power of Three,Constance M. Burge,1999,Simon Spotlight Entertainment
168387,679429220,8,Midnight in the Garden of Good and Evil: A Savannah Story,John Berendt,1994,Random House
168387,688003435,8,A Grand Man,Catherine Cookson,1975,Harpercollins
168387,702221333,5,Inheritors,Jill Dobson,1988,Intl Specialized Book Service Inc
168387,074340341X,5,A Season in the Highlands,Jude Deveraux,2000,Pocket
168387,750506202,8,This Ravished Land,Pamela Oldfield,1995,Ulverscroft Large Print
168387,858810581,6,Green mountains,Bernard O'Reilly,1992,Envirobook
168387,860074382,9,84 Charing Cross Road,Helene Hanff,0,Warner Books> C/o Little Br
168387,1551664186,4,Roomful Of Roses,Diana Palmer,1997,Mira
168387,1551668041,4,Cowboy And The Lady,Diana Palmer,2001,Mira
168387,1853261300,7,Little Lord Fauntleroy (Wordsworth Collection Children's Library),Frances Hodgson Burnett,1998,NTC/Contemporary Publishing Company
168388,006093817X,7,Watch Your Mouth: A Novel,Daniel Handler,2002,Perennial
168388,316678104,9,Fortune's Rocks : A Novel,Anita Shreve,2001,Back Bay Books
168388,440204208,7,Blood Shot (V.I. Warshawski Novels (Paperback)),Sara Paretsky,1989,Dell
168388,440210690,7,Indemnity Only (V.I. Warshawski Novels (Paperback)),Sara Paretsky,1991,Dell
168388,440236703,6,Tell No One,Harlan Coben,2002,Dell Publishing Company
168388,446604666,7,Sick Puppy,Carl Hiaasen,2001,Warner Vision
168388,446608815,6,Pop Goes the Weasel,James Patterson,2000,Warner Vision
168388,446610038,7,1st to Die: A Novel,James Patterson,2002,Warner Vision
168388,449003795,8,P Is for Peril,Sue Grafton,2002,Ballantine Books
168388,553280341,8,B Is for Burglar (Kinsey Millhone Mysteries (Paperback)),Sue Grafton,1986,Bantam
168388,553566040,7,Missing Joseph,Elizabeth George,1994,Bantam Books
168388,553576089,7,In the Presence of the Enemy,ELIZABETH GEORGE,1997,Bantam
168388,067088300X,8,The Girls' Guide to Hunting and Fishing,Melissa Bank,1999,Viking Books
168388,671024248,6,Hearts In Atlantis,Stephen King,2000,Pocket
168388,074343627X,7,Dreamcatcher,Stephen King,2001,Pocket
168394,446611891,6,Return to Oak Valley,Shirlee Busbee,2002,Warner Books
168402,373291035,7,"The Bonny Bride (Harlequin Historical Series, No. 503)",Deborah Hale,2000,Harlequin
168402,425176940,8,If I Had You,Lynn Kurland,2000,Berkley Publishing Group
168402,440223776,9,The Bodyguard,Joan Johnston,1998,Island
168402,553581686,8,The Maiden and the Unicorn,Isolde Martyn,1999,Bantam Books
168402,553583565,6,Stealing Heaven,Madeline Hunter,2002,Bantam Books
168403,8421741012,7,LA Perla,John Steinbeck,1997,Luis de Caralt
168408,64407675,10,"The Reptile Room (A Series of Unfortunate Events, Book 2)",Lemony Snicket,1999,HarperCollins
168408,64407683,10,"The Wide Window (A Series of Unfortunate Events, Book 3)",Lemony Snicket,2000,HarperCollins
168408,385720920,10,Choke,CHUCK PALAHNIUK,2002,Anchor
168408,553579754,3,Fear Nothing,DEAN KOONTZ,1998,Bantam
168408,078601427X,6,Witch Spell,Guy N. Smith,2001,Pinnacle Books
168413,60987103,9,Wicked: The Life and Times of the Wicked Witch of the West,Gregory Maguire,1996,Regan Books
168413,61091464,9,The Thief of Always,Clive Barker,1993,HarperTorch
168413,316666343,8,The Lovely Bones: A Novel,Alice Sebold,2002,"Little, Brown"
168413,743227441,10,The Other Boleyn Girl,Philippa Gregory,2002,Touchstone
168419,575065060,9,The Warlock of Strathearn,C. Whyte,1999,Gollancz
168427,684867621,8,The Girl Who Loved Tom Gordon : A Novel,Stephen King,1999,Scribner
168431,440226430,8,Summer Sisters,Judy Blume,1999,Dell Publishing Company
168431,451521412,8,Room With a View and Howards End,E. M. Forster,1992,Signet Classics
168434,451205421,7,The Door to December,Dean R. Koontz,2002,Signet Book
168438,64400808,5,"On the Way Home: The Diary of a Trip from South Dakota to Mansfield, Missouri, in 1894",Laura Ingalls Wilder,1976,HarperTrophy
168438,373033052,5,"Perfect Scoundrel (Back To The Ranch) (Harlequin Romance, No 3305)",Virginia Hart,1994,Harlequin
168438,373059337,10,"Dr. Daddy (From Here To Maternity) (Silhouette Desire, No 933)",Elizabeth Bevarly,1995,Silhouette
168438,373075286,5,"Mclain'S Law (Premiere) (Silhouette Intimate Moments, No 528)",Kylie Brant,1993,Silhouette
168438,373078595,5,"Roman'S Heart (The Justice Way) (Intimate Moments , No 859)",Sharon Sala,1998,Silhouette
168438,373097921,5,"Building Dreams (Silhouette Special Edition, No 9792)",Nancy Gray,1992,Silhouette
168438,373099592,4,"Stranger In The Family (Silhouette Special Edition, No 959)",Patricia McLinn,1995,Silhouette
168438,373120109,5,"Expectant Mistress  (Expecting) (Harlequin Presents, 2010)",Sara Wood,1999,Harlequin
168438,373196350,10,The Doctor's Pregnant Proposal  (The Thunder Clan),Donna Clayton,2002,Silhouette
168438,373223668,5,"Charmer (Avenging Angels) (Harlequin Intrigue, No 366)",Leona Karr,1996,Harlequin
168438,373224176,5,"Hotshot P I (Lawman) (Harlequin Intrigue, No 417)",B. J. Daniels,1997,Harlequin
168438,373224443,5,"Family Ties (Harlequin Intrigue, No 444)",Joanna Wayne,1997,Harlequin
168438,373225857,5,"Agent'S Secret Child (Texas Confidential) (Intrigue, 585)",B. J. Daniels,2000,Harlequin
168438,373240511,9,"Montana Passion  (That Special Woman/Made In) (Silhouette Special Edition, No 1051)",Jackie Merritt,1996,Silhouette
168438,373242670,9,"Their Other Mother  (That Special Woman/Wilders Of Wyatt County) (Silhouette Special Edition, 1267)",Janis Reams Hudson,1999,Silhouette
168438,373258674,5,"Valentine Fantasy (Fantasy For Hire) (Harlequin Temptation, No. 767)",Jamie Denton,2000,Harlequin
168438,373290276,5,"Last Rogue (Historical , No 427)",Deborah Simmons,1998,Harlequin
168438,373440464,5,"How The West Was Wed (Love and Laughter , No 46)",Jule McBride,1998,Harlequin
168438,373440901,5,"Hot Copy/From Caviar to Chaos (Duets, 24)",Diane Pershing,2000,Harlequin
168438,373440979,5,Three Babies and a Bargain/Baby Bonus? (Harlequin Duets 31),Kate Hoffman,2000,Harlequin
168438,373708505,5,"Safe Haven (Home On The Ranch) (Harlequin Superromance, 850)",Evelyn A. Crowe,1999,Harlequin
168438,373708564,5,"Found:  One Son (Finders Keepers) (Harlequin Superromance, 856)",Caroline Arnold,1999,Harlequin
168438,373708912,5,"Her Best Friend'S Baby (9 Months Later) (Harlequin Superromance, No. 891)",C. J. Carmichael,2000,Harlequin
168438,373709064,5,Woman In The Mirror (Emergency!) (Harlequin Super Romance),Bobby Hutchinson,2000,Harlequin
168438,373762674,5,"Her Forever Man (Man Of The Month) (Silhouette Desire, 1267)",Ronnie Banks,2000,Silhouette
168438,441001467,5,Earth 2: A Novel (Book 1),Melissa Crandall,1994,Ace Books
168438,671722905,7,The TEMPEST,William Shakespeare,1994,Washington Square Press
168438,671759299,5,My Girl: A Novel,Patricia Hermes,1991,Simon Spotlight Entertainment
168438,671880306,5,"The Big Game (Star Trek Deep Space Nine, No 4)",Sandy Schofield,1993,Star Trek
168438,679457143,5,The Cobra Event,Richard Preston,1997,Random House Inc
168438,785807756,4,Identifying Dinosaurs (Identifying Guide Series),Steve Parker,1997,Book Sales
168438,080198775X,5,Robin's Diary,Judith Pinsker,1995,ABC Daytime Press
168438,1577940105,8,"Help Me, I'm Worried!: Overcoming Emotional Battles With the Power of God's Word (Help Me, Series)",Joyce Meyer,1997,Harrison House
168439,385335881,10,Shopaholic Takes Manhattan (Summer Display Opportunity),Sophie Kinsella,2002,Delta
168441,894866370,10,The Language of Letting Go (Hazelden Meditation Series),Melody Beattie,1996,Hazelden Publishing &amp; Educational Services
168442,038071129X,7,The Death of a Joyce Scholar : A Peter McGarr Mystery,Bartholomew Gill,2002,Avon
168442,449223604,8,M Is for Malice,Sue Grafton,1998,Fawcett Books
168442,553800973,8,Body of Lies,IRIS JOHANSEN,2002,Bantam
168442,553802461,8,Dead Aim,IRIS JOHANSEN,2003,Bantam
168444,3442447178,10,Stein und FlÃ?Â¶te. Und das ist noch nicht alles.,Hans Bemmann,2000,Goldmann
168452,393046923,4,The Electrical Field,Kerri Sakamoto,1999,W.W. Norton &amp; Company
168456,345443284,10,While I Was Gone,Sue Miller,1999,Ballantine Books
168456,446612790,4,2nd Chance,James Patterson,2003,Warner Vision
168456,670891592,2,The Second Silence,Eileen Goudge,2000,Viking Books
168456,671776126,5,Plain Truth,Jodi Picoult,2000,Atria
168456,688157483,2,The Body in the Big Apple,Katherine Hall Page,1999,William Morrow &amp; Company
168456,743211375,6,From a Buick 8 : A Novel,Stephen King,2002,Scribner
168460,316115479,4,Arthur's Mystery Envelope : A Mark Brown Arthur Chapter Book #1 (Arthur Chapter Book Series),Marc Brown,1998,"Little, Brown"
168460,316115568,6,Arthur Accused : A Marc Brown Arthur Chapter Book 5 (Arthur Chapter Books),Marc Brown,1998,"Little, Brown"
168460,059060385X,6,The Berenstain Bear Scouts and the Sci-Fi Pizza (Berenstain Bear Scouts (Paperback)),Stan Berenstain,1996,Scholastic
168461,044661193X,8,Basket Case,Carl Hiaasen,2003,Warner Books
168461,743460529,7,Daddy's Little Girl,Mary Higgins Clark,2003,Pocket
168461,743464117,7,"Band of Brothers : E Company, 506th Regiment, 101st Airborne from Normandy to Hitler's Eagle's Nest",Stephen E. Ambrose,2002,Pocket
168463,61098256,7,Eddie's Bastard : A Novel,William Kowalski,2000,Perennial
168463,038079487X,7,What Looks Like Crazy On An Ordinary Day,Pearl Cleage,1998,Perennial
168463,452011876,9,Atlas Shrugged,Ayn Rand,1999,Plume Books
168464,60224657,6,Danny and the Dinosaur (An I Can Read Book),Syd Hoff,1993,HarperCollins Children's Books
168464,64401774,3,More Scary Stories To Tell In The Dark,Alvin Schwartz,1986,HarperTrophy
168464,64405907,9,"Caleb's Story (Sarah, Plain and Tall)",Patricia MacLachlan,2002,HarperTrophy
168464,64407667,10,"The Bad Beginning (A Series of Unfortunate Events, Book 1)",Lemony Snicket,1999,HarperCollins
168464,64407683,7,"The Wide Window (A Series of Unfortunate Events, Book 3)",Lemony Snicket,2000,HarperCollins
168464,64408191,9,Homeless Bird,Gloria Whelan,2001,HarperTrophy
168464,141303522,9,A Long Way from Chicago: A Novel in Stories,Richard Peck,2000,Puffin Books
168464,345340345,7,"1,000 More Jokes for Kids",Michael Kilgarriff,1991,Ballantine Books
168464,380709562,7,"Ramona Quimby, Age 8 (Avon Camelot Books (Paperback))",Beverly Cleary,1992,HarperTrophy
168464,439401372,10,Mcgrowl:  Beware Of Dog,Bob Balaban,2002,Scholastic
168464,440407524,10,Shiloh (Yearling Newbery),Phyllis Reynolds Naylor,1992,Yearling Books
168464,440415454,7,The Wreckers (High Seas Trilogy),Iain Lawrence,1999,Yearling Books
168464,590138014,10,Book of Laughs (The Baby-Sitters Little Sister),Ann M. Martin,1997,Little Apple
168464,590404008,5,Hundred Dresses,Eleanor Estes,0,Scholastic Inc
168464,059043411X,9,Vampires Don't Wear Polka Dots (Adventures of the Bailey School Kids (Paperback)),Debbie Dadey,1997,Scholastic
168464,671469800,4,"Giants, Elves, and Scary Monsters (Which Way Secret Door Books)",R.G. Austin,1983,Pocket Books
168464,679905278,10,"Oh, the Places You'll Go!",Seuss,1990,Random House Books for Young Readers
168464,689859368,9,"The Field Guide (The Spiderwick Chronicles, Book 1)",Tony DiTerlizzi,2003,Simon &amp; Schuster Children's Publishing
168464,689859376,9,"The Seeing Stone (The Spiderwick Chronicles, Book 2)",Tony DiTerlizzi,2003,Simon &amp; Schuster Children's Publishing
168464,842321942,5,Second Chance (Left Behind: The Kids #2),Jerry B. Jenkins,1998,Tyndale House Publishers
168464,1576731928,2,Penny Pear (Fruit Troop Action Board Books),Melody Carlson,1997,Multnomah Publishers
168464,1576731944,2,Peachy Pete (Fruit Troop Action Board Books),Melody Carlson,1997,Multnomah Publishers
168464,1576731979,2,Pineapple Paul (Fruit Troop Action Board Books),Melody Carlson,1997,Multnomah Publishers
168466,345368975,9,Pegasus in Flight,Anne McCaffrey,1991,Del Rey Books
168466,553582755,7,One Door Away from Heaven,Dean R. Koontz,2002,Bantam Books
168474,380707527,7,Almost Golden: Jessica Savitch and the Selling of Television News,Gwenda Blair,1989,Harper Mass Market Paperbacks (Mm)
168478,345468694,8,Blessings,ANNA QUINDLEN,2004,Fawcett Books
168478,373501838,9,Husband In Time (Fortune'S Children),Maggie Shayne,1996,Harlequin
168478,425177750,9,The Celtic Riddle: An Archaeological Mystery (Archaeological Mystery),Lyn Hamilton,2000,Berkley Publishing Group
168478,451192176,8,Murder Can Spook Your Cat: A Desire Shapiro Mystery (Desiree Shapiro Mysteries (Paperback)),Selma Eichler,1998,Signet Book
168478,451202511,8,Murder Can Upset Your Mother: A Desiree Shapiro Mystery (Desiree Shapiro Mysteries (Paperback)),Selma Eichler,2001,Signet Book
168478,743442318,8,The Fortune Teller's Daughter,Susan Wilson,2003,Pocket
168478,778320286,6,Changing Habits (Mira),Debbie Macomber,2004,Mira
168478,786889004,9,Dixie City Jam,James Lee Burke,1995,Hyperion
168478,1401300316,10,The Center of Everything,Laura Moriarty,2003,Hyperion
168482,312872402,10,Kushiel's Avatar (Kushiel's Legacy),Jacqueline Carey,2003,Tor Books
168484,743412761,7,Cameo Lake,Susan Wilson,2001,Atria
168487,037329039X,7,"Harrigan'S Bride (Harlequin Historicals, 439)",Cheryl Reavis,1998,Harlequin
168487,373290403,5,"Warrior'S Passion (Harlequin Historicals, 440)",Molly Moore,1998,Harlequin
168487,373290764,5,"Lady Of The Knight (Harlequin Historical, No. 476)",Tori Phillips,1999,Harlequin
168487,373290772,5,"Winter'S Bride (Harlequin Historical, No. 477)",Catherine Archer,1999,Harlequin
168487,446603929,5,See How They Run,James Patterson,1997,Warner Books
168487,446607711,5,The Simple Truth,David Baldacci,1999,Warner Books
168487,553571818,5,Long After Midnight,IRIS JOHANSEN,1997,Bantam
168489,316096199,10,Lucky : A Memoir,Alice Sebold,2002,Back Bay Books
168490,786807695,8,Son of the Mob,Gordon Korman,2002,Hyperion Books for Children
168491,373706367,8,"Wrong Twin (9 Months) (Harlequin Superromance, No 636)",Rebecca Winters,1995,Harlequin
168499,517881640,5,Organizing for the Creative Person,Dorothy Lehmkuhl,1994,Crown Publishing Group (NY)
168500,140298479,5,Bridget Jones: The Edge of Reason,Helen Fielding,2001,Penguin Books
168500,345319656,8,The Time of the Dark (The Darwath Trilogy Series),Barbara Hambly,1988,Del Rey Books
168500,345445848,8,Big Cherry Holler: A Big Stone Gap Novel (Ballantine Reader's Circle),Adriana Trigiani,2002,Ballantine Books
168500,375725784,3,A Heartbreaking Work of Staggering Genius,Dave Eggers,2001,Vintage Books USA
168500,399145990,8,The River King,Alice Hoffman,2000,Putnam Publishing Group
168500,425184943,7,Blue Diary,Alice Hoffman,2002,Berkley Publishing Group
168500,1558743669,8,"A Child Called \It\"": One Child's Courage to Survive""",Dave Pelzer,1995,Health Communications
168509,140171177,7,The House of Doctor Dee,Peter Ackroyd,1994,Penguin Books
168509,631200991,8,Wittgenstein's Place in Twentieth-Century Analytic Philosophy,P. M. S. Hacker,1996,Blackwell Publishers
168520,3596148707,6,Saras Freunde.,Meg Wolitzer,2001,"Fischer (Tb.), Frankfurt"
168530,446673544,7,Sex &amp; the City,Candace Bushnell,1997,Warner Books
168530,1580622712,8,"Mr. Cheap's New York, 2nd Edition",Michelle Roy Kelly,2000,Adams Media Corporation
168531,316343196,8,Underfoot in show business,Helene Hanff,1980,"Little, Brown"
168531,044990945X,7,A Walk Across France,Miles Morland,1994,Ballantine Books
168535,385335482,10,Confessions of a Shopaholic (Summer Display Opportunity),SOPHIE KINSELLA,2001,Delta
168539,141306084,6,Singenpoo's Secret Weapon,Paul Jennings,2001,Puffin
168542,345294459,8,Chameleon,William Diehl,1988,Ballantine Books
168545,316666343,9,The Lovely Bones: A Novel,Alice Sebold,2002,"Little, Brown"
168545,380873877,5,Wild Bells to the Wild Sky,Laurie McBain,1989,Harper Mass Market Paperbacks (Mm)
168545,451139712,9,The stand,Stephen King,1980,New American Library
168545,451402200,7,Lisbon,Valerie Sherwood,1990,New Amer Library (Mm)
168545,671864173,7,WAITING TO EXHALE,Terry McMillan,1993,Pocket
168545,743418174,9,Good in Bed,Jennifer Weiner,2002,Washington Square Press
168545,821751921,6,Tender Scoundrel,Linda Lang Bartell,1996,Zebra Books
168545,821770764,5,Warrior's Heart (Zebra Historical Romance),Georgina Gentry,2001,Kensington Publishing Corporation
168545,1558177655,7,The Highwayman,Nadine Crenshaw,1993,Pinnacle Books
168549,812533550,10,Ender's Game (Ender Wiggins Saga (Paperback)),Orson Scott Card,1986,Tor Books
168553,1573221643,7,Innocence,Jane Mendelsohn,2000,Riverhead Books
168554,140620648,6,The Adventures of Huckleberry Finn (Penguin Popular Classics),Mark Twain,1994,Penguin Books Ltd
168562,140184961,6,The Heart of the Matter (Twentieth Century Classics),Graham Greene,1991,Penguin Books
168563,140351329,7,Under the Lilacs (Puffin Classics),Louisa May Alcott,1991,Puffin Books
168563,440219507,8,Troubling a Star,Madeleine L'Engle,1995,Laure Leaf
168563,689814763,7,Stalker (danger.com),Jordan Cray,1998,Simon Pulse
168573,312278586,9,The Nanny Diaries: A Novel,Emma McLaughlin,2002,St. Martin's Press
168573,089296507X,9,Fair Game,Rochelle Majer Krich,1993,Mysterious Press
168575,8497597656,5,Un Mundo Mejor,Alberto Vazquez-Figueroa,2003,Debolsillo
168581,034538430X,8,TickTock,Dean R. Koontz,1997,Ballantine Books
168581,515115649,9,The Cat Who Came to Breakfast,Lilian Jackson Braun,1995,Jove Books
168582,886779464,7,Alternate Realities: Port Eternity/Voyager in Night/Wave Without a Shore,C. J. Cherryh,2000,Daw Books
168587,486275507,10,The Road Not Taken and Other Poems (Dover Thrift Editions),Robert Frost,1993,Dover Publications
168590,8420633275,9,Miau,Benito Perez Galdos,1985,Alianza
168590,8437600537,8,Antologia Del Grupo Poetico Del 1927,Vicente Gaos,1984,Grupo Anaya Comercial
168592,440237300,5,Three Weeks in Paris,BARBARA TAYLOR BRADFORD,2002,Dell
168593,671742515,5,Long Dark Tea Time of the Soul,Douglas Adams,1991,Pocket
168600,446611360,5,Point Deception,Marcia Muller,2002,Warner Books
168600,451194047,5,The Canceled Czech: An Evan Tanner Mystery (Evan Tanner Mysteries),Lawrence Block,1999,Signet Book
168601,385326335,10,A Letter to Mrs. Roosevelt,C. COCO DE YOUNG,1999,Delacorte Books for Young Readers
